Golden Nugget (Playstation Ps1 Juego Completo + Casi Nuevo;12,87 EUR;+ 4,48 EUR de envío;Vendidos  12 sep 2021Artículo vendido;desde Estados Unidos;
Golden Nugget (Sony PlayStation 1, 1997) (Completo) (probados);5,97 EUR;Envío gratis;Vendidos  10 sep 2021Artículo vendido;desde Estados Unidos;
PlayStation: Golden Nugget videojuegos;3,27 EUR;Envío gratis;Vendidos  8 sep 2021Artículo vendido;desde Estados Unidos;
Golden Nugget (Sony PlayStation 1, 1997) Completo En Caja Probado PS1 Completa;7,74 EUR;Envío gratis;Vendidos  5 sep 2021Artículo vendido;desde Estados Unidos;
Golden Nugget-PS1 PS2 completa Playstation Game;1,70 EUR;+ 2,54 EUR de envío;Vendidos  2 sep 2021Artículo vendido;desde Estados Unidos;
Golden Nugget-PS1 PS2 disco 1 de 2 solo Playstation Game;2,75 EUR;Envío gratis;Vendidos  28 ago 2021Artículo vendido;desde Estados Unidos;
Golden Nugget-PS1 PS2 disco 2 de 2 solo Playstation Game;2,75 EUR;Envío gratis;Vendidos  28 ago 2021Artículo vendido;desde Estados Unidos;
Golden Nugget (Sony PlayStation 1, 1997) discos de juegos y funda ~ ~ Probado;5,06 EUR;Envío gratis;Vendidos  23 ago 2021Artículo vendido;desde Estados Unidos;
Golden Nugget (Sony PlayStation 1 PS1) * Completo-Probado Y Garantizado *;9,29 EUR;Envío gratis;Vendidos  20 ago 2021Artículo vendido;desde Estados Unidos;
Golden Nugget (Sony PlayStation 1, 1997) disco 1 sólo sin seguimiento ps1;1,94 EUR;Envío gratis;Vendidos  16 ago 2021Artículo vendido;desde Estados Unidos;
Golden Nugget-Sony PlayStation-Completo-Probado-Muy Limpio;6,89 EUR;Envío gratis;Vendidos  3 ago 2021Artículo vendido;desde Estados Unidos;
Golden Nugget, Play Station estilo de juego de casino de Las Vegas;6,89 EUR;+ 2,75 EUR de envío;Vendidos  30 jul 2021Artículo vendido;desde Estados Unidos;
SONY Golden Nugget-PLAYSTATION (PSN021860);6,89 EUR;Envío gratis;Vendidos  14 jul 2021Artículo vendido;desde Estados Unidos;
Golden Nugget para PlayStation 1 PS1 muy buena 5E;5,34 EUR;Envío gratis;Vendidos  13 jul 2021Artículo vendido;desde Estados Unidos;
Caesars Palace, juegos de cartas, Golden Nugget (PlayStation 1) 3 Game Lot-Completo;8,57 EUR;Envío gratis;Vendidos  10 jul 2021Artículo vendido;desde Estados Unidos;
Golden Nugget-Las Vegas Estilo Casino juegos Sony PlayStation PS1 Juego Completo;8,60 EUR;+ 3,44 EUR de envío;Vendidos  6 jul 2021Artículo vendido;desde Estados Unidos;
Sony PlayStation PS1 Video Juego De Casino Lote-Caesars Palace 2 Golden Nugget;15,06 EUR;Envío gratis;Vendidos  4 jul 2021Artículo vendido;desde Estados Unidos;
Golden Nugget Playing Cards USPCC;87,84 EUR;+ 20,13 EUR de envío estimado;Vendidos  25 ago 2021Artículo vendido;desde Reino Unido;
Nintendo 64 N64 NTSC-U USA-Golden Nugget;23,06 EUR;+ 16,64 EUR de envío estimado;Vendidos  16 sep 2021Artículo vendido;desde Reino Unido;
