Darkstalkers Chronicle el caos Torre Sony PSP Juego PlayStation Portable;15,75 EUR;Envío no especificado;Vendidos  2 oct 2021Artículo vendido;desde Reino Unido;
PS1-Darkstalkers en Caja Con Manual (sin cubierta frontal) - Sony PlayStation 1;35,01 EUR;+ 21,11 EUR de envío estimado;Vendidos  26 sep 2021Artículo vendido;desde Reino Unido;
Darkstalkers ps1 PlayStation 1 PSX cib pal UE;89,90 EUR;+ 10,00 EUR de envío;Vendidos  24 sep 2021Artículo vendido;desde Alemania;
Videogioco Darkstalkers: The Night Warriors PS1 PlayStation 1 PAL;60,00 EUR;Envío no especificado;Vendidos  10 sep 2021Artículo vendido;desde Italia;
Darkstalkers 3 - SONY Playstation 1 PS1 - PAL ;100,00 EUR;+ 9,00 EUR de envío;Vendidos  8 sep 2021Artículo vendido;desde Francia;
Darkstalkers 3 para SONY PLAYSTATION 1 PS1 rara completa en en muy buena condición Capcom;75,88 EUR;+ 19,84 EUR de envío;Vendidos  14 ago 2021Artículo vendido;desde Reino Unido;
Darkstalkers 3 PS1 Playstation 1 videojuego Muy Buen Estado;69,99 EUR;+ 25,29 EUR de envío estimado;Vendidos  6 ago 2021Artículo vendido;desde Reino Unido;
Darkstalkers 3 Capcom (PlayStation 1/PS1 1998) Muy Raro!!! Cartucho Completo En Caja Ln;103,47 EUR;Envío gratis;Vendidos  2 oct 2021Artículo vendido;desde Estados Unidos;
Darkstalkers la noche guerreros Sony PlayStation 1 PS1 Luchadores Edge;137,96 EUR;Envío gratis;Vendidos  2 oct 2021Artículo vendido;desde Estados Unidos;
Raro Darkstalkers 3 Completo PlayStation 1 PS1 juego con el registro M/Probado Casi Nuevo;116,37 EUR;Envío gratis;Vendidos  2 oct 2021Artículo vendido;desde Estados Unidos;
Vampiro Darkstalkers Colección Playstation 2 japonés Importado PS2 de Japón;48,27 EUR;Envío internacional gratis;Vendidos  30 sep 2021Artículo vendido;desde Japón;
Darkstalkers 3 Playstation 1 PS1 jugador sugerencia Libro Guía De Estrategia;60,32 EUR;Envío gratis;Vendidos  30 sep 2021Artículo vendido;desde Estados Unidos;
Darkstalkers: la noche Warriors (Sony PlayStation 1, 1996);51,73 EUR;Envío gratis;Vendidos  29 sep 2021Artículo vendido;desde Estados Unidos;
Darkstalkers: la noche guerreros Sony PlayStation PS1 Longbox no manual Capcom;59,50 EUR;+ 5,17 EUR de envío;Vendidos  29 sep 2021Artículo vendido;desde Estados Unidos;
Darkstalkers 3 (Sony PlayStation 1, 1998);73,30 EUR;+ 3,08 EUR de envío;Vendidos  28 sep 2021Artículo vendido;desde Estados Unidos;
Darkstalkers: la noche Warriors (Sony PlayStation 1, 1996), probado Caja Larga;77,61 EUR;+ 4,79 EUR de envío;Vendidos  24 sep 2021Artículo vendido;desde Estados Unidos;
Vampiro Darkstalkers Colección Playstation 2 japonés Importado PS2 JP Vendedor de Estados Unidos;43,11 EUR;Envío gratis;Vendidos  19 sep 2021Artículo vendido;desde Estados Unidos;
Darkstalkers 3 PlayStation PS1-disco solamente-sin Portada;43,12 EUR;Envío gratis;Vendidos  18 sep 2021Artículo vendido;desde Estados Unidos;
PS2 Vampiro Darkstalkers Colección PlayStation 2 Capcom Japón Importación;57,75 EUR;Envío internacional gratis;Vendidos  17 sep 2021Artículo vendido;desde Japón;
Darkstalkers Chronicle el caos Tower (Sony PlayStation Portable, 2005) PSP;11,99 EUR;Envío gratis;Vendidos  17 sep 2021Artículo vendido;desde Estados Unidos;
PS3 Vampiro Darkstalkers resurrección Playstation 3 CAPCOM Sony de Japón;55,19 EUR;Envío internacional gratis;Vendidos  15 sep 2021Artículo vendido;desde Japón;
PS3 Vampiro Darkstalkers resurrección región libre Playstation 3 Japón Importación;67,86 EUR;Envío internacional gratis;Vendidos  15 sep 2021Artículo vendido;desde Japón;
Darkstalkers 3 (PlayStation 1 PS1) Nuevo Sellado, Negro Etiqueta!;301,81 EUR;+ 4,87 EUR de envío;Vendidos  13 sep 2021Artículo vendido;desde Estados Unidos;
Darkstalkers: la noche guerreros Sony PlayStation PS1 Longbox no manual Capcom;51,74 EUR;+ 4,31 EUR de envío;Vendidos  12 sep 2021Artículo vendido;desde Estados Unidos;
Darkstalkers la noche Warriors (Sony PlayStation 1, 1996 PS1) Disco Solamente, Probado;38,76 EUR;Envío gratis;Vendidos  12 sep 2021Artículo vendido;desde Estados Unidos;
PS3 Vampiro Darkstalkers resurrección Playstation 3 CAPCOM Sony de Japón;55,19 EUR;Envío internacional gratis;Vendidos  11 sep 2021Artículo vendido;desde Japón;
Darkstalkers la noche en Caja De Cartucho De Caja De largo Warriors (Sony PlayStation 1,1996) PS1;107,79 EUR;+ 8,71 EUR de envío;Vendidos  10 sep 2021Artículo vendido;desde Estados Unidos;
Darkstalkers 3-Playstation 1 PS1 Manual sólo ningún juego!;30,17 EUR;+ 3,45 EUR de envío;Vendidos  6 sep 2021Artículo vendido;desde Estados Unidos;
Vampiro Darkstalkers Colección capcole PS2 Capcom Sony PlayStation 2 de Japón;33,16 EUR;+ 12,50 EUR de envío;Vendidos  6 sep 2021Artículo vendido;desde Japón;
Vampire Resurrection [a.k.a. Darkstalkers] - Japan import (Playstation 3 PS3);40,78 EUR;+ 8,13 EUR de envío;Vendidos  4 sep 2021Artículo vendido;desde Canadá;
Darkstalkers Chronicle: el caos Tower (Sony PSP, 2005) Completo!!! Playstation;38,80 EUR;Envío gratis;Vendidos  4 sep 2021Artículo vendido;desde Estados Unidos;
Darkstalkers la noche en Caja De Cartucho De Caja De largo Warriors (Sony PlayStation 1,1996) PS1;115,55 EUR;+ 13,11 EUR de envío;Vendidos  4 sep 2021Artículo vendido;desde Estados Unidos;
Vampiro Darkstalkers Colección-Sony Playstation 2 PS2 NTSC-J Jp Nuevo Y Sellado;146,55 EUR;+ 17,25 EUR de envío;Vendidos  3 sep 2021Artículo vendido;desde Taiwán;
Darkstalkers: la noche guerreros Playstation 1 (PSX) Disco Solamente, Buen Estado;53,46 EUR;Envío gratis;Vendidos  3 sep 2021Artículo vendido;desde Estados Unidos;
Vampiro Darkstalkers Colección mejor Playstation 2 japonés Importado PS2 Vendedor de Estados Unidos;50,01 EUR;Envío gratis;Vendidos  30 ago 2021Artículo vendido;desde Estados Unidos;
Darkstalkers 3 (Sony PlayStation 1, 1998) Disco Solamente;43,11 EUR;+ 4,18 EUR de envío;Vendidos  29 ago 2021Artículo vendido;desde Estados Unidos;
Darkstalkers: la noche guerreros Playstation 1 PS1 Longbox, dañado caso/disco;86,23 EUR;Envío gratis;Vendidos  29 ago 2021Artículo vendido;desde Estados Unidos;
Darkstalkers: la noche Warriors (Sony PlayStation 1, 1996) Completo;116,37 EUR;Envío gratis;Vendidos  28 ago 2021Artículo vendido;desde Estados Unidos;
Darkstalkers 3-PlayStation 1 PS1-disco solamente;43,11 EUR;+ 3,45 EUR de envío;Vendidos  26 ago 2021Artículo vendido;desde Estados Unidos;
PS1 Darkstalkers 3 (Sony PlayStation 1, 1998) COMPLETO CAPCOM leer descripción;86,23 EUR;Envío gratis;Vendidos  24 ago 2021Artículo vendido;desde Estados Unidos;
Darkstalkers: la noche Warriors (Sony PlayStation 1, 1996) Disco Solamente;46,57 EUR;+ 4,14 EUR de envío;Vendidos  24 ago 2021Artículo vendido;desde Estados Unidos;
Darkstalkers 3 PlayStation PS1 Original Black Label Nuevo Sellado Juego + Lote de guía;326,82 EUR;Envío gratis;Vendidos  24 ago 2021Artículo vendido;desde Estados Unidos;
Sony Playstation Darkstalkers 3 Caja Completa Manual Instrucciones Capcom PS1 PSX;112,10 EUR;Envío gratis;Vendidos  23 ago 2021Artículo vendido;desde Estados Unidos;
PS2 Vampiro Darkstalkers Colección PlayStation 2 Capcom Japón;68,12 EUR;Envío internacional gratis;Vendidos  22 ago 2021Artículo vendido;desde Japón;
PS3 Vampiro Darkstalkers resurrección Playstation 3 CAPCOM Sony de Japón;55,19 EUR;Envío internacional gratis;Vendidos  21 ago 2021Artículo vendido;desde Japón;
Darkstalkers 3 PS1 reproducción caso ningún disco-rápido envío!!!;11,21 EUR;Envío gratis;Vendidos  17 ago 2021Artículo vendido;desde Estados Unidos;
Revista PSM Playstation #14 de octubre de 1998, Legacy of Kain Darkstalkers 3;17,22 EUR;+ 2,75 EUR de envío;Vendidos  17 ago 2021Artículo vendido;desde Estados Unidos;
Darkstalkers la noche en Caja De Cartucho De Caja De largo Warriors (Sony PlayStation 1,1996) PS1;120,72 EUR;+ 7,11 EUR de envío;Vendidos  17 ago 2021Artículo vendido;desde Estados Unidos;
Darkstalkers 3 (Sony PlayStation 1 PS1) Disco Solamente probado trabajando-buenas Condiciones;55,97 EUR;+ 3,45 EUR de envío;Vendidos  15 ago 2021Artículo vendido;desde Estados Unidos;
Vampiro Darkstalkers resurrección Sony Play Station 3 Ps3 Capcom de Japón;80,19 EUR;Envío internacional gratis;Vendidos  15 ago 2021Artículo vendido;desde Japón;
Vampiro Darkstalkers Collection (Sony PlayStation 2). Japón. Nueva. PS2;94,86 EUR;Envío gratis;Vendidos  13 ago 2021Artículo vendido;desde Estados Unidos;
Darkstalkers: la noche guerreros PlayStation 1 largo Caja Excelente disco completo;86,22 EUR;Envío gratis;Vendidos  11 ago 2021Artículo vendido;desde Estados Unidos;
