PS1-Darkstalkers en Caja Con Manual (sin cubierta frontal) - Sony PlayStation 1;34,77 EUR;+ 20,96 EUR de envío estimado;Vendidos  26 sep 2021Artículo vendido;desde Reino Unido;
Darkstalkers ps1 PlayStation 1 PSX cib pal UE;89,90 EUR;+ 10,00 EUR de envío;Vendidos  24 sep 2021Artículo vendido;desde Alemania;
Videogioco Darkstalkers: The Night Warriors PS1 PlayStation 1 PAL;60,00 EUR;Envío no especificado;Vendidos  10 sep 2021Artículo vendido;desde Italia;
Darkstalkers 3 - SONY Playstation 1 PS1 - PAL ;100,00 EUR;+ 9,00 EUR de envío;Vendidos  8 sep 2021Artículo vendido;desde Francia;
Darkstalkers 3 para SONY PLAYSTATION 1 PS1 rara completa en en muy buena condición Capcom;75,35 EUR;+ 19,70 EUR de envío;Vendidos  14 ago 2021Artículo vendido;desde Reino Unido;
Darkstalkers 3 PS1 Playstation 1 videojuego Muy Buen Estado;69,51 EUR;+ 25,11 EUR de envío estimado;Vendidos  6 ago 2021Artículo vendido;desde Reino Unido;
Darkstalkers: la noche Warriors (Sony PlayStation 1, 1996);51,39 EUR;Envío gratis;Vendidos  29 sep 2021Artículo vendido;desde Estados Unidos;
Darkstalkers: la noche guerreros Sony PlayStation PS1 Longbox no manual Capcom;59,11 EUR;+ 5,14 EUR de envío;Vendidos  29 sep 2021Artículo vendido;desde Estados Unidos;
Darkstalkers 3 (Sony PlayStation 1, 1998);72,81 EUR;+ 3,06 EUR de envío;Vendidos  28 sep 2021Artículo vendido;desde Estados Unidos;
Darkstalkers: la noche Warriors (Sony PlayStation 1, 1996), probado Caja Larga;77,10 EUR;+ 4,75 EUR de envío;Vendidos  24 sep 2021Artículo vendido;desde Estados Unidos;
Vampiro Darkstalkers Colección Playstation 2 japonés Importado PS2 JP Vendedor de Estados Unidos;42,82 EUR;Envío gratis;Vendidos  19 sep 2021Artículo vendido;desde Estados Unidos;
Darkstalkers 3 PlayStation PS1-disco solamente-sin Portada;42,83 EUR;Envío gratis;Vendidos  18 sep 2021Artículo vendido;desde Estados Unidos;
PS2 Vampiro Darkstalkers Colección PlayStation 2 Capcom Japón Importación;57,37 EUR;Envío internacional gratis;Vendidos  17 sep 2021Artículo vendido;desde Japón;
Darkstalkers Chronicle el caos Tower (Sony PlayStation Portable, 2005) PSP;11,91 EUR;Envío gratis;Vendidos  17 sep 2021Artículo vendido;desde Estados Unidos;
PS3 Vampiro Darkstalkers resurrección Playstation 3 CAPCOM Sony de Japón;54,83 EUR;Envío internacional gratis;Vendidos  15 sep 2021Artículo vendido;desde Japón;
PS3 Vampiro Darkstalkers resurrección región libre Playstation 3 Japón Importación;67,41 EUR;Envío internacional gratis;Vendidos  15 sep 2021Artículo vendido;desde Japón;
Darkstalkers 3 (PlayStation 1 PS1) Nuevo Sellado, Negro Etiqueta!;299,82 EUR;+ 4,84 EUR de envío;Vendidos  13 sep 2021Artículo vendido;desde Estados Unidos;
Darkstalkers: la noche guerreros Sony PlayStation PS1 Longbox no manual Capcom;51,40 EUR;+ 4,28 EUR de envío;Vendidos  12 sep 2021Artículo vendido;desde Estados Unidos;
Darkstalkers la noche Warriors (Sony PlayStation 1, 1996 PS1) Disco Solamente, Probado;38,51 EUR;Envío gratis;Vendidos  12 sep 2021Artículo vendido;desde Estados Unidos;
PS3 Vampiro Darkstalkers resurrección Playstation 3 CAPCOM Sony de Japón;54,83 EUR;Envío internacional gratis;Vendidos  11 sep 2021Artículo vendido;desde Japón;
Darkstalkers la noche en Caja De Cartucho De Caja De largo Warriors (Sony PlayStation 1,1996) PS1;107,08 EUR;+ 8,65 EUR de envío;Vendidos  10 sep 2021Artículo vendido;desde Estados Unidos;
Darkstalkers 3-Playstation 1 PS1 Manual sólo ningún juego!;29,97 EUR;+ 3,43 EUR de envío;Vendidos  6 sep 2021Artículo vendido;desde Estados Unidos;
Vampiro Darkstalkers Colección capcole PS2 Capcom Sony PlayStation 2 de Japón;33,19 EUR;+ 12,42 EUR de envío;Vendidos  6 sep 2021Artículo vendido;desde Japón;
Vampire Resurrection [a.k.a. Darkstalkers] - Japan import (Playstation 3 PS3);40,43 EUR;+ 8,06 EUR de envío;Vendidos  4 sep 2021Artículo vendido;desde Canadá;
Darkstalkers Chronicle: el caos Tower (Sony PSP, 2005) Completo!!! Playstation;38,54 EUR;Envío gratis;Vendidos  4 sep 2021Artículo vendido;desde Estados Unidos;
Darkstalkers la noche en Caja De Cartucho De Caja De largo Warriors (Sony PlayStation 1,1996) PS1;114,79 EUR;+ 13,02 EUR de envío;Vendidos  4 sep 2021Artículo vendido;desde Estados Unidos;
Vampiro Darkstalkers Colección-Sony Playstation 2 PS2 NTSC-J Jp Nuevo Y Sellado;145,59 EUR;+ 17,13 EUR de envío;Vendidos  3 sep 2021Artículo vendido;desde Taiwán;
Darkstalkers: la noche guerreros Playstation 1 (PSX) Disco Solamente, Buen Estado;53,10 EUR;Envío gratis;Vendidos  3 sep 2021Artículo vendido;desde Estados Unidos;
Vampiro Darkstalkers Colección mejor Playstation 2 japonés Importado PS2 Vendedor de Estados Unidos;49,68 EUR;Envío gratis;Vendidos  30 ago 2021Artículo vendido;desde Estados Unidos;
Darkstalkers 3 (Sony PlayStation 1, 1998) Disco Solamente;42,82 EUR;+ 4,15 EUR de envío;Vendidos  29 ago 2021Artículo vendido;desde Estados Unidos;
Darkstalkers: la noche guerreros Playstation 1 PS1 Longbox, dañado caso/disco;85,66 EUR;Envío gratis;Vendidos  29 ago 2021Artículo vendido;desde Estados Unidos;
Darkstalkers: la noche Warriors (Sony PlayStation 1, 1996) Completo;115,60 EUR;Envío gratis;Vendidos  28 ago 2021Artículo vendido;desde Estados Unidos;
Darkstalkers 3-PlayStation 1 PS1-disco solamente;42,82 EUR;+ 3,43 EUR de envío;Vendidos  26 ago 2021Artículo vendido;desde Estados Unidos;
PS1 Darkstalkers 3 (Sony PlayStation 1, 1998) COMPLETO CAPCOM leer descripción;85,66 EUR;Envío gratis;Vendidos  24 ago 2021Artículo vendido;desde Estados Unidos;
Darkstalkers: la noche Warriors (Sony PlayStation 1, 1996) Disco Solamente;46,26 EUR;+ 4,11 EUR de envío;Vendidos  24 ago 2021Artículo vendido;desde Estados Unidos;
Darkstalkers 3 PlayStation PS1 Original Black Label Nuevo Sellado Juego + Lote de guía;324,67 EUR;Envío gratis;Vendidos  24 ago 2021Artículo vendido;desde Estados Unidos;
Sony Playstation Darkstalkers 3 Caja Completa Manual Instrucciones Capcom PS1 PSX;111,36 EUR;Envío gratis;Vendidos  23 ago 2021Artículo vendido;desde Estados Unidos;
PS2 Vampiro Darkstalkers Colección PlayStation 2 Capcom Japón;67,67 EUR;Envío internacional gratis;Vendidos  22 ago 2021Artículo vendido;desde Japón;
PS3 Vampiro Darkstalkers resurrección Playstation 3 CAPCOM Sony de Japón;54,83 EUR;Envío internacional gratis;Vendidos  21 ago 2021Artículo vendido;desde Japón;
Darkstalkers 3 PS1 reproducción caso ningún disco-rápido envío!!!;11,14 EUR;Envío gratis;Vendidos  17 ago 2021Artículo vendido;desde Estados Unidos;
Revista PSM Playstation #14 de octubre de 1998, Legacy of Kain Darkstalkers 3;17,11 EUR;+ 2,73 EUR de envío;Vendidos  17 ago 2021Artículo vendido;desde Estados Unidos;
Darkstalkers la noche en Caja De Cartucho De Caja De largo Warriors (Sony PlayStation 1,1996) PS1;119,92 EUR;+ 7,07 EUR de envío;Vendidos  17 ago 2021Artículo vendido;desde Estados Unidos;
Darkstalkers 3 (Sony PlayStation 1 PS1) Disco Solamente probado trabajando-buenas Condiciones;55,60 EUR;+ 3,43 EUR de envío;Vendidos  15 ago 2021Artículo vendido;desde Estados Unidos;
Vampiro Darkstalkers resurrección Sony Play Station 3 Ps3 Capcom de Japón;79,66 EUR;Envío internacional gratis;Vendidos  15 ago 2021Artículo vendido;desde Japón;
Vampiro Darkstalkers Collection (Sony PlayStation 2). Japón. Nueva. PS2;94,23 EUR;Envío gratis;Vendidos  13 ago 2021Artículo vendido;desde Estados Unidos;
Darkstalkers: la noche guerreros PlayStation 1 largo Caja Excelente disco completo;85,66 EUR;Envío gratis;Vendidos  11 ago 2021Artículo vendido;desde Estados Unidos;
Darkstalkers 3 (Sony PlayStation 1, 1998) * COMPLETO *;67,63 EUR;+ 2,48 EUR de envío;Vendidos  11 ago 2021Artículo vendido;desde Estados Unidos;
Auténtico Sony Playstation PS1 Psone Capcom Darkstalkers 3 Disco Con Manual! Raro!;100,50 EUR;Envío gratis;Vendidos  10 ago 2021Artículo vendido;desde Estados Unidos;
Darkstalkers 3 por Capcom completa (Sony Playstation 1) PS1 juego Dark Stalkers;72,81 EUR;+ 4,20 EUR de envío;Vendidos  10 ago 2021Artículo vendido;desde Estados Unidos;
Darkstalkers: la noche Warriors (PlayStation PS1, 1996) Disco Solamente probado;47,12 EUR;Envío gratis;Vendidos  9 ago 2021Artículo vendido;desde Estados Unidos;
