Initial D Extreme Stage The Best - Sony Playstation 3 PS3 - NTSC-J JAP JAPAN;49,90 EUR;+ 4,90 EUR de envío;desde Francia;
SONY PS1 Playstation - Initial D - THE BEST Versión JAPÓN con SPINE CARD;22,90 EUR;+ 17,90 EUR de envío;desde España;
SONY PLAYSTATION 2 PS2 - Initial D Special Stage - JAPAN VERSION SEGA;32,90 EUR;+ 17,90 EUR de envío;desde España;
Initial D - Playstation PS1 JAP Japan complet;18,90 EUR;+ 11,00 EUR de envío;desde Francia;
Initial D Juego Playstation 2 especial etapa Rara Completa Excelente Disco;35,01 EUR;+ 17,02 EUR de envío estimado;desde Reino Unido;
Initial D Extreme Stage - Sony Playstation 3 PS3 - NTSC-J JAP JAPAN - Near Mint;59,90 EUR;+ 4,90 EUR de envío;desde Francia;
Initial D Street etapa PlayStation Portable versión japonesa Psp;21,56 EUR;+ 5,09 EUR de envío;desde Estados Unidos;
PS3 Wangan medianoche & Initial D Set Japón PlayStation 3;83,63 EUR;+ 17,25 EUR de envío;desde Japón;
Initial D mejor Playstation 1 japonés de importación Japón jp PS1 JPN región Vendedor de Estados Unidos;22,41 EUR;Envío gratis;desde Estados Unidos;
Initial D Extreme etapa SEGA PS3 Playstation 3 de Japón;33,49 EUR;+ 8,19 EUR de envío;desde Japón;
Initial D PS1 Playstation 1 Japón importación Super Limpio vendedor de EE. UU. limpio con la columna;28,45 EUR;+ 3,44 EUR de envío;desde Estados Unidos;
Initial D Extreme etapa mejor Playstation 3 japonés Importado PS3 Japón vendedor de EE. UU. B;49,14 EUR;Envío gratis;desde Estados Unidos;
Initial D Playstation 1 japonés de importación Japón jp PS1 JPN región Vendedor de Estados Unidos;23,27 EUR;Envío gratis;desde Estados Unidos;
Initial D entrenador de mecanografía * Playstation 2 * PS2 Japón Takahashi Ryosuke no escribir;110,37 EUR;Envío gratis;desde Estados Unidos;
Initial D Extreme etapa mejor Playstation 3 japonés Importado PS3 Japón un vendedor de Estados Unidos;50,01 EUR;Envío gratis;desde Estados Unidos;
Initial D con SC Playstation 1 PS1 japonés Importado PS JP Racing Japan US Seller B;25,86 EUR;Envío gratis;desde Estados Unidos;
Initial D especial etapa Playstation 2 japonés de importación Japón jp PS2 US Seller B;28,45 EUR;Envío gratis;desde Estados Unidos;
PS1 Initial D PlayStation 1;11,01 EUR;+ 3,45 EUR de envío;desde Japón;
PS3 Initial D: Extreme etapa PlayStation 3 el mejor juego de importación de Japón;41,37 EUR;Envío internacional gratis;desde Japón;
PS2 Initial D especial etapa PlayStation 2 SEGA Juegos Importado De Japón;19,29 EUR;Envío internacional gratis;desde Japón;
Initial D Extreme etapa Playstation 3 japonés Importado PS3 Japón un vendedor de Estados Unidos;56,04 EUR;Envío gratis;desde Estados Unidos;
Initial D Street etapa Wangan medianoche archivo PSP PlayStation Portable UMD Japón;86,06 EUR;Envío internacional gratis;desde Japón;
PlayStation PS2 Initial D + Usado PS3 Reversible Chaqueta Initial D 2 juego japonés;38,63 EUR;+ 8,62 EUR de envío;desde Japón;
Initial D Extreme etapa SEGA 3 PS 3 Coche Play Station Acción;35,35 EUR;Envío internacional gratis;desde Japón;
Ps2 Initial D especial etapa 2 de Japón Juego Station;12,06 EUR;+ 8,19 EUR de envío;desde Japón;
PSP PlayStation Portable Initial D Usado calle etapa juego suave de 00113 Japón Importación;27,16 EUR;+ 3,62 EUR de envío;desde Japón;
PS2 Initial D especial etapa probado funciona desde Japón Anime Usado PlayStation 2;21,55 EUR;Envío internacional gratis;desde Japón;
Initial D Extreme etapa Playstation 3 japonés de importación Japón jp PS3 US Seller B;53,46 EUR;Envío gratis;desde Estados Unidos;
PS2 PlayStation 2 Initial D Usado: etapa especial (idioma/japonés);15,52 EUR;+ 6,90 EUR de envío;desde Japón;
PlayStation 3 PS3 Initial D Extreme etapa + Wangan medianoche 2 juego japonés;64,72 EUR;+ 12,93 EUR de envío;desde Japón;
Usado SONY PlayStation Portable PSP Initial D Street etapa versión japonesa;21,39 EUR;+ 8,62 EUR de envío;desde Japón;
PlayStation 2 Initial D especial Stage & Wangan medianoche 2 Juegos Japón importación PS2;65,53 EUR;Envío internacional gratis;desde Japón;
Initial D Extreme etapa Playstation 3 japonés de importación Japón jp PS3 Vendedor de Estados Unidos;56,05 EUR;+ 4,31 EUR de envío;desde Estados Unidos;
PS3 Initial D Extreme etapa SEGA Juegos PlayStation 3 de Japón Usado;31,08 EUR;+ 3,45 EUR de envío;desde Japón;
Initial D Extreme etapa SEGA 3 PS 3 el Play Station mejor acción de coche;30,17 EUR;Envío internacional gratis;desde Japón;
PS3 Wangan medianoche & Initial D Set Japón PlayStation 3;80,17 EUR;+ 8,62 EUR de envío;desde Japón;
PSP Initial D caso Manual de etapa de calle completa japonés Playstation Sega Sony;34,49 EUR;Envío internacional gratis;desde Japón;
Nuevo anuncioInitial D mejor Playstation 1 japonés de importación Japón jp PS1 JPN;27,59 EUR;Envío gratis;desde Estados Unidos;
PS3 Initial D Extreme etapa Reversible Sony PlayStation 3 Chaqueta Japón Usado;38,80 EUR;+ 6,04 EUR de envío;desde Japón;
Juego Completo De ~ ~ Initial D: etapa extrema (Sony PlayStation 3 importación, 2008).;50,83 EUR;Envío gratis;desde Estados Unidos;
Initial D Playstation 1 PS1 japonés Importado PS JP Racing Japan B-Vendedor de Estados Unidos;22,41 EUR;Envío gratis;desde Estados Unidos;
PS2 Initial D especial etapa PlayStation 2 SEGA Juegos Playstation 2 de Japón F/S;43,11 EUR;Envío internacional gratis;desde Japón;
Initial D PS1 Playstation 1 Japón importación N. Menta/Buen vendedor de Estados Unidos;27,92 EUR;+ 2,59 EUR de envío;desde Estados Unidos;
Sony PSP Japón Initial D Usado calle etapa Psp el mejor PlayStation Portable;23,27 EUR;+ 11,21 EUR de envío;desde Japón;
Initial D Extreme etapa SEGA 3 PS 3 Coche Play Station Juego De Acción;40,52 EUR;Envío internacional gratis;desde Japón;
Initial D Extreme etapa mejor Playstation 3-US SELLER! PS3 Importado Japonés;44,83 EUR;+ 5,13 EUR de envío;desde Estados Unidos;
SONY PS2 Japón Initial D etapa especial con Mascota Correa PlayStation 2 NTSC-J;43,11 EUR;+ 17,25 EUR de envío;desde Japón;
Usado SONY PlayStation 2 PS2 Initial D etapa especial + Kaido batalla 2 juego japonés;24,84 EUR;+ 8,62 EUR de envío;desde Japón;
Sony PSP Japón Initial D Usado calle etapa de Japón PlayStation Portable;29,31 EUR;+ 11,21 EUR de envío;desde Japón;
PSP Initial D Street etapa PlayStation Portable versión japonesa. el Mejor PSP.;23,28 EUR;+ 6,04 EUR de envío;desde Japón;
Initial D Kodo Saisoku Densetsu con Pegatina-Sega Saturn-Japón JPN-Completo;36,71 EUR;+ 17,06 EUR de envío estimado;desde Reino Unido;
