ATV Racers (Sony PlayStation 1) PS1 Libre P&P;5,27 EUR;+ 16,54 EUR de envío estimado;Vendidos  22 sep 2021Artículo vendido;desde Reino Unido;
ATV Racers (PlayStation PS1) - disco solamente;3,63 EUR;Envío gratis;Vendidos  14 sep 2021Artículo vendido;desde Estados Unidos;
Raro-ATV Racers (Sony PlayStation 1 PS1, 2003), nuevo Sellado De Fábrica;11,96 EUR;+ 4,26 EUR de envío;Vendidos  5 sep 2021Artículo vendido;desde Estados Unidos;
ATV Racers (Sony PlayStation 1 PS1, 2003), nuevo Sellado De Fábrica;12,72 EUR;+ 4,10 EUR de envío;Vendidos  6 ago 2021Artículo vendido;desde Estados Unidos;
ATV Racers Para Sony PlayStation-Completo;2,98 EUR;+ 4,27 EUR de envío;Vendidos  23 jul 2021Artículo vendido;desde Estados Unidos;
Sony PlayStation PS1 | ATV Racers | Negro Etiqueta Probado;5,98 EUR;+ 4,15 EUR de envío;Vendidos  11 jul 2021Artículo vendido;desde Estados Unidos;
Hombres del Ejército: guerra Mundial, cabrestante ATV Racers, & Largo Playstation 1 Lote, PS1-probado!;17,08 EUR;Envío gratis;Vendidos  3 jul 2021Artículo vendido;desde Estados Unidos;
