Cardcaptor Sakura animetic historia SC Playstation 1 japonés Importado PS1 Vendedor de Estados Unidos;22,43 EUR;Envío gratis;Vendidos  27 sep 2021Artículo vendido;desde Estados Unidos;
PS1 PS PlayStation Tetris con Usado Cardcaptor Sakura eterno corazón Japón Importación;20,83 EUR;Envío internacional gratis;Vendidos  23 sep 2021Artículo vendido;desde Japón;
PS1 PlayStation 1 Tetris con Usado Cardcaptor Sakura eterno Corazón;24,16 EUR;+ 6,90 EUR de envío;Vendidos  23 sep 2021Artículo vendido;desde Japón;
Tetris con Cardcaptor Sakura Playstation 1 japonés Importado PS1 Japón Vendedor de Estados Unidos;32,78 EUR;Envío gratis;Vendidos  16 sep 2021Artículo vendido;desde Estados Unidos;
PS1 PS PlayStation 1 Tetris Usado Con Cardcaptor Sakura eterno corazón 00044 Japón;24,36 EUR;+ 3,62 EUR de envío;Vendidos  28 ago 2021Artículo vendido;desde Japón;
Animetic historia juego 1: Cardcaptor Sakura (Sony Playstation, 1999) de Japón;8,02 EUR;+ 6,04 EUR de envío;Vendidos  1 ago 2021Artículo vendido;desde Japón;
UK FuRyu Cardcaptor Sakura Clear Card Arc Dream Wand 50cm Card Captor Japan NEW;63,99 EUR;+ 22,19 EUR de envío estimado;Vendidos  26 ago 2021Artículo vendido;desde Reino Unido;
Anime Cardcaptor Sakura Sakura Kinomoto Dakimakura Hugging Body Funda de Almohada 59";23,46 EUR;Envío internacional gratis;Vendidos  12 sep 2021Artículo vendido;desde China;
Abrazadera de Japón: Cardcaptor Sakura: claro tarjeta gallina Anime Libro De Arranque;30,20 EUR;Envío internacional gratis;Vendidos  27 sep 2021Artículo vendido;desde Japón;
Original Trendmasters Special Edition Cardcaptor Sakura Clow Cards & Book;186,09 EUR;+ 43,56 EUR de envío estimado;Vendidos  28 jul 2021Artículo vendido;desde Reino Unido;
Sega Cardcaptor Sakura Claro Tarjeta Ed Premium Figura "Sakura Kinomoto" Japón;53,74 EUR;+ 21,57 EUR de envío;Vendidos  5 ago 2021Artículo vendido;desde Japón;
Nuevo Anime Cardcaptor Sakura Llaveros Llavero Llavero Colección Cosplay Regalos;7,67 EUR;+ 3,02 EUR de envío;Vendidos  7 ago 2021Artículo vendido;desde China;
Cardcaptor Sakura Kinomoto Rubber Keychain Official ;6,98 EUR;+ 17,57 EUR de envío estimado;Vendidos  25 jul 2021Artículo vendido;desde Reino Unido;
Cardcaptor Sakura Star wand Key Chain Official ;5,82 EUR;+ 17,56 EUR de envío estimado;Vendidos  20 sep 2021Artículo vendido;desde Reino Unido;
Japón Cardcaptor Sakura-Claro Tarjeta Arc-piano solista álbum (piano libro de puntuación);44,78 EUR;Envío internacional gratis;Vendidos  7 sep 2021Artículo vendido;desde Japón;
Cardcaptor Sakura Syaoran Li Pen Case;8,14 EUR;+ 17,59 EUR de envío estimado;Vendidos  28 jul 2021Artículo vendido;desde Reino Unido;
Cardcaptor Sakura Kinomoto Suction Cup Window Decoration Official ;9,31 EUR;+ 18,28 EUR de envío estimado;Vendidos  21 jul 2021Artículo vendido;desde Reino Unido;
Cardcaptor Sakura Kinomoto Small Clear File Official Cerberus kero;6,98 EUR;+ 17,57 EUR de envío estimado;Vendidos  15 ago 2021Artículo vendido;desde Reino Unido;
Cardcaptor Sakura Pencil Board Official;9,31 EUR;+ 17,61 EUR de envío estimado;Vendidos  15 sep 2021Artículo vendido;desde Reino Unido;
Cardcaptor Sakura Metal Dream Staff Key Ring Official ;11,63 EUR;+ 18,32 EUR de envío estimado;Vendidos  16 sep 2021Artículo vendido;desde Reino Unido;
Cardcaptor Sakura Anime Nakayoshi mini bag/pouch/purse CLAMP;40,72 EUR;+ 18,03 EUR de envío;Vendidos  29 ago 2021Artículo vendido;desde Reino Unido;
Cardcaptor Sakura Sealing Wand Key Chain Official ;5,82 EUR;+ 17,56 EUR de envío estimado;Vendidos  11 jul 2021Artículo vendido;desde Reino Unido;
Cardcaptor Sakura acrylic japanese anime character stand;15,71 EUR;+ 16,61 EUR de envío estimado;Vendidos  26 sep 2021Artículo vendido;desde Reino Unido;
Cardcaptor Sakura Movie Promo Booklet In Japanese Official ;5,82 EUR;+ 18,22 EUR de envío estimado;Vendidos  28 jul 2021Artículo vendido;desde Reino Unido;
Cardcaptor Sakura Sweet Tea Party Ichiban Kuji Prize Acrylic Stand;8,13 EUR;+ 18,60 EUR de envío estimado;Vendidos  4 sep 2021Artículo vendido;desde Reino Unido;
Cardcaptor Sakura Metal Star Key Key Ring Official ;11,63 EUR;+ 18,32 EUR de envío estimado;Vendidos  17 jul 2021Artículo vendido;desde Reino Unido;
Cardcaptor Sakura Metal Clear Card Key Ring Official ;11,63 EUR;+ 18,32 EUR de envío estimado;Vendidos  15 sep 2021Artículo vendido;desde Reino Unido;
Cardcaptor Sakura CharaMaru Large Pass Case/Pouch - Japan Import Anime Manga;11,63 EUR;+ 20,27 EUR de envío estimado;Vendidos  9 jul 2021Artículo vendido;desde Reino Unido;
10x Cardcaptor Sakura Anime Postcards Manga Stationery Cute Magical Girl Art ;3,48 EUR;+ 5,58 EUR de envío;Vendidos  14 sep 2021Artículo vendido;desde Reino Unido;
Anime 56 un. Cardcaptor Sakura Clow Tarjetas Juegos Oro Capucha Libro Caja Regalo De Navidad;28,18 EUR;Envío internacional gratis;Vendidos  28 sep 2021Artículo vendido;desde China;
Cardcaptor Sakura Pendant Keychain Set;10,34 EUR;+ 16,52 EUR de envío estimado;Vendidos  26 sep 2021Artículo vendido;desde Reino Unido;
SEGA Cardcaptor Sakura clear card ed premium figure "Sakura Kinomoto" japan;62,82 EUR;+ 26,76 EUR de envío;Vendidos  15 jul 2021Artículo vendido;desde Japón;
Cardcaptor Sakura Kinomoto Rubber Keychain Official ;6,98 EUR;+ 17,57 EUR de envío estimado;Vendidos  30 ago 2021Artículo vendido;desde Reino Unido;
Cardcaptor Sakura Hard Presentation Folder Official ;9,31 EUR;+ 18,28 EUR de envío estimado;Vendidos  30 jul 2021Artículo vendido;desde Reino Unido;
Cardcaptor Sakura long prize towel japanese anime kawaii cute;26,76 EUR;+ 21,50 EUR de envío estimado;Vendidos  13 ago 2021Artículo vendido;desde Reino Unido;
Cardcaptor Sakura Sweet Tea Party Face Cloth Official ;5,82 EUR;+ 18,22 EUR de envío estimado;Vendidos  6 ago 2021Artículo vendido;desde Reino Unido;
Cardcaptor Sakura Anime rubber strap phone charm : Sakura Kinomoto;8,14 EUR;+ 7,56 EUR de envío;Vendidos  15 jul 2021Artículo vendido;desde Reino Unido;
Cardcaptor Sakura Anime light up star key : Takara Tomy RPG toy;37,23 EUR;+ 27,92 EUR de envío;Vendidos  7 ago 2021Artículo vendido;desde Reino Unido;
56 un. Anime Cardcaptor Sakura Clow Tarjetas Captor rosa libro de personajes set con caja de regalo;37,22 EUR;+ 6,88 EUR de envío;Vendidos  4 sep 2021Artículo vendido;desde China;
Cardcaptor Sakura pouch make up bag case : Japanese CLAMP Anime 1st opening;8,14 EUR;+ 9,31 EUR de envío;Vendidos  31 ago 2021Artículo vendido;desde Reino Unido;
Cardcaptor Sakura fortuna tarjeta Portátil;54,36 EUR;Envío internacional gratis;Vendidos  5 jul 2021Artículo vendido;desde Japón;
Cardcaptors Cardcaptor Sakura Anime Challenge of the Clow spirits board game;30,25 EUR;+ 41,88 EUR de envío;Vendidos  23 jul 2021Artículo vendido;desde Reino Unido;
Cardcaptor Sakura Starlight Collection Face Cloth Official ;4,65 EUR;+ 18,20 EUR de envío estimado;Vendidos  30 jul 2021Artículo vendido;desde Reino Unido;
Cardcaptor Sakura: Sakura Kinomoto Cute Frog Ver. Special FuRyu Figure;34,90 EUR;+ 26,54 EUR de envío estimado;Vendidos  10 ago 2021Artículo vendido;desde Reino Unido;
Anime Cardcaptor Sakura Clow Tarjetas Juegos fortuna Tarot Card Captor Set Completo;12,16 EUR;+ 1,29 EUR de envío;Vendidos  27 sep 2021Artículo vendido;desde China;
Anime 56 un. Cardcaptor Sakura Clow Tarjetas Conjunto Rosa Capucha Libro Caja Regalo De Navidad;28,18 EUR;Envío internacional gratis;Vendidos  28 sep 2021Artículo vendido;desde China;
Cardcaptor Sakura Mirror A Prize Ichiban Kuji Hand Mirror Anime Kawaii;34,90 EUR;+ 21,50 EUR de envío estimado;Vendidos  6 jul 2021Artículo vendido;desde Reino Unido;
Cardcaptor Sakura Koedarize Mini Figure ;13,96 EUR;+ 16,58 EUR de envío estimado;Vendidos  1 ago 2021Artículo vendido;desde Reino Unido;
Cardcaptor Sakura In Wonderland Kero Keychain Strap;12,80 EUR;+ 20,06 EUR de envío estimado;Vendidos  18 ago 2021Artículo vendido;desde Reino Unido;
