Cardcaptor Sakura a Asobo Playstation 2 Japón importación PS2 Japón Chan Vendedor de Estados Unidos;22,41 EUR;Envío gratis;desde Estados Unidos;
Cardcaptor Sakura a Asobo Playstation 2 Japón importación PS2 Chan JP US Seller B;20,69 EUR;Envío gratis;desde Estados Unidos;
Cardcaptor Sakura animetic historia SC Playstation 1 japonés Importado PS1 Vendedor de Estados Unidos;22,41 EUR;Envío gratis;desde Estados Unidos;
Cardcaptor Sakura Capucha Carta Magic Playstation 1 japonés Importado PS1 un vendedor de Estados Unidos;16,38 EUR;Envío gratis;desde Estados Unidos;
Tetris con Cardcaptor Sakura Playstation 1 japonés Importado PS1 Japón Vendedor de Estados Unidos;32,76 EUR;Envío gratis;desde Estados Unidos;
PS1 PS PlayStation 1 Tetris Usado Con Cardcaptor Sakura eterno corazón 00044 Japón;24,34 EUR;+ 3,62 EUR de envío;desde Japón;
Cardcaptor Sakura clowcard Magic Playstation 1 PS1 Japón Con Obi Hagaki columna vertebral Reg;21,55 EUR;Envío internacional gratis;desde Japón;
Cardcaptor Sakura clowcard Magic PS1 Playstation 1 Japón importación N. MINT/MINT;15,50 EUR;+ 2,59 EUR de envío;desde Estados Unidos;
PS Cardcaptor Sakura Crow Magic Edición Limitada pokeste y otros Incluido;346,17 EUR;+ 17,24 EUR de envío;desde Japón;
Sony Playstation Tetris con Cardcaptor Sakura eterno corazón PS1 Japón JP NTSC-J;43,98 EUR;+ 6,90 EUR de envío;desde Japón;
Juego historia animetic 1 Cardcaptor Sakura no manual PS1 PlayStation Importado JP 1492;12,06 EUR;Envío gratis;desde Estados Unidos;
Tetris con Cardcaptor Sakura Playstation 1 japonés Importado PS1 JP un vendedor de Estados Unidos;36,21 EUR;Envío gratis;desde Estados Unidos;
Tetris con Cardcaptor Sakura Playstation 1 japonés Importado PS1 JP US Seller ⚡ 🚢;37,08 EUR;Envío gratis;desde Estados Unidos;
Cardcaptor Sakura clowcard Magic Playstation 1 PS1 Japón Con Obi Hagaki columna vertebral Reg;21,55 EUR;Envío internacional gratis;desde Japón;
Cardcaptor Sakura Crow Tarjeta Magia Edición Limitada Ps;102,14 EUR;Envío internacional gratis;desde Japón;
Cardcaptor Sakura animetic historia juego 1 PS1 PlayStation;12,93 EUR;+ 15,52 EUR de envío;desde Japón;
Cardcaptor Sakura juego promoción cartel 2000 PS Playstation Anime;76,45 EUR;Envío internacional gratis;desde Japón;
Cardcaptor Sakura juego Promoción Póster PS Playstation;58,46 EUR;Envío internacional gratis;desde Japón;
Historia de anime Cardcaptor Sakura;42,92 EUR;Envío internacional gratis;desde Japón;
Tetris con Cardcaptor Sakura eterno corazón PS1 Arica Sony PlayStation 1 Japón;16,88 EUR;+ 17,25 EUR de envío;desde Japón;
Cardcaptor Sakura: jugar con Sakura-Chan PlayStation 2 versión japonesa;41,76 EUR;Envío internacional gratis;desde Japón;
Cardcaptor Sakura animetic historia Playstation 1 versión japonesa;48,29 EUR;Envío internacional gratis;desde Japón;
PS1 PlayStation 1 Tetris con Usado Cardcaptor Sakura eterno Corazón;24,15 EUR;+ 6,90 EUR de envío;desde Japón;
PlayStation Cardcaptor Sakura Clow Tarjetas Magia Edición Limitada Nuevo de Japón;256,97 EUR;Envío internacional gratis;desde Japón;
Tetris con Cardcaptor Sakura eterno corazón PS1 Arica Sony PlayStation 1 Japón;17,60 EUR;+ 12,50 EUR de envío;desde Japón;
Cardcaptor Sakura clowcard Magic Sony PlayStation PSX;30,08 EUR;Envío internacional gratis;desde Japón;
PS1 PS PlayStation 1 Tetris con Cardcaptor Sakura eterno Corazón;20,88 EUR;+ 12,50 EUR de envío;desde Japón;
Abrazadera de Japón: Cardcaptor Sakura: claro tarjeta gallina Anime Libro De Arranque;30,18 EUR;Envío internacional gratis;desde Japón;
Japón Cardcaptor Sakura-Claro Tarjeta Arc-piano solista álbum (piano libro de puntuación);44,75 EUR;Envío internacional gratis;desde Japón;
Sega Cardcaptor Sakura Claro Tarjeta Ed Premium Figura "Sakura Kinomoto" Japón;53,71 EUR;+ 21,56 EUR de envío;desde Japón;
Nuevo Anime Cardcaptor Sakura Llaveros Llavero Llavero Colección Cosplay Regalos;8,61 EUR;+ 3,02 EUR de envío;desde China;
Anime Cardcaptor Sakura Sakura Kinomoto Dakimakura Hugging Body Funda de Almohada 59";23,45 EUR;Envío internacional gratis;desde China;
Anime 56 un. Cardcaptor Sakura Clow Tarjetas Juegos Oro Capucha Libro Caja Regalo De Navidad;28,16 EUR;Envío internacional gratis;desde China;
Cardcaptor Sakura official CLAMP Anime drawstring bag : Brand new & sealed;8,76 EUR;+ 9,34 EUR de envío;desde Reino Unido;
Cardcaptor Sakura Decorative Plate Official ;11,68 EUR;+ 20,34 EUR de envío estimado;desde Reino Unido;
Clamp: Cardcaptor Sakura 20th Anniversary Memorial Box;87,55 EUR;+ 26,85 EUR de envío;desde Japón;
UK FuRyu Cardcaptor Sakura Clear Card Arc Star Wand 50cm Card Captor Damaged Box;61,88 EUR;+ 22,22 EUR de envío estimado;desde Reino Unido;
Cardcaptor Sakura Clear Card hen Anime two sided Pillow Case Cover 263;5,83 EUR;Envío internacional gratis;desde China;
59" Cardcaptor Sakura Kinomoto Dakimakura Anime Otaku Hugging Body Funda de Almohada D;20,52 EUR;+ 3,45 EUR de envío;desde China;
Cardcaptor Sakura Clow Cards Cosplay Anime Fortune Tarot Card Captor Collection ;12,95 EUR;Envío internacional gratis;desde China;
Abrazadera de Japón Manga: Cardcaptor Sakura-Claro Tarjeta Arc-vol.2 Edición Especial;81,92 EUR;Envío internacional gratis;desde Japón;
Ultra Rare Discontinued Cardcaptor Sakura Original Manga ;700,49 EUR;+ 0,01 EUR de envío;desde Reino Unido;
Cardcaptor Sakura Free POse Tomoyo Figure Dolls Bandai Rare BNIB ~ Anime;52,54 EUR;+ 27,30 EUR de envío estimado;desde Reino Unido;
Cardcaptor Sakura Kinomoto Nendoroid 918 Tomoeda Junior High School Uniform Ver;87,56 EUR;+ 17,51 EUR de envío;desde Reino Unido;
UK FuRyu Cardcaptor Sakura Clear Card Arc Star Wand 50cm Card Captor Japan NEW;64,21 EUR;+ 22,26 EUR de envío estimado;desde Reino Unido;
Cardcaptor Sakura Denim Bag Official Item ;21,02 EUR;+ 20,50 EUR de envío estimado;desde Reino Unido;
Cardcaptor Sakura Glass Decorative Plate Unboxed Official ;7,01 EUR;+ 20,24 EUR de envío estimado;desde Reino Unido;
Cardcaptor Sakura Kinomoto Clear File Official ;9,34 EUR;+ 18,34 EUR de envío estimado;desde Reino Unido;
Cardcaptor Sakura: Clear Card Yume Chic Kero big plush "Laying" 23cm Japan NEW ;29,19 EUR;+ 21,13 EUR de envío;desde Reino Unido;
Cardcaptor Sakura claro tarjeta gallina Anime Dos Caras Funda de Almohada 262;5,17 EUR;+ 2,59 EUR de envío;desde China;
Cardcaptor Sakura Manga special edition by clamp Vol 1-3;75,88 EUR;+ 22,47 EUR de envío estimado;desde Reino Unido;
Authentic GSC Cardcaptor Sakura Nendoroid Kinomoto Sakura Bows;1,17 EUR;+ 37,17 EUR de envío estimado;desde Reino Unido;
Anime 56 un. Cardcaptor Sakura Clow Tarjetas Conjunto Rosa Capucha Libro Caja Regalo De Navidad;28,16 EUR;Envío internacional gratis;desde China;
56 un. Anime Cardcaptor Sakura Clow Tarjetas Captor rosa libro de personajes set con caja de regalo;37,20 EUR;+ 6,87 EUR de envío;desde China;
Cardcaptor Sakura Kinomoto Clear File Official ;9,34 EUR;+ 18,34 EUR de envío estimado;desde Reino Unido;
Cardcaptor Sakura Kinomoto Face Cloth Official ;8,17 EUR;+ 18,32 EUR de envío estimado;desde Reino Unido;
Cardcaptor Sakura Clear File Various Characters Official ;7,01 EUR;+ 18,29 EUR de envío estimado;desde Reino Unido;
Hot Japón Anime Cardcaptor Sakura Ccs desplazamiento De Pared Póster de decoración del hogar 21*30CM A +;6,03 EUR;Envío internacional gratis;desde China;
Cardcaptor Sakura Kinomoto Window Suction Cup Official ;9,34 EUR;+ 18,34 EUR de envío estimado;desde Reino Unido;
Cardcaptor Sakura Face Cloth Twinkle Little Magic;7,01 EUR;+ 17,63 EUR de envío estimado;desde Reino Unido;
Cardcaptor Sakura Pencil Board Official ;9,34 EUR;+ 17,68 EUR de envío estimado;desde Reino Unido;
Cardcaptor Sakura Pencil Board Official ;5,84 EUR;+ 17,62 EUR de envío estimado;desde Reino Unido;
Anime Cardcaptor Sakura Sakura Kinomoto Dakimakura Hugging Body Pillow Case 59”;23,34 EUR;+ 3,49 EUR de envío;desde China;
Hot Japón Anime Cardcaptor Sakura Ccs póster de desplazamiento de pared 21*30CM Decoración del hogar;6,03 EUR;Envío internacional gratis;desde China;
Nueva tarjeta de claro Cardcaptor Sakura arco Gallina Especial mercancías Caja 3 Japón 9784063588583;21,56 EUR;+ 17,25 EUR de envío;desde Japón;
Nueva tarjeta de claro Cardcaptor Sakura arco Gallina Especial mercancías Caja 2 Japón 9784063588576;24,55 EUR;+ 17,25 EUR de envío;desde Japón;
Nueva tarjeta de claro Cardcaptor Sakura arco Gallina Especial mercancías Caja 1 Japón 9784063588569;25,18 EUR;+ 17,25 EUR de envío;desde Japón;
Cardcaptor Sakura Kinomoto Goodsmile Figure 1/7 Scale;145,94 EUR;+ 42,25 EUR de envío estimado;desde Reino Unido;
Authentic GSC Cardcaptor Sakura Nendoroid Kinomoto Sakura Spare Parts Bundle;1,17 EUR;+ 38,34 EUR de envío estimado;desde Reino Unido;
Cardcaptor Sakura: Clear Card: Hand Towel;10,50 EUR;+ 20,07 EUR de envío estimado;desde Reino Unido;
Cardcaptor Sakura Starlight Collection Face Cloth Official ;4,67 EUR;+ 18,26 EUR de envío estimado;desde Reino Unido;
Cardcaptor Sakura Anime Nakayoshi mini backpack bag 90s CLAMP;64,21 EUR;+ 24,52 EUR de envío;desde Reino Unido;
Cardcaptor Sakura Clear card arc, official Anime pouch / make up bag rocket beat;14,01 EUR;+ 8,17 EUR de envío;desde Reino Unido;
BANDAI WonderSwan-Cardcaptor Sakura-Japón;9,34 EUR;+ 8,17 EUR de envío;desde Japón;
