Cardcaptor Sakura animetic historia SC Playstation 1 japonés Importado PS1 Vendedor de Estados Unidos;22,21 EUR;Envío gratis;Vendidos  27 sep 2021Artículo vendido;desde Estados Unidos;
PS1 PS PlayStation Tetris con Usado Cardcaptor Sakura eterno corazón Japón Importación;20,63 EUR;Envío internacional gratis;Vendidos  23 sep 2021Artículo vendido;desde Japón;
PS1 PlayStation 1 Tetris con Usado Cardcaptor Sakura eterno Corazón;23,93 EUR;+ 6,84 EUR de envío;Vendidos  23 sep 2021Artículo vendido;desde Japón;
Tetris con Cardcaptor Sakura Playstation 1 japonés Importado PS1 Japón Vendedor de Estados Unidos;32,47 EUR;Envío gratis;Vendidos  16 sep 2021Artículo vendido;desde Estados Unidos;
PS1 PS PlayStation 1 Tetris Usado Con Cardcaptor Sakura eterno corazón 00044 Japón;24,13 EUR;+ 3,59 EUR de envío;Vendidos  28 ago 2021Artículo vendido;desde Japón;
Animetic historia juego 1: Cardcaptor Sakura (Sony Playstation, 1999) de Japón;7,95 EUR;+ 5,98 EUR de envío;Vendidos  1 ago 2021Artículo vendido;desde Japón;
Cardcaptor Sakura Open Japanese Trading Card Pack;4,10 EUR;+ 36,72 EUR de envío estimado;Vendidos  28 ago 2021Artículo vendido;desde Reino Unido;
Cardcaptor Sakura Mini Notepad / Origami Paper;5,27 EUR;+ 36,74 EUR de envío estimado;Vendidos  6 sep 2021Artículo vendido;desde Reino Unido;
Cardcaptor Sakura Kinomoto Figure Dolls Bundle Of Dolls Li, Blue Warrior, Kitty;44,51 EUR;+ 42,18 EUR de envío estimado;Vendidos  11 jul 2021Artículo vendido;desde Reino Unido;
UK FuRyu Cardcaptor Sakura Clear Card Arc Dream Wand 50cm Card Captor Japan NEW;64,42 EUR;+ 22,34 EUR de envío estimado;Vendidos  26 ago 2021Artículo vendido;desde Reino Unido;
Cardcaptor Sakura Kero Heart Cushion Blue 30cm Cardcaptors Anime Japan BRAND NEW;18,74 EUR;+ 40,55 EUR de envío estimado;Vendidos  11 jul 2021Artículo vendido;desde Reino Unido;
Abrazadera de Japón: Cardcaptor Sakura: claro tarjeta gallina Anime Libro De Arranque;29,91 EUR;Envío internacional gratis;Vendidos  27 sep 2021Artículo vendido;desde Japón;
Anime Cardcaptor Sakura Sakura Kinomoto Dakimakura Hugging Body Funda de Almohada 59";23,24 EUR;Envío internacional gratis;Vendidos  12 sep 2021Artículo vendido;desde China;
Original Trendmasters Special Edition Cardcaptor Sakura Clow Cards & Book;187,35 EUR;+ 43,85 EUR de envío estimado;Vendidos  28 jul 2021Artículo vendido;desde Reino Unido;
Sega Cardcaptor Sakura Claro Tarjeta Ed Premium Figura "Sakura Kinomoto" Japón;54,89 EUR;+ 21,37 EUR de envío;Vendidos  5 ago 2021Artículo vendido;desde Japón;
Authentic GSC Cardcaptor Sakura Nendoroid Kinomoto Sakura Sealing Wand;2,93 EUR;+ 38,50 EUR de envío estimado;Vendidos  5 ago 2021Artículo vendido;desde Reino Unido;
Nuevo Anime Cardcaptor Sakura Llaveros Llavero Llavero Colección Cosplay Regalos;7,60 EUR;+ 2,99 EUR de envío;Vendidos  7 ago 2021Artículo vendido;desde China;
Japón Cardcaptor Sakura-Claro Tarjeta Arc-piano solista álbum (piano libro de puntuación);44,36 EUR;Envío internacional gratis;Vendidos  7 sep 2021Artículo vendido;desde Japón;
Cardcaptor Sakura Kinomoto Rubber Keychain Official ;7,03 EUR;+ 17,69 EUR de envío estimado;Vendidos  25 jul 2021Artículo vendido;desde Reino Unido;
Cardcaptor Sakura Star wand Key Chain Official ;5,86 EUR;+ 17,68 EUR de envío estimado;Vendidos  20 sep 2021Artículo vendido;desde Reino Unido;
Cardcaptor Sakura Pendant Keychain Set;10,41 EUR;+ 16,63 EUR de envío estimado;Vendidos  26 sep 2021Artículo vendido;desde Reino Unido;
Cardcaptor Sakura Syaoran Li Pen Case;8,20 EUR;+ 17,71 EUR de envío estimado;Vendidos  28 jul 2021Artículo vendido;desde Reino Unido;
Cardcaptor Sakura Anime Nakayoshi mini bag/pouch/purse CLAMP;41,00 EUR;+ 18,16 EUR de envío;Vendidos  29 ago 2021Artículo vendido;desde Reino Unido;
Cardcaptor Sakura Kinomoto Suction Cup Window Decoration Official ;9,37 EUR;+ 18,40 EUR de envío estimado;Vendidos  21 jul 2021Artículo vendido;desde Reino Unido;
Cardcaptor Sakura Kinomoto Small Clear File Official Cerberus kero;7,03 EUR;+ 17,69 EUR de envío estimado;Vendidos  15 ago 2021Artículo vendido;desde Reino Unido;
Cardcaptor Sakura Pencil Board Official;9,37 EUR;+ 17,73 EUR de envío estimado;Vendidos  15 sep 2021Artículo vendido;desde Reino Unido;
Cardcaptor Sakura Metal Dream Staff Key Ring Official ;11,71 EUR;+ 18,45 EUR de envío estimado;Vendidos  16 sep 2021Artículo vendido;desde Reino Unido;
Anime 56 un. Cardcaptor Sakura Clow Tarjetas Juegos Oro Capucha Libro Caja Regalo De Navidad;27,91 EUR;Envío internacional gratis;Vendidos  12 sep 2021Artículo vendido;desde China;
Cardcaptor Sakura Sweet Tea Party Ichiban Kuji Prize Acrylic Stand;8,19 EUR;+ 18,73 EUR de envío estimado;Vendidos  4 sep 2021Artículo vendido;desde Reino Unido;
Cardcaptor Sakura Sealing Wand Key Chain Official ;5,86 EUR;+ 17,68 EUR de envío estimado;Vendidos  11 jul 2021Artículo vendido;desde Reino Unido;
Cardcaptor Sakura acrylic japanese anime character stand;15,81 EUR;+ 16,73 EUR de envío estimado;Vendidos  26 sep 2021Artículo vendido;desde Reino Unido;
Cardcaptor Sakura Movie Promo Booklet In Japanese Official ;5,86 EUR;+ 18,34 EUR de envío estimado;Vendidos  28 jul 2021Artículo vendido;desde Reino Unido;
SEGA Cardcaptor Sakura clear card ed premium figure "Sakura Kinomoto" japan;62,08 EUR;+ 26,94 EUR de envío;Vendidos  15 jul 2021Artículo vendido;desde Japón;
Cardcaptor Sakura Metal Star Key Key Ring Official ;11,71 EUR;+ 18,45 EUR de envío estimado;Vendidos  17 jul 2021Artículo vendido;desde Reino Unido;
Cardcaptor Sakura Metal Clear Card Key Ring Official ;11,71 EUR;+ 18,45 EUR de envío estimado;Vendidos  15 sep 2021Artículo vendido;desde Reino Unido;
Cardcaptor Sakura CharaMaru Large Pass Case/Pouch - Japan Import Anime Manga;11,71 EUR;+ 20,40 EUR de envío estimado;Vendidos  9 jul 2021Artículo vendido;desde Reino Unido;
56 un. Anime Cardcaptor Sakura Clow Tarjetas Captor rosa libro de personajes set con caja de regalo;36,87 EUR;+ 6,81 EUR de envío;Vendidos  4 sep 2021Artículo vendido;desde China;