Cardcaptor Sakura a Asobo Playstation 2 Japón importación PS2 Japón Chan Vendedor de Estados Unidos;22,38 EUR;desde Estados Unidos;
Cardcaptor Sakura a Asobo Playstation 2 Japón importación PS2 Chan JP US Seller B;20,65 EUR;desde Estados Unidos;
Cardcaptor Sakura animetic historia SC Playstation 1 japonés Importado PS1 Vendedor de Estados Unidos;22,38 EUR;desde Estados Unidos;
Cardcaptor Sakura Capucha Carta Magic Playstation 1 japonés Importado PS1 un vendedor de Estados Unidos;16,35 EUR;desde Estados Unidos;
Tetris con Cardcaptor Sakura Playstation 1 japonés Importado PS1 Japón Vendedor de Estados Unidos;32,71 EUR;desde Estados Unidos;
PS1 PS PlayStation 1 Tetris Usado Con Cardcaptor Sakura eterno corazón 00044 Japón;24,30 EUR;+ 3,62 EUR de envío;desde Japón;
Cardcaptor Sakura clowcard Magic Playstation 1 PS1 Japón Con Obi Hagaki columna vertebral Reg;21,51 EUR;Envío internacional gratis;desde Japón;
Cardcaptor Sakura clowcard Magic PS1 Playstation 1 Japón importación N. MINT/MINT;12,38 EUR;+ 2,58 EUR de envío;desde Estados Unidos;
PS Cardcaptor Sakura Crow Magic Edición Limitada pokeste y otros Incluido;345,61 EUR;+ 17,21 EUR de envío;desde Japón;
Sony Playstation Tetris con Cardcaptor Sakura eterno corazón PS1 Japón JP NTSC-J;43,91 EUR;+ 6,89 EUR de envío;desde Japón;
Tetris con Cardcaptor Sakura Playstation 1 japonés Importado PS1 JP un vendedor de Estados Unidos;36,15 EUR;desde Estados Unidos;
Tetris con Cardcaptor Sakura Playstation 1 japonés Importado PS1 JP US Seller ⚡ 🚢;37,02 EUR;Envío gratis;desde Estados Unidos;
Cardcaptor Sakura clowcard Magic Playstation 1 PS1 Japón Con Obi Hagaki columna vertebral Reg;21,51 EUR;Envío internacional gratis;desde Japón;
Cardcaptor Sakura animetic historia juego 1 PS1 PlayStation;12,91 EUR;+ 15,50 EUR de envío;desde Japón;
Cardcaptor Sakura juego promoción cartel 2000 PS Playstation Anime;76,32 EUR;Envío internacional gratis;desde Japón;
Cardcaptor Sakura juego Promoción Póster PS Playstation;58,36 EUR;Envío internacional gratis;desde Japón;
Cardcaptor Sakura animetic historia Playstation 1 versión japonesa;48,21 EUR;Envío internacional gratis;desde Japón;
Tetris con Cardcaptor Sakura eterno corazón PS1 Arica Sony PlayStation 1 Japón;16,86 EUR;+ 17,22 EUR de envío;desde Japón;
Cardcaptor Sakura: jugar con Sakura-Chan PlayStation 2 versión japonesa;41,69 EUR;Envío internacional gratis;desde Japón;
PS1 PlayStation 1 Tetris con Usado Cardcaptor Sakura eterno Corazón;24,11 EUR;+ 6,89 EUR de envío;desde Japón;
PlayStation Cardcaptor Sakura Clow Tarjetas Magia Edición Limitada Nuevo de Japón;256,55 EUR;Envío internacional gratis;desde Japón;
Tetris con Cardcaptor Sakura eterno corazón PS1 Arica Sony PlayStation 1 Japón;17,83 EUR;+ 12,48 EUR de envío;desde Japón;
Cardcaptor Sakura clowcard Magic Sony PlayStation PSX;30,03 EUR;Envío internacional gratis;desde Japón;
PS1 PS PlayStation 1 Tetris con Cardcaptor Sakura eterno Corazón;21,10 EUR;+ 12,48 EUR de envío;desde Japón;
Abrazadera de Japón: Cardcaptor Sakura: claro tarjeta gallina Anime Libro De Arranque;30,13 EUR;Envío internacional gratis;desde Japón;
Sega Cardcaptor Sakura Claro Tarjeta Ed Premium Figura "Sakura Kinomoto" Japón;55,29 EUR;+ 21,52 EUR de envío;desde Japón;
Japón Cardcaptor Sakura-Claro Tarjeta Arc-piano solista álbum (piano libro de puntuación);44,68 EUR;Envío internacional gratis;desde Japón;
Nuevo Anime Cardcaptor Sakura Llaveros Llavero Llavero Colección Cosplay Regalos;7,65 EUR;+ 3,01 EUR de envío;desde China;
Anime Cardcaptor Sakura Sakura Kinomoto Dakimakura Hugging Body Funda de Almohada 59";23,41 EUR;Envío internacional gratis;desde China;
Anime 56 un. Cardcaptor Sakura Clow Tarjetas Juegos Oro Capucha Libro Caja Regalo De Navidad;28,12 EUR;Envío internacional gratis;desde China;
Cardcaptor Sakura official CLAMP Anime drawstring bag : Brand new & sealed;8,67 EUR;+ 9,25 EUR de envío;desde Reino Unido;
UK FuRyu Cardcaptor Sakura Clear Card Arc Star Wand 50cm Card Captor Damaged Box;61,26 EUR;+ 21,99 EUR de envío estimado;desde Reino Unido;
Cardcaptor Sakura Decorative Plate Official ;11,56 EUR;+ 20,13 EUR de envío estimado;desde Reino Unido;
Clamp: Cardcaptor Sakura 20th Anniversary Memorial Box;86,67 EUR;+ 26,58 EUR de envío;desde Japón;
Cardcaptor Sakura Clear Card hen Anime two sided Pillow Case Cover 263;5,77 EUR;Envío internacional gratis;desde China;
59" Cardcaptor Sakura Kinomoto Dakimakura Anime Otaku Hugging Body Funda de Almohada D;20,49 EUR;+ 3,44 EUR de envío;desde China;
Cardcaptor Sakura Star Wand Cosplay Alloy Accessories In Box Figure Adjustable;22,72 EUR;Envío internacional gratis;desde China;
Abrazadera de Japón Manga: Cardcaptor Sakura-Claro Tarjeta Arc-vol.2 Edición Especial;81,79 EUR;Envío internacional gratis;desde Japón;
Ultra Rare Discontinued Cardcaptor Sakura Original Manga ;693,46 EUR;+ 0,01 EUR de envío;desde Reino Unido;
UK FuRyu Cardcaptor Sakura Clear Card Arc Star Wand 50cm Card Captor Japan NEW;63,57 EUR;+ 22,04 EUR de envío estimado;desde Reino Unido;
Cardcaptor Sakura Clow Cards Cosplay Anime Fortune Tarot Card Captor Collection ;12,82 EUR;Envío internacional gratis;desde China;
Cardcaptor Sakura: Clear Card Yume Chic Kero big plush "Laying" 23cm Japan NEW ;28,89 EUR;+ 20,92 EUR de envío;desde Reino Unido;
Cardcaptor Sakura Free POse Tomoyo Figure Dolls Bandai Rare BNIB ~ Anime;52,01 EUR;+ 27,02 EUR de envío estimado;desde Reino Unido;
Cardcaptor Sakura Kinomoto Clear File Official ;9,25 EUR;+ 18,16 EUR de envío estimado;desde Reino Unido;
Hot Japón Anime Cardcaptor Sakura Ccs desplazamiento De Pared Póster de decoración del hogar 21*30CM A +;6,02 EUR;Envío internacional gratis;desde China;
Cardcaptor Sakura claro tarjeta gallina Anime Dos Caras Funda de Almohada 262;5,16 EUR;+ 2,58 EUR de envío;desde China;
Cardcaptor Sakura Manga special edition by clamp Vol 1-3;75,11 EUR;+ 22,25 EUR de envío estimado;desde Reino Unido;
Cardcaptor Sakura Denim Bag Official Item ;20,80 EUR;+ 20,30 EUR de envío estimado;desde Reino Unido;
Cardcaptor Sakura Kinomoto Nendoroid 918 Tomoeda Junior High School Uniform Ver;86,68 EUR;+ 17,34 EUR de envío;desde Reino Unido;
Anime 56 un. Cardcaptor Sakura Clow Tarjetas Conjunto Rosa Capucha Libro Caja Regalo De Navidad;28,12 EUR;Envío internacional gratis;desde China;
Cardcaptor Sakura Glass Decorative Plate Unboxed Official ;6,93 EUR;+ 20,04 EUR de envío estimado;desde Reino Unido;
Cardcaptor Sakura: Clear Card: Hand Towel;10,39 EUR;+ 19,87 EUR de envío estimado;desde Reino Unido;
Nueva tarjeta de claro Cardcaptor Sakura arco Gallina Especial mercancías Caja 3 Japón 9784063588583;21,52 EUR;+ 17,22 EUR de envío;desde Japón;
Nueva tarjeta de claro Cardcaptor Sakura arco Gallina Especial mercancías Caja 2 Japón 9784063588576;24,51 EUR;+ 17,22 EUR de envío;desde Japón;
Nueva tarjeta de claro Cardcaptor Sakura arco Gallina Especial mercancías Caja 1 Japón 9784063588569;25,14 EUR;+ 17,22 EUR de envío;desde Japón;
Hot Japón Anime Cardcaptor Sakura Ccs póster de desplazamiento de pared 21*30CM Decoración del hogar;6,02 EUR;Envío internacional gratis;desde China;
Cardcaptor Sakura Clear card arc, official Anime pouch / make up bag rocket beat;13,87 EUR;+ 8,09 EUR de envío;desde Reino Unido;
56 un. Anime Cardcaptor Sakura Clow Tarjetas Captor rosa libro de personajes set con caja de regalo;37,14 EUR;+ 6,86 EUR de envío;desde China;
Anime Cardcaptor Sakura Sakura Kinomoto Dakimakura Hugging Body Pillow Case 59”;23,10 EUR;+ 3,46 EUR de envío;desde China;
Cardcaptor Sakura Transparent Card Four-piece bedding Pillowcase Quilt Bed Sheet;234,23 EUR;+ 46,02 EUR de envío;desde China;
Cardcaptor Sakura Kinomoto Clear File Official ;9,25 EUR;+ 18,16 EUR de envío estimado;desde Reino Unido;
Cardcaptor Sakura Kinomoto Face Cloth Official ;8,09 EUR;+ 18,13 EUR de envío estimado;desde Reino Unido;
Cardcaptor Sakura Anime Nakayoshi mini backpack bag 90s CLAMP;63,57 EUR;+ 24,27 EUR de envío;desde Reino Unido;
Cardcaptor Sakura Kinomoto Window Suction Cup Official ;9,25 EUR;+ 18,16 EUR de envío estimado;desde Reino Unido;
Cardcaptor Sakura Clear File Various Characters Official ;6,93 EUR;+ 18,11 EUR de envío estimado;desde Reino Unido;
Cardcaptor Sakura Face Cloth Twinkle Little Magic;6,93 EUR;+ 17,45 EUR de envío estimado;desde Reino Unido;
Cardcaptor Sakura Pencil Board Official ;9,25 EUR;+ 17,50 EUR de envío estimado;desde Reino Unido;
Cardcaptor Sakura Pencil Board Official ;5,78 EUR;+ 17,44 EUR de envío estimado;desde Reino Unido;
Card Captor Cardcaptor Sakura Kinomoto Action Figure Model Collectables;57,78 EUR;+ 35,09 EUR de envío estimado;desde Reino Unido;
Cardcaptor Sakura Kero and Li Original Cels and sketch;254,27 EUR;+ 50,08 EUR de envío estimado;desde Reino Unido;
