Cubix Robots Para Todos: carrera Robots N (PS1 PlayStation Game PAL) Gratis Reino Unido P&p;6,92 EUR;+ 16,45 EUR de envío estimado;Vendidos  21 sep 2021Artículo vendido;desde Reino Unido;
Cubix: los robots para todos-Race 'n robots (Sony PlayStation 1, 2001) PS1 | Nuevo;8,59 EUR;Envío gratis;Vendidos  25 sep 2021Artículo vendido;desde Estados Unidos;
Cubix Robots Para Todos Race 'n robots (Playstation PS1) completa PROBADO/OBRAS!;7,72 EUR;Envío gratis;Vendidos  22 sep 2021Artículo vendido;desde Estados Unidos;
Cubix (Sony PlayStation) PS1 Completa!;6,03 EUR;Envío gratis;Vendidos  12 sep 2021Artículo vendido;desde Estados Unidos;
Cubix: los robots para Todos Race 'n Robots-PlayStation 1 (PS1) probado;7,42 EUR;Envío gratis;Vendidos  8 sep 2021Artículo vendido;desde Estados Unidos;
Cubix: los robots para todos -- Showdown (Sony Playstation 2, 2003);8,54 EUR;+ 3,32 EUR de envío;Vendidos  6 sep 2021Artículo vendido;desde Estados Unidos;
Cubix Robots Para Todos Showdown PS2 disco solamente probado Sony PlayStation 2 buena;5,13 EUR;Envío gratis;Vendidos  4 sep 2021Artículo vendido;desde Estados Unidos;
Cubix Robots Para Todos -- carrera: 'n robots (Sony PlayStation 1, 2001);3,85 EUR;+ 3,44 EUR de envío;Vendidos  31 ago 2021Artículo vendido;desde Estados Unidos;
Cubix (Sony PlayStation) PS1 Completa!;5,17 EUR;Envío gratis;Vendidos  29 ago 2021Artículo vendido;desde Estados Unidos;
Cubix Robots Para Todos Playstation PS1 Black Label Completo con Manual;6,47 EUR;Envío gratis;Vendidos  16 ago 2021Artículo vendido;desde Estados Unidos;
Cubix: los robots para todo el mundo, de raza 'n robots (PlayStation PS1) - disco solamente;3,24 EUR;Envío gratis;Vendidos  1 ago 2021Artículo vendido;desde Estados Unidos;
Cubix Robots Para Todos -- carrera: 'n robots (Sony PlayStation 1, 2001);2,67 EUR;+ 4,23 EUR de envío;Vendidos  11 jul 2021Artículo vendido;desde Estados Unidos;
Playstation 2 Cubix: los robots para todos Showdown Juego Completo;9,48 EUR;Envío gratis;Vendidos  9 jul 2021Artículo vendido;desde Estados Unidos;
Cubix: los robots para Todos Race 'n robots (Sony Playstation 1 ps1) Completa;5,17 EUR;Envío gratis;Vendidos  6 jul 2021Artículo vendido;desde Estados Unidos;
