Final Fantasy IX 9 Completo Playstation PSone Psx Ps1 Pal España ESP Squaresoft;69,99 EUR;+ 16,99 EUR de envío;desde España;
Final Fantasy IX/9 (PlayStation/PS1) tridimensionales PAL 11+;46,69 EUR;+ 20,15 EUR de envío estimado;desde Reino Unido;
Final Fantasy IX (9) Platinum Versión original SONY PLAYSTATION PS1 PS2 PAL;19,84 EUR;+ 16,74 EUR de envío estimado;desde Reino Unido;
Final Fantasy IX (Sony PlayStation 1, 2001, Français, PAL) Original État Correct;29,90 EUR;+ 14,99 EUR de envío;desde Francia;
Final Fantasy IX (9) Guía de estrategia oficial Piggyback-PLAYSTATION;32,68 EUR;+ 31,14 EUR de envío estimado;desde Reino Unido;
Final Fantasy IX Playstation 1 Sony PSX ps1 FR;19,90 EUR;+ 33,00 EUR de envío;