Beast Wars Transformers Para Sony PlayStation PS1 Juego-Libre Rare entrega 游뚴;23,41 EUR;+ 16,87 EUR de env칤o estimado;Vendidos  18 sep 2021Art칤culo vendido;desde Reino Unido;
* S칩lo Disco * Transformers Beast Wars Playstation 1 One PS1 PSOne PS PSX;11,65 EUR;Env칤o no especificado;Vendidos  25 ago 2021Art칤culo vendido;desde Reino Unido;
Beast Wars Transformers Para Sony PlayStation PS1 Juego-Libre Rare entrega 游뚴;17,51 EUR;+ 16,76 EUR de env칤o estimado;Vendidos  4 ago 2021Art칤culo vendido;desde Reino Unido;
SONY PLAYSTATION 1 juego Beast Wars Transformers completa PS1 en muy buena condici칩n;22,20 EUR;+ 16,84 EUR de env칤o estimado;Vendidos  2 ago 2021Art칤culo vendido;desde Reino Unido;
Transformers Beast Wars Transmetals Sony Playstation 1 PS1 Completa!;51,27 EUR;Env칤o gratis;Vendidos  26 sep 2021Art칤culo vendido;desde Estados Unidos;
Beast Wars Transformers (PlayStation 1, 1997) PS1 completa revocados Probado;32,47 EUR;Env칤o gratis;Vendidos  24 sep 2021Art칤culo vendido;desde Estados Unidos;
Transformers Beast Wars Transmetals Sony PlayStation 1 PS1 Black Label probado!;46,91 EUR;Env칤o gratis;Vendidos  21 sep 2021Art칤culo vendido;desde Estados Unidos;
PlayStation 1 PS1 Beast Wars Transformers Hasbro Interactivo Cartucho en Caja;34,19 EUR;+8,55 EUR de env칤o;Vendidos  16 sep 2021Art칤culo vendido;desde Estados Unidos;
Transformers Beast Wars Transmetals (Sony Playstation 1, 2000) PS1 Solo Manual;12,81 EUR;Env칤o gratis;Vendidos  14 sep 2021Art칤culo vendido;desde Estados Unidos;
PS1 PS PlayStation 1 Usado Transformers Beast Wars 35837 Jap칩n Importaci칩n;25,64 EUR;Env칤o gratis;Vendidos  14 sep 2021Art칤culo vendido;desde Estados Unidos;
Transformers Beast Wars Transmetals Sony PlayStation 1 PS1 Black Label Completo;42,72 EUR;+4,19 EUR de env칤o;Vendidos  14 sep 2021Art칤culo vendido;desde Estados Unidos;
Transformers Beast Wars Transmetals (Playstation 1 PS1, 2000) Disco Solamente;20,51 EUR;+4,44 EUR de env칤o;Vendidos  6 sep 2021Art칤culo vendido;desde Estados Unidos;
Beast Wars Transformers (PlayStation PS!) Disco Con Estuche Sin Manual se env칤a gratis;17,08 EUR;Env칤o gratis;Vendidos  22 ago 2021Art칤culo vendido;desde Estados Unidos;
Transformers Beast Wars Transmetals (Playstation 1 PS1, 2000) Disco Solamente limpio;23,92 EUR;Env칤o gratis;Vendidos  17 ago 2021Art칤culo vendido;desde Estados Unidos;
Transformers Beast Wars PS1 Playstation 1 Importado Japon칠s Juego;23,92 EUR;Env칤o gratis;Vendidos  14 ago 2021Art칤culo vendido;desde Estados Unidos;
Transformers Beast Wars (Sony PlayStation 1, Ps1 1997) Manual y disco solamente!;14,52 EUR;Env칤o gratis;Vendidos  12 ago 2021Art칤culo vendido;desde Estados Unidos;
Transformers Beast Wars (Sony PlayStation 1 PS1, 1997) Completo en Caja Cartucho;34,18 EUR;Env칤o gratis;Vendidos  25 jul 2021Art칤culo vendido;desde Estados Unidos;
Raro Beast Wars Transformers completa 1997 PS1 PlayStation 1;33,33 EUR;Env칤o gratis;Vendidos  24 jul 2021Art칤culo vendido;desde Estados Unidos;
Transformers Beast Wars Transmetals Sony Playstation 1 PS1 como nuevo Completa!;67,68 EUR;Env칤o gratis;Vendidos  24 jul 2021Art칤culo vendido;desde Estados Unidos;
: Transformers Beast Wars -- Transmetals (Sony PlayStation 1, 2000);44,43 EUR;Env칤o gratis;Vendidos  22 jul 2021Art칤culo vendido;desde Estados Unidos;
Transformers Beast Wars: Transmetals PS1 (Sony Playstation) (probados) Con Manual;51,27 EUR;Env칤o gratis;Vendidos  21 jul 2021Art칤culo vendido;desde Estados Unidos;
Playstation 1 PS1 juego Beast Wars Transformers Cartucho en Caja Completo En Caja;29,91 EUR;Env칤o gratis;Vendidos  21 jul 2021Art칤culo vendido;desde Estados Unidos;
Raro Beast Wars Transformers completa 1997 PS1 PlayStation 1;34,18 EUR;Env칤o gratis;Vendidos  18 jul 2021Art칤culo vendido;desde Estados Unidos;
Rare Beast Wars Transformers Complete 1997 PS1 PlayStation 1 Tested;23,67 EUR;+10,14 EUR de env칤o;Vendidos  11 jul 2021Art칤culo vendido;desde Canad치;
Transformers Beast Wars (Sony PlayStation 1, Ps1 1997) disco y manual-ning칰n caso;18,80 EUR;Env칤o gratis;Vendidos  8 jul 2021Art칤culo vendido;desde Estados Unidos;
Raro Beast Wars Transformers completa 1997 PS1 PlayStation 1;33,33 EUR;+2,99 EUR de env칤o;Vendidos  4 jul 2021Art칤culo vendido;desde Estados Unidos;
Transformers Beast Wars m치xima b'boom Mandrillo Kenner Hasbro 1997, nuevo dif칤cil de encontrar;51,19 EUR;+24,79 EUR de env칤o;Vendidos  26 jul 2021Art칤culo vendido;desde Grecia;
Transformers Beast Wars generaciones Rhinox 8" Juguete Figura De Acci칩n Rhino;46,79 EUR;+ 23,09 EUR de env칤o estimado;Vendidos  11 ago 2021Art칤culo vendido;desde Reino Unido;
Transformers Beast Wars Optimus Primal Ultra Clase 1996;35,08 EUR;+ 36,16 EUR de env칤o estimado;Vendidos  4 ago 2021Art칤culo vendido;desde Reino Unido;
Transformers Beast Wars lazorbeak;26,88 EUR;+ 36,01 EUR de env칤o estimado;Vendidos  12 sep 2021Art칤culo vendido;desde Reino Unido;
Transformers Beast Wars Optimus Primal Juguete obra maestra convoy MP-38 versi칩n de menta;163,98 EUR;+ 38,50 EUR de env칤o estimado;Vendidos  13 ago 2021Art칤culo vendido;desde Reino Unido;
Transformers Beast Wars Optimus Primal Transmetal figura-T7;14,64 EUR;+ 16,70 EUR de env칤o estimado;Vendidos  22 jul 2021Art칤culo vendido;desde Reino Unido;
Transformadores BOTCON 2016 Beast Wars Megatron;292,83 EUR;+ 40,84 EUR de env칤o estimado;Vendidos  5 sep 2021Art칤culo vendido;desde Reino Unido;
Jiangxing JX-MB01 Drag칩n Alado Transformers Masterpiece Beast Wars Megatron;216,69 EUR;+ 39,46 EUR de env칤o estimado;Vendidos  25 jul 2021Art칤culo vendido;desde Reino Unido;
Transformers Beast Wars Silverbolt Fuzor completo De lujo Clase;46,84 EUR;+ 25,76 EUR de env칤o estimado;Vendidos  14 jul 2021Art칤culo vendido;desde Reino Unido;
Transformers Beast Wars Ramhorn Completo Tripredacus;19,90 EUR;+11,13 EUR de env칤o;Vendidos  25 sep 2021Art칤culo vendido;desde Reino Unido;
Transformers Beast Wars Transmetals ratonera Completa;35,13 EUR;+12,30 EUR de env칤o;Vendidos  25 ago 2021Art칤culo vendido;desde Reino Unido;
Transformers Beast Wars Transmetal tar치ntulas cromo perfecto no pistola Predacon;52,71 EUR;+ 36,47 EUR de env칤o estimado;Vendidos  28 ago 2021Art칤culo vendido;desde Reino Unido;
Reino de Transformers Beast Wars Skywarp batalla a trav칠s del tiempo figura Nueva En Caja;32,80 EUR;+11,71 EUR de env칤o;Vendidos  13 sep 2021Art칤culo vendido;desde Reino Unido;
Transformador de juguetes Hasbro Trabajo Lote paquete Beast Wars Armada Energon Mini Cons;81,98 EUR;+ 37,01 EUR de env칤o estimado;Vendidos  24 jul 2021Art칤culo vendido;desde Reino Unido;
Terrorsaur 2016 botcon Beast Wars;81,98 EUR;+ 17,93 EUR de env칤o estimado;Vendidos  24 ago 2021Art칤culo vendido;desde Reino Unido;
Transformers Beast Wars Transmetals Dinobot Completa;46,84 EUR;+12,30 EUR de env칤o;Vendidos  15 ago 2021Art칤culo vendido;desde Reino Unido;
Transformers Beast Wars biocombat m치xima Polar Garra-Kenner 1996-Y en Caja Sellada;163,97 EUR;+ 38,50 EUR de env칤o estimado;Vendidos  12 ago 2021Art칤culo vendido;desde Reino Unido;
Transformers Beast Wars Transmetals Cheetor Completa;29,27 EUR;+11,13 EUR de env칤o;Vendidos  15 ago 2021Art칤culo vendido;desde Reino Unido;
Transformers Beast Wars diferentes figuras Airazor Terrorsaur Rattrap OVP;29,90 EUR a 39,90 EUR;+19,90 EUR de env칤o;Vendidos  8 sep 2021Art칤culo vendido;desde Alemania;
Transformers Beast Wars garras mand칤bula;18,68 EUR;+ 35,87 EUR de env칤o estimado;Vendidos  20 jul 2021Art칤culo vendido;desde Reino Unido;
Rattrap walmart Exclusive Transformers Beast Wars Reissue Kenner personaje Hasbro;44,90 EUR;+11,90 EUR de env칤o;Vendidos  19 sep 2021Art칤culo vendido;desde Alemania;
Transformers Beast Wars Transmetals 2 Cheetor Vintage Acci칩n Figura Hasbro 1999;43,26 EUR;+ 17,23 EUR de env칤o estimado;Vendidos  29 jul 2021Art칤culo vendido;desde Reino Unido;
Takara Tomy obra maestra de Transformers Beast Wars MP-46 Blackarachnia (oficial);81,99 EUR;+ 41,93 EUR de env칤o estimado;Vendidos  4 sep 2021Art칤culo vendido;desde Reino Unido;
Transformers Beast Wars Transmetal carro침ero Completa Gran Cromo Inferno BW;46,85 EUR;+ 36,37 EUR de env칤o estimado;Vendidos  28 ago 2021Art칤culo vendido;desde Reino Unido;
Transformers Beast Wars Retrax;16,40 EUR;+13,47 EUR de env칤o;Vendidos  12 sep 2021Art칤culo vendido;desde Reino Unido;
MP-43 obra maestra Beast Wars Megatron (no oficiales);117,13 EUR;+ 37,65 EUR de env칤o estimado;Vendidos  9 jul 2021Art칤culo vendido;desde Reino Unido;
Transformers Beast Wars Transmetal Optimal Optimus Prime 10" Figura De Acci칩n;35,14 EUR;+29,28 EUR de env칤o;Vendidos  11 jul 2021Art칤culo vendido;desde Reino Unido;
1997 Transformers Beast Wars biocombat Megatron Metal T-Rex 100% completo roto;68,36 EUR;+13,67 EUR de env칤o;Vendidos  10 sep 2021Art칤culo vendido;desde Grecia;
Transformers Beast Wars generaciones Rhinox 8" Juguete Figura de acci칩n, no en caja ex;29,27 EUR;+ 39,80 EUR de env칤o estimado;Vendidos  14 jul 2021Art칤culo vendido;desde Reino Unido;
Transformers Robot Masters Beast Wars Megatron 100% RM-02 (2004) + Caja Y Manuales;55,64 EUR;+ 40,28 EUR de env칤o estimado;Vendidos  9 ago 2021Art칤culo vendido;desde Reino Unido;
Nuevo MP-41 Transformers Masterpiece Dinobot Beast Wars (칰ltimo);283,45 EUR;+ 45,14 EUR de env칤o estimado;Vendidos  2 ago 2021Art칤culo vendido;desde Reino Unido;
Transformers Beast Wars Transmetals Airazor Completo-N94;19,90 EUR;+7,02 EUR de env칤o;Vendidos  1 ago 2021Art칤culo vendido;desde Reino Unido;
Transformers Beast Wars clase b치sica Armordillo m치xima;21,03 EUR;+ 35,90 EUR de env칤o estimado;Vendidos  12 sep 2021Art칤culo vendido;desde Reino Unido;
Transformers Beast Wars Transmetal 2 acecho 2 (Negro) completa BW m치xima;35,14 EUR;+ 36,16 EUR de env칤o estimado;Vendidos  21 ago 2021Art칤culo vendido;desde Reino Unido;
Transformers Beast Wars Cicadacon figura 1997 Takara Hasbro incompleto;26,93 EUR;+ 21,01 EUR de env칤o estimado;Vendidos  26 jul 2021Art칤culo vendido;desde Reino Unido;
Transformers Beast Wars Jetstorm Completa;35,13 EUR;+11,13 EUR de env칤o;Vendidos  4 sep 2021Art칤culo vendido;desde Reino Unido;
Transfomers Kingdom Bundle-Beast Wars figuers Megatron 칩ptima Optimus + m치s;210,84 EUR;+ 45,56 EUR de env칤o estimado;Vendidos  13 ago 2021Art칤culo vendido;desde Reino Unido;
TransArt Toys Beast Wars Transmutate, Transformers Masterpiece extra침o amigo;93,69 EUR;+ 41,69 EUR de env칤o estimado;Vendidos  31 jul 2021Art칤culo vendido;desde Reino Unido;
Transformers Beast Wars Cybershark 99% completo m치xima Sky-Byte precursor;29,28 EUR;+ 36,05 EUR de env칤o estimado;Vendidos  24 ago 2021Art칤culo vendido;desde Reino Unido;
Transformadores BOTCON Exclusivo Raro y Airazor 2016 en la mano ahora (Beast Wars);87,85 EUR;+ 37,12 EUR de env칤o estimado;Vendidos  5 jul 2021Art칤culo vendido;desde Reino Unido;
Transformers Beast Wars Optimus Primal Transmetal mega clase 1997;23,37 EUR;+ 16,87 EUR de env칤o estimado;Vendidos  23 jul 2021Art칤culo vendido;desde Reino Unido;
Transformers Takara Beast Wars 11-VS39-sobrevivir Vs Killer Punch - 1999;158,13 EUR;+ 44,72 EUR de env칤o estimado;Vendidos  28 ago 2021Art칤culo vendido;desde Reino Unido;
Transformers Beast Wars Ani mutantes Deluxe Transmetals 2 Predator plaga dif칤cil de encontrar;72,56 EUR;+24,79 EUR de env칤o;Vendidos  19 jul 2021Art칤culo vendido;desde Grecia;
Transformers Generaciones emocionante 30 ratonera completa obra maestra Beast Wars;41,00 EUR;+ 36,26 EUR de env칤o estimado;Vendidos  28 ago 2021Art칤culo vendido;desde Reino Unido;
Figura De Transformers de Beast Wars Jetstorm;35,13 EUR;+ 36,16 EUR de env칤o estimado;Vendidos  20 jul 2021Art칤culo vendido;desde Reino Unido;
Transformers Beast Wars Cybershark 7" Acci칩n Figura Hasbro 1996;35,14 EUR;+17,57 EUR de env칤o;Vendidos  24 ago 2021Art칤culo vendido;desde Reino Unido;
Tar치ntulas Transmetals 100% COMPLETO De Lujo Beast Wars Transformers;93,71 EUR;+ 41,73 EUR de env칤o estimado;Vendidos  9 ago 2021Art칤culo vendido;desde Reino Unido;
Transformers Beast Wars Transmetal Airazor Fox Ni침os Completa BW m치xima;29,28 EUR;+ 36,05 EUR de env칤o estimado;Vendidos  11 sep 2021Art칤culo vendido;desde Reino Unido;
Takara MP41 Dinobot, Transformers Masterpiece Beast Wars MP-41;281,10 EUR;+ 45,10 EUR de env칤o estimado;Vendidos  7 jul 2021Art칤culo vendido;desde Reino Unido;
