Dark Messiah - Sony Playstation - PS1 PSX - JAP Japan;24,90 EUR;+ 12,00 EUR de envío;desde Italia;
Usado PS1 PS PlayStation 1 Dark Messiah 10172 Japón Importación;18,86 EUR;+ 3,62 EUR de envío;desde Japón;
Usado PS1 PS PlayStation 1 Dark Messiah de Japón;25,12 EUR;+ 8,19 EUR de envío;desde Japón;
Dark Messiah japonés Importado PS1 Sony PlayStation;25,86 EUR;+ 7,11 EUR de envío;desde Estados Unidos;
Dark Messiah (Sony PlayStation 1, 1998) Importado Japonés;38,80 EUR;+ 9,42 EUR de envío;desde Estados Unidos;
Usado PS1 PlayStation 1 Dark Messiah (idioma/japonés);23,28 EUR;+ 6,90 EUR de envío;desde Japón;
Dark Messiah Playstation;140,40 EUR;+ 17,25 EUR de envío;desde Japón;
Dark Messiah PS1 Playstation Japón p1;25,87 EUR;+ 14,66 EUR de envío;desde Japón;
Dark Messiah con la columna tarjeta PS1 Sony PlayStation;28,45 EUR;+ 15,52 EUR de envío;desde Japón;
PS1 Dark Messiah PlayStation 1;18,55 EUR;+ 3,45 EUR de envío;desde Japón;
PS1 PlayStation 1 Dark Messiah versión japonesa/de Japón;22,43 EUR;+ 14,23 EUR de envío;desde Japón;
Usado PS1 PS PlayStation 1 Dark Messiah Japón Importación;28,56 EUR;+ 8,19 EUR de envío;desde Japón;
Dark Messiah of Might and Magic elementos Microsoft Xbox 360 Juego;4,66 EUR;+ 17,51 EUR de envío;desde Reino Unido;
Dark Messiah: Might and Magic Edicion Coleccionista PC JUEGO COMPLETO MANUAL, MAPAS;11,66 EUR;+ 16,60 EUR de envío estimado;desde Reino Unido;
Might and Magic Dark Messiah - Juego para PC DVD-Rom Edicion España PAL - AM;14,90 EUR;+ 9,90 EUR de envío;desde España;
Dark Messiah of Might and Magic-Edicion Coleccionista PC juego rápido post-Completo;9,28 EUR;+ 11,68 EUR de envío;desde Reino Unido;
Nuevo anuncioDark Messiah Might And Magic -- PC -- ;3,99 EUR;+ 9,40 EUR de envío;desde Francia;
Dark Messiah Might and Magic Pc Windows DVD-ROM Video Juego Completo Manual EUR V;6,23 EUR;+ 18,42 EUR de envío estimado;desde Reino Unido;
JEU.X BOX 360 Dark Messiah Of Might And Magic  MA REF CAISSE 8;4,90 EUR;+ 5,30 EUR de envío;desde Francia;
Dark Messiah of Might and Magic (Pc DVD);3,49 EUR;+ 16,45 EUR de envío estimado;desde Reino Unido;
