Brave Fencer Musashi - Sony PlayStation 2 - New Sealed - PS2 USA;69,90 EUR;+ 29,90 EUR de envío;desde Italia;
Sony PLAYSTATION Susumu Oficial Guía Brave Fencer Musashiden Jap. JK Voz;14,90 EUR;+ 5,00 EUR de envío;desde Alemania;
Brave Fencer Musashi With Strategy Guide! PlayStation 1 Rare;135,08 EUR;+ 23,64 EUR de envío;desde Canadá;
Brave Fencer Musashi Complete Sony Playstation 1 Ps1 Tested Works;135,08 EUR;+ 13,51 EUR de envío;desde Canadá;
Sony PlayStation 1 PSOne pantalla LCD y 7 Juegos Xenogears Brave Fencer Musashi;191,55 EUR;+ 21,51 EUR de envío;desde Estados Unidos;
Brave Fencer Musashiden-Sony PlayStation 1-NTSC JAP-A-Ware;21,88 EUR;Envío internacional gratis;desde Austria;
Jeu PS1 Brave Fencer Musashiden Sony Playstation Japonais avec notice RPG;12,99 EUR;+ 6,00 EUR de envío;desde Francia;
Brave Fencer Musashiden PlayStation NTSC-J JP Import;17,99 EUR;+ 18,50 EUR de envío;desde España;
Brave Fencer Musashi - Manual;2,51 EUR;+ 19,95 EUR de envío;desde Países Bajos;
Brave Fencer Musashiden - Playstation - Japonés - 4961012987016;11,59 EUR;Envío no especificado;desde España;
