Monkey Magic: reemplazo Caja y manual (Sony PlayStation 1) sin juego!;25,87 EUR;+ 4,53 EUR de envío;desde Estados Unidos;
Monkey Magic (Sony PlayStation 1, PS1) COMPLETO FUNCIONA Probado;43,11 EUR;+ 4,53 EUR de envío;desde Estados Unidos;
Monkey Magic (Sony PlayStation 1 PS1) Game Disc Only Sunsoft Platformer;37,41 EUR;+ 9,91 EUR de envío;desde Canadá;
Monkey Magic PS1 Playstation 1 1999 ANUNCIO IMPRESO DE COLECCIÓN/cartel Auténtico Oficial!;14,22 EUR;desde Estados Unidos;
Monkey Magic Anime & Playstation 1999 Vintage Auténtico Cartel Promo Print Ad;12,93 EUR;desde Estados Unidos;
Monkey Magic Case Only NO GAME Sony PlayStation 1 PS1 Replacement Back Artwork;20,40 EUR;+ 13,31 EUR de envío;desde Canadá;
