PlayStation 1 japón NTSC-J "Agile Warrior" CD, guía & OVP;9,95 EUR;+ 5,99 EUR de envío;desde Alemania;
Jeu Playstation 1 PS1 VF  Agile Warrior F-111X avec notice Envoi rapide et suivi;24,99 EUR;+ 12,00 EUR de envío;desde Francia;
Jeu Agile Warrior F-111X pour Playstation PS1 PAL Complet CIB - Floto Games;24,90 EUR;+ 5,00 EUR de envío;desde Francia;
Agile Warrior PlayStation NTSC-J Japan Import;12,99 EUR;+ 18,50 EUR de envío;desde España;
Agile Warrior F-IIIX - PS1 Loose Version Française PlayStation Sony;19,95 EUR;+ 8,00 EUR de envío;desde Francia;
Agile Warrior F-IIIX - PS1 Complet Version Française PlayStation Sony;24,95 EUR;+ 10,00 EUR de envío;desde Francia;
Agile Warrior F-111X PS1 ita videogioco per Sony PlayStation 1 funzionante gioco;14,99 EUR;+ 18,00 EUR de envío;desde Italia;
Agile Warrior f-111x (PlayStation 1);12,00 EUR;Envío no especificado;desde Alemania;
Ps1 Agile Warrior F-IIIX OVP Sony PlayStation 1 best seller USK 18;12,89 EUR;Envío no especificado;desde Alemania;
Lote 18 Sony Juego De Playstation 1 Cd Agile Warrior Soviética Strike Gta;136,70 EUR;Envío gratis;desde Estados Unidos;
Agile Warrior F-111X (Sony PlayStation 1, 1996) PS1 COMPLETE with MANUAL! F-3X;10,11 EUR;Envío internacional gratis;desde Canadá;
Agile Warrior F-111X (Sony PlayStation 1, 1996) disc only tested working;6,76 EUR;+ 3,38 EUR de envío;desde Canadá;
Agile Warrior F-111X (Playstation 1: 1996) - $2.99 CDN Shipping !!;8,11 EUR;+ 5,40 EUR de envío;desde Canadá;
Agile Warrior F-111X (Sony PlayStation 1) Long Box, 1996, Complete & Tested PS1;27,04 EUR;+ 13,52 EUR de envío;desde Canadá;
Agile Warrior F-111X (Sony PlayStation 1, 1996) PS1 PSX PS F111X Warriors;10,68 EUR;+ 5,90 EUR de envío;desde Canadá;
Agile Warrior PS1 PLAYSTATION PS importación Japón juego de video p1;8,55 EUR;+ 14,53 EUR de envío;desde Japón;
