Lego Rock Raiders Juego PlayStation One PS1 Buenas Cond Manual PAL;7,93 EUR;Envío no especificado;desde Reino Unido;
Lego Rock Raiders | PlayStation 1 | PS1 | Sony | PAL;6,91 EUR;+ 6,99 EUR de envío;desde Reino Unido;
Lego Rock Raiders Playstation 1 PS1;8,17 EUR;+ 16,53 EUR de envío estimado;desde Reino Unido;
Lego Rock Raiders-Sony PlayStation 1-PS1;4,66 EUR;+ 16,47 EUR de envío estimado;desde Reino Unido;
Lego Rock Raiders (COMPLETO) Sony PlayStation 1, Ps1, Psone versión francesa;10,45 EUR;+ 16,58 EUR de envío estimado;desde Reino Unido;
Playstation 1 Juegos x4 un Bug's Life, Lego Rock Raiders, Bust a Move 3DX, Spice World;16,35 EUR;+ 16,68 EUR de envío estimado;desde Reino Unido;
Lego Rock Raiders Cartel Sony PlayStation 1, Ps1, Psone;6,95 EUR;+ 16,51 EUR de envío estimado;desde Reino Unido;
PLAYSTATION-Lego Rock Raiders (PAL) #DB54;8,16 EUR;+ 16,53 EUR de envío estimado;desde Reino Unido;
Lego Rock Raiders (Sony PlayStation 1, PS1, 2000);5,83 EUR;+ 18,54 EUR de envío estimado;desde Reino Unido;
Lego Rock Raiders-PlayStation 1-PS1;5,55 EUR;+ 6,41 EUR de envío;desde Reino Unido;
Lego Rock Raiders Sony Playstation 1 juego PS1;7,58 EUR;+ 21,02 EUR de envío;desde Reino Unido;
Lego Rock Raiders PS1 PlayStation 1 Juego en Caja Gran Disco;8,16 EUR;+ 16,53 EUR de envío estimado;desde Reino Unido;
Lego Rock Raiders PS1 Juego-PLAYSTATION ONE-PAL;7,58 EUR;+ 16,52 EUR de envío estimado;desde Reino Unido;
Lego Rock Raiders Play Station Playstation PAL ESPAÑOL;4,95 EUR;+ 19,95 EUR de envío;desde España;
Lego Rock Raiders (Sony Playstation 1, 2000);6,99 EUR;+ 16,51 EUR de envío estimado;desde Reino Unido;
Lego Rock Raiders Juego Para Sony PlayStation 1 PS 1 Pal Con Folleto;5,55 EUR;+ 18,62 EUR de envío estimado;desde Reino Unido;
Lego Rock Raiders Para Sony PlayStation (PS1);5,55 EUR;+ 16,49 EUR de envío estimado;desde Reino Unido;
Lego Rock Raiders Juego PlayStation One PS1;7,58 EUR;+ 16,52 EUR de envío estimado;desde Reino Unido;
Lego Rock Raiders PS1 Sony Playstation PAL completa probada Gratis P + P;6,95 EUR;+ 8,17 EUR de envío;desde Reino Unido;
Lego Rock Raiders Playstation 1;7,01 EUR;+ 16,51 EUR de envío estimado;desde Reino Unido;
Notice de Lego Rock Raiders pour Sony Playstation 1 PS1 - Floto Games;7,90 EUR;+ 6,00 EUR de envío;desde Francia;
Lego Rock Raiders-Sony Playstation One PS1 delantero embutido obra de arte;3,49 EUR;+ 16,45 EUR de envío estimado;desde Reino Unido;
Lego Rock Raiders-Sony Playstation PSONE PS1 Juego-disco solamente!!!;5,80 EUR;+ 11,66 EUR de envío;desde Reino Unido;
Lego Rock Raiders Juego PlayStation PS1 buenas condiciones Manual PAL One + cartel;11,66 EUR;Envío no especificado;desde Reino Unido;
Jeu Lego Rock Raiders- Sony Playstation Ps1 100% Fr Pal Ps One Rétro Ps2 Ps3;13,00 EUR;Envío no especificado;desde Francia;
Lego Rock Raiders PlayStation 1 Videojuegos Retro;33,95 EUR;Envío no especificado;desde España;
