Air Hockey Sony PlayStation 1 PS1 Brand New Sealed Cracked Case;17,09 EUR;Envío gratis;Vendidos  26 sep 2021Artículo vendido;desde Estados Unidos;
Air Hockey - New & Sealed - Playstation 1 - PS1;22,00 EUR;+ 25,00 EUR de envío;Vendidos  26 sep 2021Artículo vendido;desde Países Bajos;
Playstation Air Hockey Game COMPLETE;6,83 EUR;Envío gratis;Vendidos  9 sep 2021Artículo vendido;desde Estados Unidos;
✅ Air Hockey (Sony PlayStation 1, 2003) Brand New Sealed with Y-Folds;8,54 EUR;Envío gratis;Vendidos  30 ago 2021Artículo vendido;desde Estados Unidos;
Air Hockey (Sony PlayStation 1, 2003) BRAND NEW;8,50 EUR;Envío gratis;Vendidos  27 ago 2021Artículo vendido;desde Estados Unidos;
Air Hockey So Y PlayStation 1 PS1 PSX;4,89 EUR;Envío gratis;Vendidos  12 ago 2021Artículo vendido;desde Estados Unidos;
Spiderman Marvel Superhero Adventures Air Hockey Table Top Game Kids .;2,34 EUR;+ 45,06 EUR de envío estimado;Vendidos  11 jul 2021Artículo vendido;desde Reino Unido;
Mini Air Hockey Game By RED5, Travel Toy, Arcade Games;5,84 EUR;+ 34,88 EUR de envío estimado;Vendidos  13 jul 2021Artículo vendido;desde Reino Unido;
Kids Freestanding Air Hockey Paddle Pushers Pucks Toy Family Game Xmas Gift Fun ;46,79 EUR;+ 60,49 EUR de envío estimado;Vendidos  11 ago 2021Artículo vendido;desde Reino Unido;
Marvel Spiderman Air Hockey Arena  ;9,36 EUR;+ 58,47 EUR de envío estimado;Vendidos  1 ago 2021Artículo vendido;desde Reino Unido;
Air Hockey table top Game;2,93 EUR;+ 44,15 EUR de envío estimado;Vendidos  27 sep 2021Artículo vendido;desde Reino Unido;
Folding Football Table Pool Air Hockey Gaming Game Sports Foosball Indoor Soccer;35,13 EUR;+ 84,42 EUR de envío estimado;Vendidos  27 jul 2021Artículo vendido;desde Reino Unido;
Official SAM Air Hockey Puck Detector ;55,05 EUR;+ 60,64 EUR de envío estimado;Vendidos  17 sep 2021Artículo vendido;desde Reino Unido;
Table-top Neon Table Air Hockey;18,16 EUR;+ 40,68 EUR de envío estimado;Vendidos  21 sep 2021Artículo vendido;desde Reino Unido;
2x Air Hockey Table Felt Pushers Replacement Felt Pads - GREEN RED GRAY;2,80 EUR;+ 10,53 EUR de envío;Vendidos  5 jul 2021Artículo vendido;desde Reino Unido;
Marvel Avengers Air Hockey Arena (Original Now Rare) Complete In Great Condition;12,87 EUR;+ 59,26 EUR de envío estimado;Vendidos  31 jul 2021Artículo vendido;desde Reino Unido;
Power Play 20" Air Hockey Game **CLEARANCE 50% OFF!!**;11,70 EUR;+ 15,23 EUR de envío;Vendidos  19 sep 2021Artículo vendido;desde Reino Unido;
Table Hockey - Desk Air Hockey Home / Office Game Gift Children & Adults Instant;11,70 EUR;+ 21,07 EUR de envío;Vendidos  16 ago 2021Artículo vendido;desde Reino Unido;
Toyrific Power Play 28" Table Top Air Hockey Kids Adults Family Game Toy Set NEW;37,47 EUR;+ 50,66 EUR de envío estimado;Vendidos  22 sep 2021Artículo vendido;desde Reino Unido;
2 6cm Air Hockey Table Felt Pusher with 2 6cm Puck Mallet Goalies;5,84 EUR;+ 44,94 EUR de envío estimado;Vendidos  13 sep 2021Artículo vendido;desde Reino Unido;
2x Quality Air Hockey Pucks 63mm 65mm 70mm 73mm Rugby RED, BLUE, ORANGE, YELLOW;2,80 EUR;+ 11,70 EUR de envío;Vendidos  3 jul 2021Artículo vendido;desde Reino Unido;
Mini Air Hockey table;3,51 EUR;+ 44,16 EUR de envío estimado;Vendidos  19 sep 2021Artículo vendido;desde Reino Unido;
Marvel Superhero Adventures Air Hockey Arena Table Top Kids Children's Game;5,84 EUR;+ 34,53 EUR de envío estimado;Vendidos  13 ago 2021Artículo vendido;desde Reino Unido;
SAM Air Hockey Bat / Player – Red;14,06 EUR;+ 55,05 EUR de envío estimado;Vendidos  21 sep 2021Artículo vendido;desde Reino Unido;
New wooden Air Hockey;5,86 EUR;+ 43,90 EUR de envío estimado;Vendidos  6 jul 2021Artículo vendido;desde Reino Unido;
SAM Air Hockey Puck – Rugby Shaped - New Exciting Gameplay;8,20 EUR;+ 54,95 EUR de envío estimado;Vendidos  21 sep 2021Artículo vendido;desde Reino Unido;
SAM Air Hockey Puck – Orange - For Quieter Slower Games;7,03 EUR;+ 40,47 EUR de envío estimado;Vendidos  11 ago 2021Artículo vendido;desde Reino Unido;
SAM Air Hockey Puck – Yellow / Cosmic - Fast Play Puck;7,03 EUR;+ 40,47 EUR de envío estimado;Vendidos  21 sep 2021Artículo vendido;desde Reino Unido;
SAM Air Hockey Bat / Player – Blue;14,06 EUR;+ 55,05 EUR de envío estimado;Vendidos  21 sep 2021Artículo vendido;desde Reino Unido;
Air Hockey Table Pucks 63mm x 4mm. Qty 4;5,80 EUR;+ 16,55 EUR de envío estimado;Vendidos  5 jul 2021Artículo vendido;desde Reino Unido;
5Pcs 2 inch Mini Air Hockey Table Pucks 50mm Puck Children Table New D1W7;3,37 EUR;+ 2,33 EUR de envío;Vendidos  22 ago 2021Artículo vendido;desde China;
Air Hockey Replacement Felt for Bats/ Players - Official SAM Felts;4,69 EUR;+ 40,43 EUR de envío estimado;Vendidos  15 sep 2021Artículo vendido;desde Reino Unido;
SAM Air Hockey Puck – Red/ Soccer - Fastest Play Puck;7,03 EUR;+ 40,47 EUR de envío estimado;Vendidos  21 sep 2021Artículo vendido;desde Reino Unido;
Brand New Table Top Air Hockey By HY-PRO;23,43 EUR;+ 50,40 EUR de envío estimado;Vendidos  3 sep 2021Artículo vendido;desde Reino Unido;
Instant Tabletop Air Hockey Mini Table Sports Electronic Game;11,70 EUR;+ 25,76 EUR de envío;Vendidos  31 ago 2021Artículo vendido;desde Reino Unido;
Red Air Hockey Set (8 pcs. 63 mm Air Hockey Puck) V5F6;5,22 EUR;+ 2,33 EUR de envío;Vendidos  9 jul 2021Artículo vendido;desde China;
Marvel Superhero Adventures Air Hockey & Pinball Table Top Kids Childrens Game;18,68 EUR;+ 45,61 EUR de envío estimado;Vendidos  2 sep 2021Artículo vendido;desde Reino Unido;
Neon Tabletop Electronic Air Hockey Executive Arcade Sports Desk Game;11,70 EUR;+ 58,82 EUR de envío estimado;Vendidos  12 ago 2021Artículo vendido;desde Reino Unido;
Air Hockey Set Home Table Game Replacement Accessories 2-Pucks 4-Slider Pus C5S2;4,93 EUR;+ 0,90 EUR de envío;Vendidos  30 ago 2021Artículo vendido;desde China;
