Actua Ice Hockey Video Game for Sony PlayStation PS1 PAL TESTED;6,95 EUR;+16,39 EUR shipping estimate;from United Kingdom;
PS1 Actua Ice Hockey Classic Sony PlayStation 1 1998 European Version Free Post;8,10 EUR;+16,42 EUR shipping estimate;from United Kingdom;
Jeu Actua Ice Hockey pour Sony Playstation PS1 PAL Complet CIB - Floto Games;13,90 EUR;+5,00 EUR shipping;from France;
Actua Ice Hockey Classic (Sony PlayStation 1, 1998) - European Version Free P&p;12,51 EUR;+16,50 EUR shipping estimate;from United Kingdom;
Actua Ice Hockey - Sony PlayStation 1, Ps1, Psone - No Manual;6,90 EUR;+16,39 EUR shipping estimate;from United Kingdom;
Actua Ice Hockey Game Disc Only PS1 Playstation 1 Game Uk Pal;4,63 EUR;+13,91 EUR shipping;from United Kingdom;
Actua Ice Hockey - PS1 Sony Playstation One Game - PAL Complete;3,47 EUR;+20,38 EUR shipping estimate;from United Kingdom;
Actua Ice Hockey Classic (Sony PlayStation 1, 1998) - European Version;5,10 EUR;+20,08 EUR shipping estimate;from United Kingdom;
Actua Ice Hockey Classic (Sony PlayStation 1, 1998) - European Version;4,64 EUR;+18,48 EUR shipping estimate;from United Kingdom;
Actua Ice Hockey | Manual | Handbook | Sony Playstation 1 | PS1 |;2,79 EUR;+3,70 EUR shipping;from Germany;
Actua Ice Hockey for Sony PlayStation (PS1) - new sealed pal ;34,77 EUR;+6,96 EUR shipping;from United Kingdom;
Actua Ice Hockey 2 (Sony Playstation 1, 1999);49,00 EUR;Shipping not specified;from Germany;
Notice de Actua Ice Hockey 2 pour Sony Playstation 1 PS1 - Floto Games;5,90 EUR;Shipping not specified;from France;
✪ Actua Ice Hockey 2 Playstation 1 PS1 PAL BLACK LABEL NEW NEW SEALED ✪;124,99 EUR;Shipping not specified;from Germany;
Actua Ice Hockey of PlayStation | Game | CONDITION ACCEPTABLE;3,47 EUR;Shipping not specified;from Germany;
Actua Ice Hockey 2 Playstation 1 PSone Boxed Acclaim einkaufgp 1 to 2 Players;8,89 EUR;Shipping not specified;from Germany;
