Barbie Explorer - Playstation 1 - PS1;8,46 EUR;+ 19,95 EUR de envío;desde Países Bajos;
PS1 Barbie Explorer Sony PLAYSTATION Un Jeu;18,65 EUR;Envío internacional gratis;desde Reino Unido;
Barbie Explorer Playstation NEW;299,99 EUR;+ 19,99 EUR de envío;desde España;
Barbie Explorer para PlayStation 1/ps1 #1;7,99 EUR;Envío no especificado;desde Alemania;
Barbie Explorer original PlayStation 1 con embalaje original, ps1;9,99 EUR;Envío no especificado;desde Alemania;
Barbie Explorer para PlayStation 1/ps1 #2;8,99 EUR;Envío no especificado;desde Alemania;
Barbie Explorer para PlayStation 1/ps1;9,99 EUR;Envío no especificado;desde Alemania;
Barbie Explorer PlayStation 1 Videojuegos Retro;22,95 EUR;Envío no especificado;desde España;
Completa Barbie Explorer Sony PlayStation 1 PS1 Envíos Gratis US Seller-Funciona;17,20 EUR;Envío gratis;desde Estados Unidos;
Completa Barbie Explorer Sony PlayStation 1 PS1 Envíos Gratis US Seller-Funciona;19,83 EUR;Envío gratis;desde Estados Unidos;
Nuevo anuncioBarbie Explorer (Sony PlayStation 1, 2001) NO MANUAL;17,69 EUR;+ 15,40 EUR de envío;desde Canadá;
Barbie Explorer - PlayStation 1 / PS1 / PSX Game;18,14 EUR;+ 18,78 EUR de envío;desde Australia;
Barbie Explorer (Sony PlayStation 1, 2001 PS1)-Complete;36,57 EUR;+ 4,08 EUR de envío;desde Canadá;
Barbie Explorer Sony Playstation 1;27,21 EUR;+ 15,40 EUR de envío;desde Canadá;
PS1 Barbie Explorer Sony Playstation * juego One;13,98 EUR;+ 4,67 EUR de envío;desde Reino Unido;
