游꿡 Mickey's Wild Adventure-PS1-Playstation 1-Caja Grande-Raro 游꿡;29,18 EUR;+ 16,92 EUR de env칤o estimado;desde Reino Unido;
Mickey's Wild Adventure Para Sony PS1 Playstation 1 completos y en condiciones Exc;46,69 EUR;+23,34 EUR de env칤o;desde Reino Unido;
Mickey's Wild Adventure - PlayStation 1 PS1 - PAL - Complet;9,90 EUR;+14,90 EUR de env칤o;desde Francia;
Top Disney Mickey's Wild Adventure 1996 PlayStation 1 PS 1 completamente OVP juego;11,99 EUR;+3,70 EUR de env칤o;desde Alemania;
Mickey's Wild Adventure-Disco de imagen de JUEGO SONY PLAYSTATION PS1 Black Label;23,29 EUR;+15,17 EUR de env칤o;desde Reino Unido;
Mickey's Wild Adventure para PlayStation 1/ps1;11,99 EUR;Env칤o no especificado;desde Alemania;
Ps1 Mickey's Wild Adventure chicos de Mickey OVP Sony PlayStation 1 best seller;9,89 EUR;Env칤o no especificado;desde Alemania;
Mickey's Wild Adventure (PlayStation 1/ps one, PAL) en papel envolvente;3,99 EUR;Env칤o no especificado;desde Alemania;
Ps1 Mickey's Wild Adventure Sony PlayStation 1 no;5,89 EUR;Env칤o no especificado;desde Alemania;
Mickey's Wild Adventure Playstation 1 / PS1 Pal Espa침a;99,99 EUR;Env칤o no especificado;desde Espa침a;
Mickey's Wild Adventure Sony Playstation 1 Ps1 Pal;69,00 EUR;Env칤o no especificado;desde Italia;
Mickey's Wild Adventure SONY PLAYSTATION 1 PS1 PS2 Juego Con Manual PAL Reino Unido;15,17 EUR;+ 16,66 EUR de env칤o estimado;desde Reino Unido;
Mickey's Wild Adventure PS1 PlayStation 1 PAL JUEGO COMPLETO Platino Disney;16,33 EUR;+ 20,19 EUR de env칤o estimado;desde Reino Unido;
Mickey's Wild Adventure SONY PLAYSTATION 1 PS1 PS2 Juego Con Manual PAL Reino Unido;12,83 EUR;+ 18,76 EUR de env칤o estimado;desde Reino Unido;
Mickey's Wild Adventure PS1 disco de juego solamente PlayStation PAL-R치pido Gratis P&P;5,71 EUR;+ 16,49 EUR de env칤o estimado;desde Reino Unido;
Sony Playstation PS1 - Mickey's Wild Adventure - PAL;14,99 EUR;+9,00 EUR de env칤o;desde Francia;
Mickey's Wild Adventure Para Sony PS1 Playstation 1 completos y en condiciones Exc;23,35 EUR;+ 20,90 EUR de env칤o estimado;desde Reino Unido;
Mickey's Wild Adventure (Platinum Edition) Playstation 1 (PS1);10,50 EUR;+ 16,58 EUR de env칤o estimado;desde Reino Unido;
PlayStation 1 PS1 Mickey's Wild Adventure ex PAL Reino Unido CIB Platino Gratis Reino Unido P&p;11,62 EUR;+34,97 EUR de env칤o;desde Reino Unido;
Mickey's Wild Adventure + Supersponge - 2 PLAYSTATION GAMES PS1-S칩lo Discos;9,33 EUR;+12,84 EUR de env칤o;desde Reino Unido;
Mickey's Wild Adventure PlayStation 1 completo con instrucciones y embalaje;14,90 EUR;Env칤o no especificado;desde Alemania;
Sony Playstation PS1 - Mickey's Wild Adventure - CD Seul ;7,99 EUR;+3,60 EUR de env칤o;desde Francia;
Playstation PS1:Mickey's Wild Adventure [TOP PLATE-FORME 2D] Fr;14,90 EUR;+5,80 EUR de env칤o;desde Francia;
Mickey's Wild Adventure PS1 Playstation Completo Manual Probado Funcionando PAL;11,43 EUR;+ 20,68 EUR de env칤o estimado;desde Reino Unido;
Mickey's Wild Adventure Platinum-PlayStation 1 ps1, # K - 222-36;9,99 EUR;+29,00 EUR de env칤o;desde Alemania;
Mickey's Wild Adventure Sony Playstation 1 juego PS1 Platino;9,33 EUR;+21,02 EUR de env칤o;desde Reino Unido;
Mickey's Wild Adventure Playstation 1 PS1;8,76 EUR;+ 20,63 EUR de env칤o estimado;desde Reino Unido;
Mickey's Wild Adventure-Platinum versi칩n PS1 Sony Playstation One Con Manual;11,62 EUR;+ 20,69 EUR de env칤o estimado;desde Reino Unido;
Mickey's Wild Adventure-Platinum versi칩n PS1 Sony Playstation One-Sin Manual;11,62 EUR;+ 20,69 EUR de env칤o estimado;desde Reino Unido;
Nuevo anuncioDisney Mickey's Wild Adventure-PlayStation (PS1) - disco solamente-BLACK LABEL;10,50 EUR;+ 16,58 EUR de env칤o estimado;desde Reino Unido;
PS1 / Playstation 1 - Mickey's Wild Adventure en el embalaje usado COMO NUEVO;65,99 EUR;Env칤o internacional gratis;desde Alemania;
Mickey's Wild Adventure-Sony PS1 PS2 PS3 PlayStation Disc s칩lo-PAL;3,50 EUR;+ 16,45 EUR de env칤o estimado;desde Reino Unido;
Mickey's Wild Adventure Sony Playstation 1 PS1 3+ Juego De Plataformas;10,50 EUR;+11,68 EUR de env칤o;desde Reino Unido;
Disney Mickey's Wild Adventure Platino Juego Para Sony PlayStation PS1 PAL regi칩n;22,17 EUR;+ 16,79 EUR de env칤o estimado;desde Reino Unido;
Mickey's Wild Adventure / Play Station / Completo / Pal Espa침a  ;29,90 EUR;+12,00 EUR de env칤o;desde Espa침a;
Sony Playstation PS1 - Mickey's Wild Adventure - Notice / Instruction Manual;4,99 EUR;+3,80 EUR de env칤o;desde Francia;
Mickey's Wild Adventure un juego para la Playstation 1 ps1;11,66 EUR;+8,76 EUR de env칤o;desde Reino Unido;
Mickey's Wild Adventure PlayStation 1 con embalaje original, CIB ps1;19,99 EUR;Env칤o no especificado;desde Alemania;
