Family Feud-PlayStation 4 Standard Edition: Playstation 4 PS4;12,91 EUR;Envío gratis;Vendidos  28 sep 2021Artículo vendido;desde Estados Unidos;
Family Feud para PlayStation 4 [nuevo juego de video] PS 4;12,83 EUR;Envío gratis;Vendidos  27 sep 2021Artículo vendido;desde Estados Unidos;
Family Feud-PlayStation 4 Standard Edition: Playstation 4 PS4;12,04 EUR;Envío gratis;Vendidos  22 sep 2021Artículo vendido;desde Estados Unidos;
Family Feud-Sony PlayStation 4 PS4;12,04 EUR;Envío gratis;Vendidos  20 sep 2021Artículo vendido;desde Estados Unidos;
Family Feud-PlayStation 4 edición estándar;2,80 EUR;+ 6,47 EUR de envío;Vendidos  17 sep 2021Artículo vendido;desde Estados Unidos;
Family Feud-Sony PlayStation 4;12,91 EUR;+ 3,44 EUR de envío;Vendidos  14 sep 2021Artículo vendido;desde Estados Unidos;
Family Feud-Sony PlayStation 4;17,21 EUR;+ 3,57 EUR de envío;Vendidos  13 sep 2021Artículo vendido;desde Estados Unidos;
Family Feud Sony PlayStation 2 PS2 2006 completa probada limpio;3,86 EUR;Envío gratis;Vendidos  11 sep 2021Artículo vendido;desde Estados Unidos;
Family Feud-PlayStation 4;12,91 EUR;Envío gratis;Vendidos  10 sep 2021Artículo vendido;desde Estados Unidos;
Family Feud (PS4, Sony PlayStation 4, 2020) Nueva Y Sellado De Fábrica;21,48 EUR;Envío gratis;Vendidos  9 sep 2021Artículo vendido;desde Estados Unidos;
Family Feud juego de video PlayStation 4 PS4 completa limpiado/probado Envío Gratis;12,91 EUR;Envío gratis;Vendidos  6 sep 2021Artículo vendido;desde Estados Unidos;
Family Feud (Sony PlayStation PS1) Hasbro Interactivo Juego Seminuevo;7,32 EUR;Envío gratis;Vendidos  4 sep 2021Artículo vendido;desde Estados Unidos;
Family Feud para PlayStation 4 [nuevo juego de video] PS 4;21,51 EUR;Envío gratis;Vendidos  1 sep 2021Artículo vendido;desde Estados Unidos;
Family Feud juego-Playstation 2 PS2-disco solamente-Probado Y Funcionando;3,40 EUR;Envío gratis;Vendidos  31 ago 2021Artículo vendido;desde Estados Unidos;
Ubisoft Family Feud, (Playstation 4);12,91 EUR;Envío gratis;Vendidos  28 ago 2021Artículo vendido;desde Estados Unidos;
Family Feud-Sony PlayStation 4 (PS4) - Nuevo, Sellado, En Mano;10,76 EUR;Envío gratis;Vendidos  28 ago 2021Artículo vendido;desde Estados Unidos;
Family Feud Playstation PS1 Video Juego Completo;10,32 EUR;Envío gratis;Vendidos  25 ago 2021Artículo vendido;desde Estados Unidos;
Family Feud (Sony PlayStation 1, 2000) PSX PS1 Nuevo Sellado Nuevo En Caja;25,82 EUR;Envío gratis;Vendidos  9 ago 2021Artículo vendido;desde Estados Unidos;
Family Feud (PS4, Sony PlayStation 4, 2020);6,56 EUR;+ 2,75 EUR de envío;Vendidos  9 ago 2021Artículo vendido;desde Estados Unidos;
Ubisoft Family Feud, Playstation 4 PS4 ||| Envío Gratis;17,21 EUR;Envío gratis;Vendidos  7 ago 2021Artículo vendido;desde Estados Unidos;
Family Feud (Sony Playstation 2) juego en familia TV Game Show PS2 rara! completa;3,44 EUR;+ 4,18 EUR de envío;Vendidos  4 ago 2021Artículo vendido;desde Estados Unidos;
Family Feud-Sony PlayStation 2 PS2 - 2006-Completo-Probado-disco limpio;5,17 EUR;Envío gratis;Vendidos  2 ago 2021Artículo vendido;desde Estados Unidos;
Family Feud & Rueda De La Fortuna (Sony PlayStation 2 Ps2) Completa;8,61 EUR;Envío gratis;Vendidos  2 ago 2021Artículo vendido;desde Estados Unidos;
Family Feud (Sony PlayStation 2, 2006) PS2 Juego Completo;2,57 EUR;+ 3,23 EUR de envío;Vendidos  31 jul 2021Artículo vendido;desde Estados Unidos;
Family Feud juego solamente en Funda Lisa para Sony Playstation 1/PS2;5,89 EUR;Envío gratis;Vendidos  30 jul 2021Artículo vendido;desde Estados Unidos;
Family Feud (Sony PlayStation 4, 2020) PS4 Excelente condición Usado;12,48 EUR;+ 2,58 EUR de envío;Vendidos  30 jul 2021Artículo vendido;desde Estados Unidos;
Family Feud -- Standard Edition (Sony PlayStation 4, 2020) Nuevo Sellado Gratis de envío y manipulación;17,21 EUR;Envío gratis;Vendidos  26 jul 2021Artículo vendido;desde Estados Unidos;
Family Feud juego de video PlayStation 4 PS4 disco solamente;12,82 EUR;Envío gratis;Vendidos  26 jul 2021Artículo vendido;desde Estados Unidos;
Family Feud (Sony PlayStation 4, 2020) NEW + SEALED;20,26 EUR;+ 6,08 EUR de envío;Vendidos  25 jul 2021Artículo vendido;desde Canadá;
Family Feud-Sony PlayStation 4 6-5-1;14,63 EUR;Envío gratis;Vendidos  21 jul 2021Artículo vendido;desde Estados Unidos;
Family Feud, Ubisoft, Playstation 4 Nueva!! Sellado!!;8,60 EUR;+ 3,44 EUR de envío;Vendidos  19 jul 2021Artículo vendido;desde Estados Unidos;
Family Feud-Sony PlayStation 4 abierto nunca jugado;5,60 EUR;+ 4,48 EUR de envío;Vendidos  18 jul 2021Artículo vendido;desde Estados Unidos;
Family Feud Para Sony PlayStation 4 PS4 Nueva Sellado;21,92 EUR;Envío gratis;Vendidos  10 jul 2021Artículo vendido;desde Estados Unidos;
Family Feud juego de video PlayStation 4 PS4 Completa;13,69 EUR;Envío gratis;Vendidos  10 jul 2021Artículo vendido;desde Estados Unidos;
Family Feud para PlayStation 4 PS4;12,91 EUR;+ 4,18 EUR de envío;Vendidos  9 jul 2021Artículo vendido;desde Estados Unidos;
Ubisoft Family Feud, (Playstation 4);16,36 EUR;Envío gratis;Vendidos  8 jul 2021Artículo vendido;desde Estados Unidos;
Nuevo Family Feud Sony PlayStation 4 2020 PS4;18,08 EUR;Envío gratis;Vendidos  8 jul 2021Artículo vendido;desde Estados Unidos;
Family Feud juego de video Playstation PS1 caso de reemplazo completo;0,85 EUR;+ 4,13 EUR de envío;Vendidos  5 jul 2021Artículo vendido;desde Estados Unidos;
