Caesar's Palace II 2 PS1 juego Sony PlayStation 1 Ceasars Palace;5,13 EUR;+ 4,45 EUR de envío;desde Estados Unidos;
Playstation 1 Lote de 8 Juegos 3 Extreme, World Championship Wrestling Nitro, Caesar's Palace II y más;33,31 EUR;Envío gratis;desde Estados Unidos;
Caesar's Palace II PS1 Sony PlayStation Interplay;17,12 EUR;desde Estados Unidos;
Caesar's Palace II (Playstation) [081B];8,52 EUR;+ 2,99 EUR de envío;desde Estados Unidos;
Caesar's Palace II 2 🔥 manual de instrucciones Sony PS1 Playstation;5,14 EUR;Envío gratis;desde Estados Unidos;
Caesar's Palace II 2 - Cart - Gameboy Color;5,00 EUR;+ 11,00 EUR de envío;desde Países Bajos;
Caesar's Palace II (Nintendo Game Boy Color, 1999) - solo carro de trabajo;2,31 EUR;+ 19,21 EUR de envío estimado;desde Reino Unido;
