Guilty Gear esforzamos | PS5 PlayStation 5 Nuevo;46,22 EUR;+ 11,56 EUR de envío;Vendidos  21 sep 2021Artículo vendido;desde Reino Unido;
Guilty Gear esforzamos Preventa Bono Dlc código PS4/PS5 para la UE PSN-Sin juego -;4,05 EUR;Envío internacional gratis;Vendidos  20 sep 2021Artículo vendido;desde Rusia;
Guilty Gear X2 el Carnaval De Medianoche Recarga Sony Playstation 2 juego PS2;6,11 EUR;+ 20,80 EUR de envío;Vendidos  18 sep 2021Artículo vendido;desde Reino Unido;
Guilty Gear: se esfuerzan -- Standard Edition (Sony PlayStation 5, 2021);31,78 EUR;+ 16,81 EUR de envío estimado;Vendidos  14 sep 2021Artículo vendido;desde Reino Unido;
Guilty Gear: strive-ps4/PlayStation 4-nuevo con embalaje original-UE versión;64,89 EUR;+ 4,90 EUR de envío;Vendidos  13 sep 2021Artículo vendido;desde Alemania;
Guilty Gear X2 #Reload - Completo con Manual (Sony PlayStation 2, 2004);10,39 EUR;+ 18,71 EUR de envío estimado;Vendidos  12 sep 2021Artículo vendido;desde Reino Unido;
Guilty Gear Judgment juicio-UMD-PlayStation PSP Portable;6,92 EUR;+ 11,55 EUR de envío;Vendidos  12 sep 2021Artículo vendido;desde Reino Unido;
Guilty Gear Judgment para PlayStation Portable PSP NTSC-J Japonés 05158;11,55 EUR;+ 16,44 EUR de envío estimado;Vendidos  9 sep 2021Artículo vendido;desde Reino Unido;
PlayStation Portable juego Guilty Gear Judgment en OVP con centajes. Sony PSP Game;22,99 EUR;Envío no especificado;Vendidos  6 sep 2021Artículo vendido;desde Alemania;
Guilty Gear esforzamos-PS5-PlayStation 5 Juego-Excelente Estado-se esfuerzan -;32,35 EUR;+ 16,81 EUR de envío estimado;Vendidos  1 sep 2021Artículo vendido;desde Reino Unido;
Playstation 2 Juego: Guilty Gear X2 (excelente fábrica sellada condición) UK PAL PS2;98,23 EUR;+ 13,23 EUR de envío;Vendidos  1 sep 2021Artículo vendido;desde Reino Unido;
Guilty Gear Xrd Sign Playstation 3 Limited Edition USA;75,00 EUR;+ 18,00 EUR de envío;Vendidos  31 ago 2021Artículo vendido;desde España;
PS5-Guilty Gear esforzamos-PS5 PlayStation 5-Nuevo Sellado Juego De Video;35,24 EUR;Envío no especificado;Vendidos  31 ago 2021Artículo vendido;desde Reino Unido;
Guilty Gear x2 Sony PlayStation 2 ps2 juego PS 2 embalaje original RPG juego de roles bien;9,90 EUR;Envío no especificado;Vendidos  29 ago 2021Artículo vendido;desde Alemania;
Guilty Gear X2 el Carnaval De Medianoche #Reload Para Sony PlayStation PS2 Pal probado;13,86 EUR;+ 16,47 EUR de envío estimado;Vendidos  27 ago 2021Artículo vendido;desde Reino Unido;
Guilty Gear X PLUS-SONY PLAYSTATION 2 PS2 juego JAP Importación-en muy buena condición;23,08 EUR;+ 11,55 EUR de envío;Vendidos  26 ago 2021Artículo vendido;desde Reino Unido;
Gobierno Real de Camboya enorme Poster-Guilty Gear X Art Arcade De Playstation 2-ARC014;12,01 EUR;Envío gratis;Vendidos  20 ago 2021Artículo vendido;desde Estados Unidos;
PS1-Guilty Gear En Caja-Sony PlayStation 1;11,55 EUR;+ 20,48 EUR de envío estimado;Vendidos  19 ago 2021Artículo vendido;desde Reino Unido;
Guilty Gear XRD Rev 2 PS4 Playstation 4 ** GRATIS UK FRANQUEO **;20,79 EUR;+ 2,89 EUR de envío;Vendidos  17 ago 2021Artículo vendido;desde Reino Unido;
Guilty Gear ps1 PlayStation 1 PSX pal UE - 5028587083266;49,90 EUR;+ 10,00 EUR de envío;Vendidos  9 ago 2021Artículo vendido;desde Alemania;
Guilty Gear (Sony PlayStation 1) en muy buena condición;34,66 EUR;+ 13,73 EUR de envío;Vendidos  27 jul 2021Artículo vendido;desde Reino Unido;
Guilty Gear X2 - PlayStation 2 (Ps2);12,50 EUR;+ 9,50 EUR de envío;Vendidos  27 jul 2021Artículo vendido;desde Francia;
Guilty Gear X2 #RELOAD SONY PLAYSTATION 2 PS2 Juego Con Manual Pal oficiales del Reino Unido;15,01 EUR;+ 16,49 EUR de envío estimado;Vendidos  24 jul 2021Artículo vendido;desde Reino Unido;
Guilty Gear X | PlayStation 2 PS2 en muy buena condición;11,50 EUR;+ 17,34 EUR de envío;Vendidos  21 jul 2021Artículo vendido;desde Reino Unido;
Jeu Playstation 5 PS5 : Guilty Gear Strive - Neuf sous Blister;49,90 EUR;Envío no especificado;Vendidos  13 jul 2021Artículo vendido;desde Francia;
Guilty Gear X2 SONY PLAYSTATION 2 Pal-Leer descripción - * NUEVO *;56,63 EUR;Envío internacional gratis;Vendidos  11 jul 2021Artículo vendido;desde Suecia;
Núcleo de Guilty Gear XX ACENTO CORE PLUS Playstation Portable PSP Nuevo y Sellado;13,87 EUR;+ 16,47 EUR de envío estimado;Vendidos  6 jul 2021Artículo vendido;desde Reino Unido;
Guilty Gear esforzamos (PlayStation 4, 2021);40,45 EUR;+ 16,96 EUR de envío estimado;Vendidos  3 jul 2021Artículo vendido;desde Reino Unido;
Guilty Gear PS1 Jap Playstation 1 Sony Ottime condizioni;19,00 EUR;Envío no especificado;Vendidos  3 jul 2021Artículo vendido;desde Italia;
