Tony Hawk Shred Big Air Sony Playstation 3 PS3 Controlador de Juego Y Patineta Nuevo;56,01 EUR;Envío gratis;Vendidos  26 sep 2021Artículo vendido;desde Estados Unidos;
Big Air (Sony PlayStation 1, 1999) * COMPLETO * envío gratuito;5,99 EUR;Envío gratis;Vendidos  3 sep 2021Artículo vendido;desde Estados Unidos;
Tony Hawk Shred Big Air Sony Playstation 3 PS3 Controlador de Juego Y Patineta Nuevo;48,28 EUR;+ 10,22 EUR de envío;Vendidos  29 ago 2021Artículo vendido;desde Estados Unidos;
Big Air (Sony PlayStation 1, 1999);4,27 EUR;+ 2,58 EUR de envío;Vendidos  24 ago 2021Artículo vendido;desde Estados Unidos;
Lote de 2: Tony Hawk Shred Big Air Ride y trucos de juegos PS3 Playstation 3 más grande;12,93 EUR;Envío gratis;Vendidos  23 ago 2021Artículo vendido;desde Estados Unidos;
Big Air Playstation PS1 Video Juego Completo;4,29 EUR;Envío gratis;Vendidos  30 jul 2021Artículo vendido;desde Estados Unidos;
Big Air (Sony PlayStation 1, 1999) PS1 Disco Solamente ENVÍO GRATUITO RÁPIDO;3,45 EUR;Envío gratis;Vendidos  10 jul 2021Artículo vendido;desde Estados Unidos;
Big Air (Sony Playstation 1, 1999) Buenas Condiciones;6,03 EUR;Envío gratis;Vendidos  10 jul 2021Artículo vendido;desde Estados Unidos;
Tony Hawk Shred Big Air más grande truco (Sony PlayStation 3);5,86 EUR;Envío gratis;Vendidos  7 jul 2021Artículo vendido;desde Estados Unidos;
Big Air Playstation PS1 video juego completo y probado!;4,31 EUR;+ 4,48 EUR de envío;Vendidos  7 jul 2021Artículo vendido;desde Estados Unidos;
