Big Air giochi PlayStation 1 ps1 PAL ITA ;6,00 EUR;Envío no especificado;desde Italia;
Big Air-PS1 (Sony Playstation 1) COMPLETA (PAL) Black Label;4,67 EUR;+ 16,53 EUR de envío estimado;desde Reino Unido;
Sony PLAYSTATION Un Jeu Big Air PS1;11,65 EUR;Envío internacional gratis;desde Reino Unido;
Tony Hawk Shred Big Air más grande trucos Juego Playstation 3 con instrucciones PS3;5,86 EUR;+ 17,57 EUR de envío;desde Reino Unido;
Tony Hawk shred: Big Air bigger trucos-PlayStation 3 ps3 OVP + instrucciones ❎ nuevo ❎;7,99 EUR;+ 19,99 EUR de envío;desde Alemania;
58524 manual de instrucciones-Big Air-Sony PS1 Playstation 1 (1999) SLES 01531;4,67 EUR;+ 5,84 EUR de envío;desde Reino Unido;
Big Air-SONY PLAYSTATION PSONE PS1 disco de juego solamente!;3,48 EUR;+ 11,70 EUR de envío;desde Reino Unido;