Gradius Gaiden con la columna & Reg-PlayStation 1 PS1-Japón JPN-Completo;75,63 EUR;+ 22,26 EUR de envío estimado;desde Reino Unido;
Gradius Gaiden Sony Playstation PS1 PSone Jap NTSC;62,00 EUR;+ 36,00 EUR de envío;desde Francia;
Gradius Gaiden - Sony Playstation PS1 - NTSC-J JAP JAPAN - Très Bon Etat;56,90 EUR;+ 4,90 EUR de envío;desde Francia;
Gradius Gaiden The Best - Sony Playstation PS1 - Complet - NTSC-J JAP JAPAN;64,90 EUR;+ 4,90 EUR de envío;desde Francia;
Gradius Gaiden (Sony PlayStation 1) Importado JP;25,83 EUR;+ 3,44 EUR de envío;desde Estados Unidos;
PS1 Gradius Gaiden (necesita JP Consola) Usado PlayStation 1 de Japón Konami;39,51 EUR;Envío internacional gratis;desde Japón;
Gradius Gaiden PS1 KONAMI Sony Playstation 1 de Japón;30,99 EUR;+ 17,22 EUR de envío;desde Japón;
KONAMI Gradius Gaiden versión japonesa Sony PlayStation 1 PS1 envío desde Japón;50,36 EUR;Envío internacional gratis;desde Japón;
PS1 Gradius Gaiden Usado PlayStation 1 Japón Konami;50,79 EUR;Envío internacional gratis;desde Japón;
PS1 Gradius Gaiden PlayStation 1 KONAMI NTSC-J;63,16 EUR;Envío internacional gratis;desde Japón;
Gradius Gaiden PS1 Sony Playstation Colección de importación de Japón #1545;77,47 EUR;Envío internacional gratis;desde Japón;
Gradius Gaiden (Side Story) con la columna tarjeta PS1 Sony PlayStation Konami;68,86 EUR;+ 15,50 EUR de envío;desde Japón;
Sony PlayStation 1 Gradius Gaiden Juego De Disparos Konami SLPM 86042 Japón JP NTSC-J;65,43 EUR;Envío internacional gratis;desde Japón;
Gradius Gaiden + Tarjeta de la columna "buenas condiciones" Sony PS1 Playstation Japón;71,59 EUR;+ 12,05 EUR de envío;desde Japón;
PS1 Gradius Gaiden la mejor columna vertebral * Playstation para 8138 p1 JP System;51,66 EUR;+ 14,64 EUR de envío;desde Japón;
Muy Bueno + Gradius Gaiden PlayStation PS1 NTSC-J Cartucho en caja Japón importado Sony Shooter;48,91 EUR;+ 17,22 EUR de envío;desde Japón;
Gradius Gaiden SONY PLAYSTATION PSX PS2 PS1, PS2 Reg Tarjeta + Tarjeta de la columna vertebral;86,08 EUR;+ 17,22 EUR de envío;desde Japón;
PS1 Gradius Gaiden (necesita JP Consola) Usado PlayStation 1 de Japón Konami;44,82 EUR;Envío internacional gratis;desde Japón;
Gradius Gaiden un PS1 KONAMI Sony Playstation 1 de Japón;36,16 EUR;+ 17,22 EUR de envío;desde Japón;
Gradius Gaiden PS la mejor versión Japón Playstation 1 PS1 Muy Buen Estado!;42,01 EUR;+ 9,30 EUR de envío;desde Japón;
PS1 Gradius Gaiden PlayStation 1 de Japón Konami;63,70 EUR;Envío internacional gratis;desde Japón;
Gradius Gaiden Playstation PS importación Japón;76,19 EUR;+ 15,50 EUR de envío;desde Japón;
Gradius Gaiden PS1 KONAMI Sony Playstation 1 de Japón;32,86 EUR;+ 12,48 EUR de envío;desde Japón;
! nuevo! Gradius Gaiden PS Libros jugar PS1 con One Obi Konami de Station Jp;220,40 EUR;+ 17,12 EUR de envío;desde Japón;
Nuevo anuncioSoftware de juegos retro Ps Gradius Gaiden Playstation;69,93 EUR;+ 17,22 EUR de envío;desde Japón;
Usado PS1 PlayStation 1 Gradius Gaiden (idioma/japonés);36,16 EUR;+ 17,22 EUR de envío;desde Japón;
Gradius Gaiden PS One Libros PS importación Japón;63,28 EUR;+ 15,50 EUR de envío;desde Japón;
Konami Sony PlayStation 1 Gradius Gaiden PS1 JP juego Muy Buena;64,56 EUR;+ 17,22 EUR de envío;desde Japón;
Gradius Gaiden PS Libros jugar PS1 Konami One FS de JP Station;48,21 EUR;+ 17,12 EUR de envío;desde Japón;
PS1 PlayStation 1 Gradius Gaiden (idioma/japonés);48,90 EUR;+ 12,48 EUR de envío;desde Japón;
Nuevo anuncioGradius Gaiden (PlayStation el mejor) [Importación de Japón] de Japón;133,92 EUR;+ 12,21 EUR de envío;desde Japón;
Gradius Gaiden PS1 Playstation para 6118 p1 JP System;60,26 EUR;+ 14,64 EUR de envío;desde Japón;
Gradius Gaiden PS1 KONAMI KCET Playstation el mejor envío gratis 1997 Japonés Usado;32,71 EUR;+ 12,05 EUR de envío;desde Japón;
PS1 Playstation Gradius Gaiden PS1 KONAMI Play Station Importado de Japón F/S;34,43 EUR;Envío internacional gratis;desde Japón;
Usado PS1 PS PlayStation 1 Gradius Gaiden 61208 Japón Importación;42,98 EUR;+ 3,62 EUR de envío;desde Japón;
Gradius Gaiden PlayStation el mejor PS1 Sony Playstation Importado De Japón #1546;43,43 EUR;Envío internacional gratis;desde Japón;
Gradius Gaiden "buenas condiciones" Sony PS1 Playstation Japón;68,00 EUR;Envío internacional gratis;desde Japón;
KONAMI Gradius Gaiden PS1 Sony Playstation Shooter juego CD-ROM 1998 Vic Viper;45,18 EUR;+ 12,91 EUR de envío;desde Japón;
PS1 Gradius Gaiden PlayStation 1;43,17 EUR;+ 3,44 EUR de envío;desde Japón;
Gradius Gaiden (PlayStation el mejor) [Importación de Japón];117,60 EUR;+ 11,84 EUR de envío;desde Japón;
Gradius Gaiden Sony Play PS PS1 Konami Usado Japón Station F/S 1997 Retro Juego;55,95 EUR;+ 17,22 EUR de envío;desde Japón;
PlayStation -- Gradius Gaiden -- Tarjeta de la columna vertebral. PS1. Japón Juego. funciona completamente. 18489;38,74 EUR;+ 8,61 EUR de envío;desde Japón;
PS1 Gradius Gaiden Usado PlayStation 1 Japón Envío gratuito de Konami;45,24 EUR;Envío internacional gratis;desde Japón;
PS1 PlayStation 1 Gradius Gaiden versión japonesa/de Japón;35,17 EUR;+ 14,21 EUR de envío;desde Japón;
PS1 Gradius Gaiden PS PlayStation 1 seguimiento de Japón F/S;66,20 EUR;Envío internacional gratis;desde Japón;
Juego suave Gradius Gaiden KONAMI PlayStation 1997 Japón Juego de disparos Hobby A3897;72,31 EUR;Envío internacional gratis;desde Japón;
Gradius Gaiden PS1 Sony Playstation Colección de importación de Japón;55,10 EUR;Envío internacional gratis;desde Japón;
