David Beckham Soccer (Playstation PS1) Play probado.;4,30 EUR;+ 2,58 EUR de envío;Vendidos  3 sep 2021Artículo vendido;desde Estados Unidos;
Sony Playstation 1 PS1 Consola Juego-David Beckham Soccer incluso Manual;3,40 EUR;+ 10,40 EUR de envío;Vendidos  12 ago 2021Artículo vendido;desde Reino Unido;
David Beckham Soccer Nintendo Game Boy Advance Video Juego Cartucho;1,14 EUR;+ 32,40 EUR de envío estimado;Vendidos  3 jul 2021Artículo vendido;desde Reino Unido;
Nintendo Gameboy Advance-David Beckham Soccer-Completo;2,89 EUR;+ 19,86 EUR de envío estimado;Vendidos  25 sep 2021Artículo vendido;desde Reino Unido;
David Beckham Soccer Nintendo Game Boy Advance;1,72 EUR;+ 17,36 EUR de envío estimado;Vendidos  18 ago 2021Artículo vendido;desde Reino Unido;
3 X Game Boy Advance Juegos-trampa, Tekken Advance, David Beckham Soccer;4,91 EUR;+ 34,40 EUR de envío estimado;Vendidos  24 ago 2021Artículo vendido;desde Reino Unido;
Probado XBOX Juego -: David Beckham Soccer;2,54 EUR;+ 16,27 EUR de envío estimado;Vendidos  7 jul 2021Artículo vendido;desde Reino Unido;
