The Jungle Book Groove Party - Playstation 2 - PS2;2,51 EUR;+ 19,95 EUR de envío;desde Países Bajos;
The Jungle Book Groove Party Promo Version - Playstation 1 Ps1 Ps2 Ps3 Game Disc;24,90 EUR;+ 7,00 EUR de envío;desde Francia;
Walt Disneys The Jungle Book: Groove Party NEW - Playstation 2 - PS2;20,96 EUR;+ 19,95 EUR de envío;desde Países Bajos;
Walt Disney's The Jungle Book: Groove Party - Playstation 2 - PS2;2,51 EUR;+ 19,95 EUR de envío;desde Países Bajos;
Walt Disney's The Jungle Book: Groove Party - Playstation 1 - PS1;5,06 EUR;+ 19,95 EUR de envío;desde Países Bajos;
The Jungle Book Groove Party Promo Versión - PLAYSTATION 1 Ps1 Ps2 PS3 Game;30,13 EUR;+ 7,00 EUR de envío;desde Francia;
Walt Disney's The Jungle Book: Groove parte para Sony Playstation 2 (nuevo Y Sellado);12,81 EUR;+ 12,83 EUR de envío;desde Reino Unido;
The Jungle Book Rhythm N' Groove Dance Pack Sony Playstation# Dance Mat#Nib;69,00 EUR;+ 30,00 EUR de envío;desde Italia;
