Macross Digital Mission VF-X PlayStation NTSC-J Japan Import;14,99 EUR;+ 18,50 EUR de envío;desde España;
Macross Digital Mission VF-X-Sony PlayStation 1-NTSC JAP-B-Ware;10,92 EUR;+ 0,99 EUR de envío;desde Austria;
Macross Digital Mission VF-X Jeu Sony Playstation 1 Version NTSC-J (Japon);12,99 EUR;+ 6,00 EUR de envío;desde Francia;
Macross Digital Mission VF-X Sony Playstation 1 PS1 one NTSC J JAP videogame old;11,00 EUR;+ 17,00 EUR de envío;desde Italia;
Macross Digital Mission VF-X - Playstation PS1 NTSC-J Japan Mech Action Game;25,00 EUR;+ 15,02 EUR de envío;desde Australia;
Macross Digital Mission VF-X [SLPS 00386];44,90 EUR;Envío internacional gratis;desde Francia;
