Evo's Space Adventure Para Playstation PS1 PSone-UK-Envío rápido;6,95 EUR;+ 16,39 EUR de envío estimado;desde Reino Unido;
Evo's Space Adventures (Cd Only) - PlayStation 1 (Ps1);7,90 EUR;+ 5,95 EUR de envío;desde Francia;
Evo's Space Adventure (Sony PlayStation 1, 1999) - Versión de Europa;5,79 EUR;+ 16,38 EUR de envío estimado;desde Reino Unido;
Evo's Space Adventure (Sony PlayStation 1, 1999) -;3,47 EUR;+ 16,34 EUR de envío estimado;desde Reino Unido;
Evo's Space Adventure SONY PLAYSTATION 1 ps1 PAL Coleccionistas De Menta;26,66 EUR;+ 6,96 EUR de envío;desde Reino Unido;
Jeu Evo's Space Adventures pour Sony Playstation PS1 PAL Complet - Floto Games;16,90 EUR;Envío no especificado;desde Francia;
Evo's Space Adventure SONY PLAYSTATION 1 ps1 PAL Coleccionistas De Menta;35,52 EUR;Envío internacional gratis;desde Reino Unido;
Evo's Space Adventures - Playstation 1 - PS1;8,00 EUR;+ 25,00 EUR de envío;desde Países Bajos;
Evo's Space Adventure;3,09 EUR;+ 40,00 EUR de envío;desde Francia;
