Sony PlayStation 1 "JoJo's Bizarre Adventure" PS1 1999 con Obi NTSC-J Japón #00129;49,14 EUR;Envío internacional gratis;Vendidos  9 sep 2021Artículo vendido;desde Japón;
JoJo's Bizarre Adventure Anime Tarot Cards UK;10,50 EUR;+ 4,66 EUR de envío;Vendidos  2 oct 2021Artículo vendido;desde Reino Unido;
JoJo's Bizarre Adventure Anime Inspired Necklace UK;5,83 EUR;+ 4,66 EUR de envío;Vendidos  30 sep 2021Artículo vendido;desde Reino Unido;
Anime Dakimakura JoJo's Bizarre Adventure Kujo Jotaro Hug Body Pillow Case Cover;22,17 EUR;+ 3,49 EUR de envío;Vendidos  10 sep 2021Artículo vendido;desde China;
JoJo's Bizarre Adventure Kujou Jotarou Card Tarot Cosplay Game Prop 31pcs;16,32 EUR;+ 3,50 EUR de envío;Vendidos  1 oct 2021Artículo vendido;desde China;
12pcs JoJo's Bizarre Adventure Earring Pin Necklace Keychain Pendant set ;23,34 EUR;+ 2,34 EUR de envío;Vendidos  29 sep 2021Artículo vendido;desde China;
JoJo's Bizarre Adventure Ichiban Kuji - Prize G - Glass Plate - Blind Box;15,17 EUR;+ 19,58 EUR de envío estimado;Vendidos  10 ago 2021Artículo vendido;desde Reino Unido;
JoJo's Bizarre Adventure Necklace Ear-ring Rings Pins Gift Set Package;23,34 EUR;+ 21,52 EUR de envío estimado;Vendidos  20 jul 2021Artículo vendido;desde Reino Unido;
Anime JoJo's Bizarre Adventure Brooch Glitter Enamel - Josuke Higashikata;8,74 EUR;+ 16,54 EUR de envío estimado;Vendidos  27 jul 2021Artículo vendido;desde Reino Unido;
JoJo's Bizarre Adventure Part III Hierophant Green Figure Medicos New;105,06 EUR;+ 23,00 EUR de envío estimado;Vendidos  23 jul 2021Artículo vendido;desde Reino Unido;
Ichiban Kuji JoJo's Bizarre Adventure : Diamond  Prize A Killer Queen ;90,00 EUR;+ 12,30 EUR de envío;Vendidos  13 jul 2021Artículo vendido;desde Francia;
31pcs JoJo's Bizarre Adventure Tarot Cards - UK Seller;12,83 EUR;+ 16,63 EUR de envío estimado;Vendidos  2 oct 2021Artículo vendido;desde Reino Unido;
JoJo's Bizarre Adventure goodies manga;20,00 EUR;+ 8,00 EUR de envío;Vendidos  24 jul 2021Artículo vendido;desde Francia;
JoJo's Bizarre Adventure Jonathan Joestar Nendoroid Medicos Ent. NEW. PRE-ORDER;54,90 EUR;+ 6,90 EUR de envío;Vendidos  22 sep 2021Artículo vendido;desde España;
JoJo's Bizarre Adventure Part 2 Chozo Kado (Kars) Medicos Ent. NEW.PRE-ORDER;85,90 EUR;+ 6,90 EUR de envío;Vendidos  22 sep 2021Artículo vendido;desde España;
Anime Dakimakura JoJo's Bizarre Adventure Johnny Joestar Hug Body Pillow Case ;22,17 EUR;+ 3,49 EUR de envío;Vendidos  11 ago 2021Artículo vendido;desde China;
Repro case with cover and JoJo's Bizarre Adventure PAL manual for Sony PS1.;20,00 EUR;Envío no especificado;Vendidos  17 sep 2021Artículo vendido;desde Italia;
