Blue's Big Musical-PS1 PlayStation 1 Black Label disco de juego y solo manual;8,35 EUR;Envío gratis;desde Estados Unidos;
Blue's Big Musical-PS1 PlayStation 1 completo muy buenas Black Label Juego Envío Gratuito;9,90 EUR;Envío gratis;desde Estados Unidos;
Blue's Clues "Blue's Big Musical" jugar 1 Juego Para 1 o Station 2 jugadores Completo En Caja;5,12 EUR;+ 3,20 EUR de envío;desde Estados Unidos;
Blue's Clues Blue's Big Musical (Sony PlayStation 1, 2001 PS1)-Complete;13,52 EUR;+ 4,06 EUR de envío;desde Canadá;
Blue's Big Musical (Playstation Ps1) Black Label Completo Excelente;6,79 EUR;+ 4,44 EUR de envío;desde Estados Unidos;
Blue's Clues: Blue's Big Musical (Sony PlayStation 1, 2001) FREE SHIP IN CANADA;10,14 EUR;+ 7,21 EUR de envío;desde Canadá;
