Duke Nukem tierra de la Babes & Tiempo para matar-PS1 PlayStation 1;17,51 EUR;+ 20,79 EUR de envío estimado;Vendidos  1 oct 2021Artículo vendido;desde Reino Unido;
Duke Nukem-Land of the Babes-Sony ps1-PlayStation 1-Disc-juego;10,79 EUR;Envío no especificado;Vendidos  30 sep 2021Artículo vendido;desde Alemania;
Duke Nukem Para PS1 Sony PlayStation 1 disco y manual sólo probado y de trabajo;8,16 EUR;+ 16,53 EUR de envío estimado;Vendidos  29 sep 2021Artículo vendido;desde Reino Unido;
Duke Nukem : time to kill- Playstation- Neuf sous blister d'origine;58,80 EUR;Envío no especificado;Vendidos  29 sep 2021Artículo vendido;desde Francia;
Duke Nukem tiempo para matar Sony PlayStation 1 PS1 PAL COMPLETO Black Label;11,56 EUR;+ 16,60 EUR de envío estimado;Vendidos  29 sep 2021Artículo vendido;desde Reino Unido;
Duke Nukem Time to Kill ps1 PlayStation 1 nuevo embalaje original Read;55,00 EUR;+ 20,00 EUR de envío;Vendidos  25 sep 2021Artículo vendido;desde Alemania;
187679 Duke Nukem 3d Game PC n64 PlayStation Xbox wall poster Print cartel;12,95 EUR;+ 9,95 EUR de envío;Vendidos  24 sep 2021Artículo vendido;desde China;
Duke Nukem Forever (Sony PlayStation 3, 2011) - Versión Europea;1,16 EUR;+ 33,22 EUR de envío estimado;Vendidos  24 sep 2021Artículo vendido;desde Reino Unido;
PS1 PLAYSTATION PAL Duke Nukem tierra del bajo 730;14,01 EUR;Envío internacional gratis;Vendidos  23 sep 2021Artículo vendido;desde Reino Unido;
Duke Nukem Playstation 1 PS1;12,83 EUR;+ 16,63 EUR de envío estimado;Vendidos  22 sep 2021Artículo vendido;desde Reino Unido;
Duke Nukem: Time to Kill (Sony PlayStation 1, 1999);8,74 EUR;+ 18,41 EUR de envío estimado;Vendidos  22 sep 2021Artículo vendido;desde Reino Unido;
Duke Nukem-un tiempo para matar-SONY PSONE PS1 PLAYSTATION disco de juego solamente!;4,64 EUR;+ 11,66 EUR de envío;Vendidos  22 sep 2021Artículo vendido;desde Reino Unido;
Duke Nukem Forever para Sony Playstation 3 PS3 completo-Ver Oferta!;4,03 EUR;+ 16,46 EUR de envío estimado;Vendidos  22 sep 2021Artículo vendido;desde Reino Unido;
Duke Nukem: Time to Kill PLAYSTATION PS1 PAL JUEGO Completo con Manual Gratis P&P;9,33 EUR;+ 16,56 EUR de envío estimado;Vendidos  21 sep 2021Artículo vendido;desde Reino Unido;
Duke Nukem Forever (Sony PlayStation 3, 2011);5,84 EUR;+ 16,50 EUR de envío estimado;Vendidos  19 sep 2021Artículo vendido;desde Reino Unido;
Duke Nukem tierra de la Babes-Sony PlayStation 1/PS1-Excelente Estado.;10,50 EUR;+ 20,61 EUR de envío estimado;Vendidos  17 sep 2021Artículo vendido;desde Reino Unido;
Duke Nukem Time to Kill ps1 VGA Wata? NTSC Sony PlayStation nuevo New sealed OVP;211,00 EUR;+ 25,00 EUR de envío;Vendidos  17 sep 2021Artículo vendido;desde Alemania;
Duke Nukem Forever (Uncut) ps3, USK: a partir de 18 años para PlayStation 3 Super Action;14,95 EUR;+ 14,99 EUR de envío;Vendidos  16 sep 2021Artículo vendido;desde Alemania;
Duke Nukem Forever PS3 SONY PLAYSTATION 3 Juego;3,49 EUR;+ 18,59 EUR de envío estimado;Vendidos  12 sep 2021Artículo vendido;desde Reino Unido;
Duke Nukem Forever-Sony Playstation 3-PS3 Discos Sin Rasguños;4,66 EUR;+ 16,47 EUR de envío estimado;Vendidos  11 sep 2021Artículo vendido;desde Reino Unido;
Duke Nukem: Time to Kill PS1 Playstation 1 en Caja * Probado *;6,41 EUR;+ 16,50 EUR de envío estimado;Vendidos  10 sep 2021Artículo vendido;desde Reino Unido;
Duke Nukem Total Meltdown (Sony PlayStation 1, 1997) - Versión Europea;15,17 EUR;+ 13,43 EUR de envío;Vendidos  10 sep 2021Artículo vendido;desde Reino Unido;
Duke Nukem Forever Sony Playstation PS 3 ps3 juego OVP como nuevo probado;5,69 EUR;+ 7,39 EUR de envío;Vendidos  10 sep 2021Artículo vendido;desde Alemania;
Duke Nukem tiempo para matar Sony Playstation 1;8,16 EUR;Envío no especificado;Vendidos  9 sep 2021Artículo vendido;desde Reino Unido;
Jeu PS1 Duke Nukem land of the babes Sony Playstation 1 PAL FRA Disque seul;5,99 EUR;+ 3,00 EUR de envío;Vendidos  8 sep 2021Artículo vendido;desde Francia;
Duke Nukem SONY PLAYSTATION PS1 Juego Black Label Completo & probado en muy buena condición;8,76 EUR;+ 18,68 EUR de envío estimado;Vendidos  8 sep 2021Artículo vendido;desde Reino Unido;
Duke Nukem Forever Sony Playstation PS 3 ps3 juego OVP como nuevo probado;5,69 EUR;+ 7,39 EUR de envío;Vendidos  7 sep 2021Artículo vendido;desde Alemania;
PS3 Duke Nukem Forever-SONY PLAYSTATION disco solamente probado Funcionando;3,26 EUR;+ 16,45 EUR de envío estimado;Vendidos  6 sep 2021Artículo vendido;desde Reino Unido;
Playstation 3 Ps3 tres Juego. Sony. Duke Nukem Forever;3,13 EUR;+ 30,62 EUR de envío estimado;Vendidos  5 sep 2021Artículo vendido;desde Reino Unido;
Duke Nukem tierra de las chicas por Sony Playstation 1 PS1 Nuevo y sellado de fábrica;25,67 EUR;+ 23,34 EUR de envío;Vendidos  5 sep 2021Artículo vendido;desde Reino Unido;
Duke Nukem Forever (Sony PlayStation 3, 2011) Ps3-MBC-Completo;4,67 EUR;+ 14,01 EUR de envío;Vendidos  2 sep 2021Artículo vendido;desde Reino Unido;
Duke Nukem Time to Kill ps1 NTSC Sony PlayStation 1 nuevo New sealed OVP;149,00 EUR;+ 20,00 EUR de envío;Vendidos  2 sep 2021Artículo vendido;desde Alemania;
Duke Nukem: Forever (PS3) Sony PlayStation 3 Video Juego;2,32 EUR;+ 18,75 EUR de envío estimado;Vendidos  1 sep 2021Artículo vendido;desde Reino Unido;
Duke Nukem Total Meltdown (Sony PlayStation 1, 1997) - Versión Europea;57,21 EUR;+ 21,52 EUR de envío estimado;Vendidos  1 sep 2021Artículo vendido;desde Reino Unido;
Duke Nukem: Time to Kill Sony PlayStation PS1;3,76 EUR;+ 32,96 EUR de envío estimado;Vendidos  24 ago 2021Artículo vendido;desde Reino Unido;
Duke Nukem Forever (Sony PlayStation 3, 2011) Ps3-MBC-Completo;4,65 EUR;+ 16,47 EUR de envío estimado;Vendidos  23 ago 2021Artículo vendido;desde Reino Unido;
Duke Nukem-ps1-PlayStation 1-UK/pal-cib-completamente;14,00 EUR;Envío no especificado;Vendidos  22 ago 2021Artículo vendido;desde Alemania;
Duke Nukem: Time to Kill (COMPLETO) Sony PlayStation 1, Ps1, Psone;10,45 EUR;Envío no especificado;Vendidos  22 ago 2021Artículo vendido;desde Reino Unido;
Duke Nukem-tierra de la Babes PS1 (Sony PlayStation 1) 2001 PAL;9,92 EUR;+ 18,35 EUR de envío estimado;Vendidos  20 ago 2021Artículo vendido;desde Reino Unido;
Duke Nukem: Time to Kill (Sony PlayStation 1, 1999);8,16 EUR;+ 18,67 EUR de envío estimado;Vendidos  20 ago 2021Artículo vendido;desde Reino Unido;
Duke Nukem Forever (Sony PlayStation 3, 2011);3,79 EUR;+ 16,45 EUR de envío estimado;Vendidos  19 ago 2021Artículo vendido;desde Reino Unido;
