Action Bass (Sony PlayStation 1, 2000, keep Case);8,95 EUR;+ 7,00 EUR de envío;desde Alemania;
Action Bass para PlayStation 1/ps1 #2;4,90 EUR;+ 9,99 EUR de envío;desde Alemania;
Action Bass für Playstation 1 / PS1;12,99 EUR;+ 15,10 EUR de envío;desde Austria;
Ps1 Action Bass OVP PlayStation 1 best seller;3,89 EUR;Envío no especificado;desde Alemania;
Sony Playstation - Action Bass - Take Two - PS1;9,90 EUR;+ 35,00 EUR de envío;desde Italia;
Action Bass para PlayStation 1/ps1;4,44 EUR;+ 9,99 EUR de envío;desde Alemania;
Action Bass Sony Playstation PS 1 ps1 juego muy bien probado;4,99 EUR;+ 9,99 EUR de envío;desde Alemania;
Action Bass Sony Playstation PS 1 ps1 juego muy bien probado;4,99 EUR;+ 9,99 EUR de envío;desde Alemania;
Jeu Ps1 Action Bass Ensemble Complet Playstation ;26,89 EUR;+ 39,00 EUR de envío;desde Francia;
💥 Action Bass + Saltwater fishing 💥 muy bien 💥 ps1 PlayStation PSX;9,98 EUR;Envío no especificado;desde Alemania;
Fishermans Bait Action Bass Sony PlayStation 1 ps1 juego PS 1 bundle pescar;24,90 EUR;Envío no especificado;desde Alemania;
Ps1-PlayStation ► Action Bass ◄ top estado!;7,95 EUR;Envío no especificado;desde Alemania;
Action Bass-PlayStation ps1;5,90 EUR;Envío no especificado;desde Alemania;
