Disney's Mulan aventura interactiva PS1 Nuevo Playstation 1 stufio Historia Original;34,27 EUR;+ 4,45 EUR de envío;desde Estados Unidos;
Disney's Mulan aventura interactiva Sony PlayStation 1 PS1 Cartucho Completo En Caja Probado;7,70 EUR;+ 4,27 EUR de envío;desde Estados Unidos;
PS1 Playstation Disney's Mulan historia Studio disco solo crear y Jugar Juego;6,84 EUR;+ 7,07 EUR de envío;desde Estados Unidos;
Disney's Verhalenstudio: Disney's Mulan PS1 Playstation 1;3,46 EUR;+ 20,00 EUR de envío;desde Países Bajos;
Sony PlayStation Disney's Mulan historia Studio aventura interactiva clasificado E **;4,27 EUR;+ 3,43 EUR de envío;desde Estados Unidos;
Nintendo Game Boy Disney's Mulan EUR Excellent état;6,90 EUR;+ 11,98 EUR de envío;desde Francia;
