Einhänder Sony Playstation PS1 PSone Japan NTSC;48,00 EUR;+ 36,00 EUR de envío;desde Francia;
EINHANDER Einhänder PS1 PSX completo con lomo cuadrado Shooter Playstation Sony;57,78 EUR;+ 11,55 EUR de envío;desde Reino Unido;
EINHANDER Einhänder Ntsc U/C ps1 juego Sony PlayStation 1 Muy Raro;346,72 EUR;Envío no especificado;desde Alemania;
Einhänder SONY PLAYSTATION PSX PS2 Tarjeta de la columna vertebral;43,04 EUR;+ 17,22 EUR de envío;desde Japón;
Einhänder SONY PLAYSTATION PSX PS2 Tarjeta de la columna vertebral.;43,04 EUR;+ 17,22 EUR de envío;desde Japón;
Anuncio de publicidad de impresión de video juego Einhänder 1997 Playstation;12,87 EUR;Envío gratis;desde Estados Unidos;
Anuncio impreso de video juego Einhänder Arte raro duro encontrar PS1 Playstation 1997;8,61 EUR;+ 4,30 EUR de envío;desde Estados Unidos;
Einhänder [SLPS 01008];91,50 EUR;Envío internacional gratis;desde Francia;
