Casper ps1 playstation;5,00 EUR;+ 12,90 EUR de envío;desde Francia;
Casper y el trío fantasmal Juego De Video Para Sony PlayStation PS2 Pal probado;4,63 EUR;+ 16,36 EUR de envío estimado;desde Reino Unido;
Casper y el trío fantasmal PLAYSTATION 2 PS2 PAL JUEGO Completo con Manual;5,79 EUR;+ 16,38 EUR de envío estimado;desde Reino Unido;
Casper y el trío fantasmal (Sony PlayStation 2, 2007) - Versión Europea;4,05 EUR;+ 16,35 EUR de envío estimado;desde Reino Unido;
Casper y el trío fantasmal Sony PlayStation 2 PS2 200 3+ GRATIS UK FRANQUEO;6,95 EUR;+ 16,39 EUR de envío estimado;desde Reino Unido;
Casper PS1 PlayStation 1 PAL JUEGO COMPLETO RARO Haunting desafío 3D;23,13 EUR;+ 9,28 EUR de envío;desde Reino Unido;
Playstation 1-Casper amigo de todo el mundo Ps1 Juego;5,79 EUR;+ 33,94 EUR de envío estimado;desde Reino Unido;
Casper y el trío fantasmal PLAYSTATION 2 juego PS2 PAL Completo con Manual;4,05 EUR;+ 16,35 EUR de envío estimado;desde Reino Unido;
Casper y el trío fantasmal-PS2-Playstation 2;2,03 EUR;+ 7,65 EUR de envío;desde Reino Unido;
Retro SONY PLAYSTATION 1/PS1 Casper: amigos de todo el mundo juegos/gaming 99P;1,15 EUR;+ 23,13 EUR de envío;desde Reino Unido;
Casper y el trío fantasmal-PLAYSTATION 2 libre UK FRANQUEO;4,58 EUR;+ 16,36 EUR de envío estimado;desde Reino Unido;
Casper un inquietante desafío 3D (COMPLETO) Sony Playstation 1, Ps1, Psone;15,06 EUR;+ 16,55 EUR de envío estimado;desde Reino Unido;
Casper: amigos de todo el mundo PLAYSTATION PS1 PAL JUEGO Completo con Manual;11,58 EUR;+ 16,49 EUR de envío estimado;desde Reino Unido;
Casper amigos de todo el mundo PS1 (completo) fantasma Sony PlayStation raro en muy buena condición;9,86 EUR;+ 6,95 EUR de envío;desde Reino Unido;
Casper: un inquietante desafío 3d con Manual Sony Playstation 1 con Manual PS1;15,06 EUR;+ 16,55 EUR de envío estimado;desde Reino Unido;
PS1 Juego, Playstation, Casper, Completa One;10,67 EUR;+ 16,46 EUR de envío estimado;desde Reino Unido;
Casper y el trío fantasmal Sony Playstation 2 PAL PS2 Video Juego;2,08 EUR;+ 18,62 EUR de envío estimado;desde Reino Unido;
Casper y el trío fantasmal-Sony PS2 Playstation 2 suministra completo (FREEPOST);3,19 EUR;+ 16,34 EUR de envío estimado;desde Reino Unido;
PLAYSTATION Casper Friends Around The World COMPLEET English Fra Deutsch Esp Ita;3,49 EUR;+ 10,44 EUR de envío;desde Países Bajos;
Casper-PS1-Sony Playstation PAL juego-completo-Case roto (004);5,79 EUR;+ 20,44 EUR de envío estimado;desde Reino Unido;
PS2 Casper Spirit Dimensions FRA CD état Neuf Playstation 2;8,90 EUR;+ 14,98 EUR de envío;desde Francia;
Casper Friends around the world PlayStation 1 ps1 PSX pal CD muy bien;19,90 EUR;+ 10,00 EUR de envío;desde Alemania;
Casper y el trío fantasmal-Playstation 2 PS2-PAL UK - 5051272000651;5,79 EUR;+ 16,38 EUR de envío estimado;desde Reino Unido;
Casper PLAYSTATION PS1 PS2;23,18 EUR;+ 12,75 EUR de envío;desde Reino Unido;
Casper Et Le Trio Fantôme - Sony PlayStation 2/Ps2;10,90 EUR;+ 3,00 EUR de envío;desde Francia;
Casper: un desafío 3D Haunting (Sony PlayStation 1, 1996);23,19 EUR;+ 20,75 EUR de envío estimado;desde Reino Unido;
Casper espíritu dimensiones PS2 PlayStation 2 Video Juego;8,86 EUR;+ 16,43 EUR de envío estimado;desde Reino Unido;
Casper y el trío fantasmal PLAYSTATION 2 juego PS2 PAL Completo con Manual;5,25 EUR;+ 16,37 EUR de envío estimado;desde Reino Unido;
Casper Et Le Trio Fantôme - Sony PlayStation 2/Ps2;8,99 EUR;+ 3,00 EUR de envío;desde Francia;
Casper y el trío fantasmal PLAYSTATION 2 juego PS2 PAL Completo con Manual;5,79 EUR;+ 16,38 EUR de envío estimado;desde Reino Unido;
Casper - PS1 Sans Notice VF PlayStation Sony;14,95 EUR;+ 10,00 EUR de envío;desde Francia;
Playstation 2 Casper Spirit Dimensions Ps2 CIB  Nice Condition OVP;17,90 EUR;+ 16,80 EUR de envío;desde Austria;
Casper espíritu dimensiones + y el trío fantasmal.. SONY PS2 PLAYSTATION 2 Juegos;9,26 EUR;+ 16,23 EUR de envío;desde Reino Unido;
Casper y el trío fantasmal PAL Playstation 2 Ps2 Juego + Caja Y Manual;3,47 EUR;+ 18,11 EUR de envío estimado;desde Reino Unido;
Playstation Casper y el trío fantasmal;8,10 EUR;+ 16,42 EUR de envío estimado;desde Reino Unido;
Casper PS1 PlayStation 1 COMPLETO PAL;10,42 EUR;+ 16,46 EUR de envío estimado;desde Reino Unido;
Playstation 1 - Casper Friends around the World - NO Manual INCLUDED;5,00 EUR;+ 11,00 EUR de envío;desde Países Bajos;
Casper en het Geestige Trio - Playstation 2 - PS2;4,21 EUR;+ 19,95 EUR de envío;desde Países Bajos;
Casper: Friends Around The World - PS1 Complet VF PlayStation Sony;19,95 EUR;+ 10,00 EUR de envío;desde Francia;
Casper (Sony Playstation 1/One) * en Caja & Probado *;8,68 EUR;+ 16,43 EUR de envío estimado;desde Reino Unido;
Nuevo anuncioCasper y el trío fantasmal (Sony PlayStation 2, 2007) - Versión Europea;5,22 EUR;+ 16,37 EUR de envío estimado;desde Reino Unido;
Casper amigos de todo el mundo. PS1 Juego. completo. PAL) (PlayStation One,;13,62 EUR;+ 7,48 EUR de envío;desde Reino Unido;
Casper espíritu dimensiones PS2 PlayStation 2 COMPLETO PAL;9,26 EUR;+ 12,17 EUR de envío;desde Irlanda;
Casper-Playstation (PS1);11,59 EUR;+ 18,61 EUR de envío estimado;desde Reino Unido;
Casper: Friends Around The World - PS1 Complet VF PlayStation Sony;13,60 EUR;+ 12,50 EUR de envío;desde Francia;
Casper - Playstation 1 - PS1;11,01 EUR;+ 19,95 EUR de envío;desde Países Bajos;
Casper and The Ghostly Trio - Playstation 2 - PS2;4,21 EUR;+ 19,95 EUR de envío;desde Países Bajos;
Casper y el trío fantasmal (Sony PlayStation 2, 2007) - Versión Europea;4,64 EUR;+ 16,36 EUR de envío estimado;desde Reino Unido;
Casper Friends Around The World - Playstation 1 - PS1 - Playstation 3 - PS3;7,95 EUR;+ 19,95 EUR de envío;desde Países Bajos;
Casper: Friends Around the World - Playstation 1 - PS1;6,76 EUR;+ 19,95 EUR de envío;desde Países Bajos;
Casper: Friends Around the World - Playstation 1 - PS1;6,76 EUR;+ 19,95 EUR de envío;desde Países Bajos;
PlayStation / PS1 Game: Casper Friends Around the World (NEW/SEALED);44,95 EUR;+ 25,00 EUR de envío;desde Países Bajos;
Casper: Spirit Dimensions - Playstation 2 - PS2;5,91 EUR;+ 19,95 EUR de envío;desde Países Bajos;
Casper's Scare School - Playstation 2 - PS2;14,41 EUR;+ 19,95 EUR de envío;desde Países Bajos;
Casper a hunting PS1 ita videogioco Sony PlayStation 1 funzionante pal Italian ;19,99 EUR;+ 18,00 EUR de envío;desde Italia;
Casper Spirit Dimensions - PlayStation 2 PS2 - PAL - Complet;8,90 EUR;+ 14,90 EUR de envío;desde Francia;
La Escuela de Miedos de Casper PS2 Play Station 2 Pal ESPAÑOL;19,95 EUR;+ 19,95 EUR de envío;desde España;
Caspers Scare School Sony PlayStation 2 PAL PS2 Video Juego;6,95 EUR;+ 18,70 EUR de envío estimado;desde Reino Unido;
