Double Dragon IV 4 Sony PlayStation 4 Ps4 2017 completa * Lrg LR-P63;55,59 EUR;Envío gratis;desde Estados Unidos;
Double Dragon IV-Completa PlayStation (arte alternativo) 4 juego PS4;51,40 EUR;Envío gratis;desde Estados Unidos;
Double Dragon IV Classic (Playstation 4 ps4) Vga 95 Mint Nuevo Sellado De Fábrica;428,31 EUR;desde Estados Unidos;
Double Dragon IV (Sony PlayStation 4, 2017) PS4 Lrg Limited Run Games Nuevo Sellado;57,39 EUR;+ 4,45 EUR de envío;desde Estados Unidos;
Double Dragon IV (PlayStation 4, 2018) Limited Run Sellado Nuevo PS4 Envío Gratuito;77,10 EUR;+ 3,51 EUR de envío;desde Estados Unidos;
Double Dragon IV 4 (Sony Playstation 4, PS4)! nuevo! Limited Run #104. Beat em up.;85,66 EUR;Envío gratis;desde Estados Unidos;
Double Dragon IV 4 Classic Edition Limited Run (Playstation 4 PS4 2018) Sellado;113,34 EUR;Envío gratis;desde Estados Unidos;
Double Dragon la leyenda continúa Poster-Nintendo Sega Playstation Mario Bros;34,26 EUR;+ 3,43 EUR de envío;desde Estados Unidos;
Nuevo anuncioPS1 PS PlayStation 1 Double Dragon Importado De Japón;110,40 EUR;Envío gratis;desde Estados Unidos;
Double Dragon IV Edición limitada ejecutar Juegos Clásicos Lrg PS4 Nueva Sellado;111,35 EUR;+ 8,56 EUR de envío;desde Estados Unidos;
Double Dragon IV (Sony PlayStation 4, 2017) Nueva!! Sellado! envío Gratis!;51,39 EUR;Envío gratis;desde Estados Unidos;
Double Dragon IV 4 Clásico Edición limitada ejecutar Playstation 4 PS4 Nuevo Sellado;76,99 EUR;+ 3,33 EUR de envío;desde Estados Unidos;
PS1 Double Dragon PlayStation 1;75,77 EUR;+ 3,43 EUR de envío;desde Japón;
PS4-Double Dragon 4 Edición Clásica [90+] Vga-Juegos Limited Run;197,02 EUR;desde Estados Unidos;
Double Dragon IV (Sony PlayStation 4, 2017) Limited Run Juegos, Nuevo, Sellado;77,09 EUR;Envío gratis;desde Estados Unidos;
Double Dragon IV 4 PlayStation 2017 PS4 Lrg Limited Run Juegos #104 - nueva Y-Fold;72,77 EUR;+ 2,53 EUR de envío;desde Estados Unidos;
Double Dragon IV (Sony PlayStation 4/PS4 juego) Limited Run Juegos Cartucho en Caja Con Tarjeta;59,96 EUR;+ 4,20 EUR de envío;desde Estados Unidos;
Double Dragon IV Sony PlayStation 4 PS4 LRG #104 Limited Run Games New Sealed;101,16 EUR;+ 6,74 EUR de envío;desde Canadá;
Double Dragon PS1 urbano Planta Sony Playstation 1 de Japón;95,40 EUR;+ 17,13 EUR de envío;desde Japón;
Double Dragon IV (Sony PlayStation 4, 2017);73,66 EUR;+ 2,62 EUR de envío;desde Estados Unidos;
Double Dragon IV Edición Clásica-Playstation 4-Limited Run Juegos #104;128,49 EUR;+ 12,71 EUR de envío;desde Estados Unidos;
Double Dragon Playstation PS importación Japón PSX;122,07 EUR;+ 15,42 EUR de envío;desde Japón;
Double Dragon PS1 urbano Planta Sony Playstation 1 de Japón;60,06 EUR;+ 12,42 EUR de envío;desde Japón;
Double Dragon IV 4 (Sony Playstation 4, PS4)! nuevo! Limited Run #104. Beat em up.;85,66 EUR;Envío gratis;desde Estados Unidos;
Usado PS1 PS PlayStation 1 Double Dragon 30018 Japón Importación;70,38 EUR;+ 3,60 EUR de envío;desde Japón;
Double Dragon PS1 Ps PLAYSTATION 1 urbano Japón planta Usado;348,21 EUR;+ 17,13 EUR de envío;desde Japón;
Super Nintendo * Super Double Dragon * SNES OVP instrucciones funda protectora cib NTSC-u/C;199,95 EUR;+ 6,70 EUR de envío;desde Alemania;
Super Nintendo * Battletoads & Double Dragon w/póster * SNES OVP centajes cib NTSC-u/C;249,95 EUR;+ 35,99 EUR de envío;desde Alemania;
Sega Mega Drive * Double Dragon 3: the Arcade Game * módulo;27,95 EUR;+ 6,70 EUR de envío;desde Alemania;
Double Dragon NES Nintendo Entertainment PAL FRA Suelto Cartucho sólo System;16,22 EUR;+ 19,99 EUR de envío estimado;desde Reino Unido;
NINTENDO NES-Double Dragon III (3) - En Caja Completa;57,97 EUR;+ 17,32 EUR de envío estimado;desde Reino Unido;
Return of Double Dragon Nintendo Super Famicom SFC Japan NTSC;141,00 EUR;+ 36,00 EUR de envío;desde Francia;
Nintendo Gameboy juego-Double Dragon 3-the Arcade Game-Embalaje original-Top-Pal;79,90 EUR;Envío no especificado;desde Alemania;
Double Dragon, Kung Fu, Tortugas Ninja Paquete. Genuino Gameboy. GB. juego Boy;52,18 EUR;+ 20,93 EUR de envío estimado;desde Reino Unido;
Nintendo Gameboy En Caja-Double Dragon 3 la Juego Arcade;57,92 EUR;+ 17,32 EUR de envío estimado;desde Reino Unido;
Nuevo anuncioDouble Dragon II (dos) 1991 NINTENDO GAME BOY JUEGO Y ESTUCHE en muy buena condición de trabajo Libre P&P;17,33 EUR;+ 16,59 EUR de envío estimado;desde Reino Unido;
Double Dragon II the Revenge 2 Nintendo Famicom FC Jap NTSC;136,00 EUR;+ 36,00 EUR de envío;desde Francia;
Battletoads and Double Dragon - Jeu Super Nintendo / SNES  Game Retro - PAL EUR ;36,50 EUR;Envío internacional gratis;desde Francia;
Nuevo anuncioDouble Dragon 2-NES Nintendo-solo carro;17,38 EUR;+ 18,71 EUR de envío estimado;desde Reino Unido;
Nes Nintendo-Double Dragon 2 The Revenge-pal-Top-en su embalaje original;129,90 EUR;Envío no especificado;desde Alemania;
