Sony PS1 Playstation - "Hot Shots Golf THE BEST" SONY JAPÓN con SPINE CARD;11,90 EUR;+ 17,90 EUR de envío;desde España;
Sony PS1 Playstation - Hot Shots Golf 2 THE BEST - VERSIÓN JAPÓN;12,90 EUR;+ 17,90 EUR de envío;desde España;
Hot Shots Golf Open Tee Playstation Portable Nuevo y sellado de fábrica;16,35 EUR;+ 11,09 EUR de envío;desde Eslovaquia;
Super Cool Hot Shots Golf Playstation Camiseta promocionales Raro Coleccionistas Talla XXL;58,38 EUR;+ 22,70 EUR de envío estimado;desde Reino Unido;
Hot Shots Golf Open Tee 2 Juego Psp;16,26 EUR;+ 16,68 EUR de envío estimado;desde Reino Unido;
Hot Shots Golf Abierta Camiseta 2 Psp Juego;17,47 EUR;Envío no especificado;desde Reino Unido;
Sony PS1 Playstation - Hot Shots Golf THE BEST - VERSIÓN JAPÓN;10,90 EUR;+ 17,90 EUR de envío;desde España;
Sony PS1 Playstation - Hot Shots Golf 2 THE BEST - VERSIÓN JAPÓN CON SPINE CARD;11,90 EUR;+ 17,90 EUR de envío;desde España;
Hot Shots Golf Sony PlayStation 1/PSX/PS1 Golf Juego Completo con Manual;8,58 EUR;+ 4,27 EUR de envío;desde Estados Unidos;
Hot Shots Golf PS1 (Sony PlayStation 1, 1998) Black Label;5,17 EUR;+ 4,53 EUR de envío;desde Estados Unidos;
Nuevo anuncioHot Shots Golf 3 grandes éxitos SONY PLAYSTATION 2 2003 Fábrica Sellada Nueva;6,90 EUR;Envío gratis;desde Estados Unidos;
Hot Shots Golf mundo derrotando Sony Playstation PS Vita Cartucho De Juego De * SOLAMENTE *;10,34 EUR;+ 3,84 EUR de envío;desde Estados Unidos;
Hot Shots Golf: World Invitational nuevo PlayStation Vita, 2012) Nueva Sellado;34,48 EUR;+ 3,44 EUR de envío;desde Estados Unidos;
Hot Shots Golf: fuera de límites (Sony PlayStation 3, 2008);12,85 EUR;Envío gratis;desde Estados Unidos;
Hot Shots Golf (Sony PlayStation 1, 1998) completo con caja manual de disco PS1;12,03 EUR;Envío gratis;desde Estados Unidos;
Hot Shots Golf: World Invitational (Sony PlayStation PS Vita, de 2012, Cartucho en Caja);19,40 EUR;+ 3,79 EUR de envío;desde Estados Unidos;
Hot Shots Golf: World Invitational (Sony PlayStation Vita, 2012);8,97 EUR;+ 4,10 EUR de envío;desde Estados Unidos;
Cartucho en Caja Hot Shots Golf: proa (Sony PlayStation 2 PS2, 2004) Completo Probado * *;8,61 EUR;Envío gratis;desde Estados Unidos;
Hot Shots Golf mundo derrotando-PlayStation PS Vita-Cartucho Completo En Caja;14,64 EUR;+ 3,43 EUR de envío;desde Estados Unidos;
Nuevo anuncioHot Shots Golf: proa (Sony PlayStation 2, 2004) completo de ~;7,67 EUR;Envío gratis;desde Estados Unidos;
2 en 1 Hot Shots Golf 3/Parappa, los rapero PlayStation 2 PS2 (SEARS Coleccionable);12,93 EUR;+ 4,44 EUR de envío;desde Estados Unidos;
Hot Shots Golf-Sony PlayStation 1-PS1-CIB con Manual-Probado-Envío Gratuito;15,51 EUR;Envío gratis;desde Estados Unidos;
Hot Shots Golf: proa (Sony PlayStation 2, 2003) Black Label Completo con Manual;4,30 EUR;+ 3,01 EUR de envío;desde Estados Unidos;
Hot Shots Golf 3 Greatest Hits (Sony PlayStation 2, 2003) Completo! probado!;8,61 EUR;Envío gratis;desde Estados Unidos;
Hot Shots Golf 3 PS2 Playstation 2 Juego Completo;3,42 EUR;+ 2,54 EUR de envío;desde Estados Unidos;
Hot Shots Golf disco y el caso y Hot Shots Golf 2 Cartucho en Caja PS1 Playstation;15,51 EUR;+ 4,30 EUR de envío;desde Estados Unidos;
Hot Shots Golf 1 y 2 (Playstation 1, 1999) Completo;34,45 EUR;Envío gratis;desde Estados Unidos;
Hot Shots Golf: World Invitational PSV PlayStation Vita Cartucho en Caja Con Insertos;16,85 EUR;Envío gratis;desde Estados Unidos;
Hot Shots Golf (Sony PlayStation 1, 1998) Black Label Completo;10,34 EUR;+ 2,59 EUR de envío;desde Estados Unidos;
Hot Shots Golf (Sony PlayStation 1, 1998) PS1 completo con manual y tarjeta de inscripción;10,34 EUR;+ 4,53 EUR de envío;desde Estados Unidos;
Hot Shots Golf: fuera de límites (Sony PlayStation 3, 2008) PS3 Completo con Manual;18,06 EUR;+ 2,16 EUR de envío;desde Estados Unidos;
Nuevo anuncioHot Shots Golf 3 (PlayStation 2) PS2 (sólo juego video juego);0,01 EUR2,16 EUR;+ 5,17 EUR de envío;desde Estados Unidos;
Hot Shots Golf 3/Parappa, los rapero 2 Demo Disc Sony Playstation 2;16,06 EUR;Envío gratis;desde Estados Unidos;
Hot Shots Golf 3 Sony PlayStation 2 PS2 Cartucho De Juego Completo En Caja Manual;6,03 EUR;Envío gratis;desde Estados Unidos;
Hot Shots Golf/velocidad punks Demo (Sony Playstation 1 ps1) Con Manga;8,54 EUR;Envío gratis;desde Estados Unidos;
Hot Shots Golf 3 Greatest Hits (Sony PlayStation 2, 2003) Con Manual;4,31 EUR;desde Estados Unidos;
Hot Shots Golf: proa (Sony PlayStation 2, PS2,) ** ** Solo Disco;5,17 EUR;+ 4,53 EUR de envío;desde Estados Unidos;
Hot Shots Golf 3 [GH] (Sony PlayStation 2 PS2) * Nueva-Sellado De Fábrica *;10,08 EUR;Envío gratis;desde Estados Unidos;
Hot Shots Golf 3 Greatest Hits (Sony PlayStation 2, 2003) Completo y Probado;7,75 EUR;Envío gratis;desde Estados Unidos;
Hot Shots Golf: proa (Sony PlayStation 2, 2004) * COMPLETO *;5,13 EUR;+ 2,50 EUR de envío;desde Estados Unidos;
Auténtico Original PS1 PLAYSTATION SONY Ent Juegos Hot Shots Golf 1 & 2;21,13 EUR;+ 5,78 EUR de envío;desde Estados Unidos;
Hot Shots Golf: World Invitational (Sony PlayStation Vita, Juego De 2012);11,18 EUR;Envío gratis;desde Estados Unidos;
Hot Shots Golf 2/velocidad punks doble Demo Disc Set-Sony Playstation 1 PS1;12,89 EUR;Envío gratis;desde Estados Unidos;
Hot Shots Golf: Fore + Hot Shots Tenis * LOTE * PLAYSTATION 2 * completo * PS2 4;11,20 EUR;+ 3,44 EUR de envío;desde Estados Unidos;
Hot Shots Golf 3 (PlayStation 2, 2003) Disco Solamente-Probado-Rápido Envío Gratis!;6,03 EUR;Envío gratis;desde Estados Unidos;
Hot Shots Golf: World Invitational (Sony PlayStation Vita, 2012);18,96 EUR;Envío gratis;desde Estados Unidos;
Hot Shots Golf: fuera de límites PS3 Sony PlayStation 3, 2008 disco solamente;12,92 EUR;Envío gratis;desde Estados Unidos;
Hot Shots Golf 3 (Sony PlayStation 2, PS2) Black Label;3,44 EUR;+ 3,24 EUR de envío;desde Estados Unidos;
Hot Shots Golf: Out of Bounds (Sony PlayStation 3, 2008);13,61 EUR;+ 4,76 EUR de envío;desde Canadá;
Hot Shots Golf: fuera de límites (PlayStation 3, 2008) COMPLETO FUNCIONA ~ probado y;17,23 EUR;Envío gratis;desde Estados Unidos;
Hot Shots Golf: World Invitational (Sony PlayStation Vita, 2012);17,24 EUR;Envío gratis;desde Estados Unidos;
Nuevo anuncioHot Shots Golf 3 PS2 Playstation 2 Juego Completo;2,15 EUR4,30 EUR;+ 4,44 EUR de envío;desde Estados Unidos;
Nuevo anuncioHot Shots Golf: proa (Sony PlayStation 2, 2003) Black Label Completo con Manual;2,15 EUR4,30 EUR;+ 4,44 EUR de envío;desde Estados Unidos;
Hot Shots Golf 2 (Sony PlayStation PS1) Disco Solamente;8,61 EUR;Envío gratis;desde Estados Unidos;
Hot Shots Golf 3 (Sony PlayStation 2, PS2) Funciona/disco solamente #1675;0,85 EUR;+ 2,75 EUR de envío;desde Estados Unidos;
Hot Shots Golf Open Tee 2 & Hot Shots tenis obtener un agarre PLAYSTATION PORTABLE PSP;4,30 EUR;+ 5,13 EUR de envío;desde Estados Unidos;
Hot Shots Golf fuera de límites Completa Con Manual Sony PS3 PlayStation 3;21,52 EUR;Envío gratis;desde Estados Unidos;
Hot Shots Golf 4 PS2 Tarjeta de memoria de 8MB (2004) totalmente nuevo y sellado de fábrica de Sony;70,04 EUR;+ 17,66 EUR de envío estimado;desde Reino Unido;
Hot Shots Golf: abrir Tee-para Sony PSP;8,74 EUR;+ 10,97 EUR de envío;desde Reino Unido;
Hot Shots Golf: abrir Tee (Sony PSP) disco solamente sin estuche;2,32 EUR;+ 18,21 EUR de envío estimado;desde Reino Unido;
Hot Shots Golf Open Tee PSP Manual Y Caja;5,24 EUR;+ 7,71 EUR de envío;desde Reino Unido;
Hot Shots Golf Open Tee 2/PSP-PSP.. - c1398c;22,03 EUR;+ 16,79 EUR de envío estimado;desde Reino Unido;
Sony PSP Hot Shots Golf  Open Tee complet   Vers. USA;9,90 EUR;Envío no especificado;desde Francia;
