Nuevo Sellado Advan Racing Playstation 1 PS1 Japón Importación estadounidense vendedor Atlus;103,54 EUR;Envío gratis;desde Estados Unidos;
Utiliza PS1 PS Playstation 1 Advan Racing 10233 Japón Importación;16,72 EUR;+ 3,62 EUR de envío;desde Japón;
Advan Racing CHASER Cover Playstation 1 jzx crown;40,51 EUR;+ 24,93 EUR de envío;desde Australia;
Advan Racing X 2 Pegatinas Calcomanías JDM S2000 DC5 DC2 EK9 EP3 FN2 FD2;5,81 EUR;+ 1,75 EUR de envío;desde Reino Unido;
Super Advan Racing SA3R guerras Slap Pegatina JDM Yokohama Starwars;6,40 EUR;+ 16,45 EUR de envío estimado;desde Reino Unido;
4x Advan Racing RG-D, Premium Rueda Calcomanías Pegatinas, Jdm Deriva,;9,30 EUR;+ 3,49 EUR de envío;desde Reino Unido;
4x Advan Racing Rs, Premium Rueda Calcomanías Pegatinas, Jdm Deriva,;9,30 EUR;+ 3,49 EUR de envío;desde Reino Unido;
4x Advan Racing RG-2, RG-II Premium Rueda Calcomanías Pegatinas, Jdm Deriva,;9,30 EUR;+ 3,49 EUR de envío;desde Reino Unido;
