NBA Jam Extreme Jeu Playstation PS1 Complet PAL EUR;14,90 EUR;+ 15,00 EUR de envío;desde Francia;
NBA Jam Extreme Sony Playstation 1 PS1 FR;20,00 EUR;Envío no especificado;desde Francia;
NBA Jam Extreme PlayStation 1 PS1 Complete - NTSC U/C;13,57 EUR;+ 4,46 EUR de envío;desde Canadá;
NBA Jam Extreme - Sony PlayStation 1 | AUS PAL;21,90 EUR;+ 15,65 EUR de envío;desde Australia;
Playstation 1 NBA Jam Extreme PS1 Game PAL 1996 Basketball;12,51 EUR;+ 15,02 EUR de envío;desde Australia;
PS1 NBA Jam Extreme Sony PLAYSTATION Un Jeu;22,12 EUR;Envío internacional gratis;desde Reino Unido;
NBA Jam Extreme (Sony PlayStation 1) PS1 Disc Only - Basketball Sports Game;4,06 EUR;+ 10,18 EUR de envío;desde Canadá;
Sega Saturn juego NBA Jam Extreme con embalaje original y guía;19,90 EUR;+ 8,99 EUR de envío;desde Alemania;
1996 juego arcade NBA Jam Extreme PS1 Sega Saturn Vintage Anuncio Cartel Promo enmarcado;35,01 EUR;+ 15,17 EUR de envío;desde Alemania;
Sega Saturn-NBA Jam Extreme (completo);23,99 EUR;+ 6,50 EUR de envío;desde Alemania;
