No One Can Stop Mr. Domino ‼️BRAND NEW, SEALED‼️ (Sony PlayStation 1 PS1) RARE;102,03 EUR;+ 23,12 EUR de envío;desde Canadá;
No One Can Stop Mr. Domino (Sony PlayStation 1, 1998);23,80 EUR;+ 14,03 EUR de envío;desde Canadá;
Mr. Domino Playstation 1 print ad Poster sólo 7.75x10.50;12,89 EUR;Envío gratis;desde Estados Unidos;
No One Can Stop Mr. Domino (Sony PlayStation 1, 1998);17,01 EUR;+ 13,61 EUR de envío;desde Canadá;
No One Can Stop Mr. Domino Sony PlayStation 1 PSX 1998 Fast Shipping;30,61 EUR;+ 5,44 EUR de envío;desde Canadá;
1998 Mr. Domino video juego de Playstation print ad I el 5 etapas de adicción Raro;12,06 EUR;Envío gratis;desde Estados Unidos;
