Final Doom SONY PLAYSTATION 1 PS1 PS2 juego PAL oficiales del Reino Unido;29,07 EUR;+ 16,86 EUR de envío estimado;desde Reino Unido;
Final Doom ps1 PlayStation 1 PSX cib PAL de alemán;59,90 EUR;+ 10,00 EUR de envío;desde Alemania;
Final Doom Playstation 1 PS1-disco solamente;17,39 EUR;+ 16,65 EUR de envío estimado;desde Reino Unido;
Final Doom-PS1 Sony/PlayStation 1 (con manual);32,56 EUR;+ 16,92 EUR de envío estimado;desde Reino Unido;
Final Doom Sony Playstation 1 juego PS1;34,89 EUR;+ 20,94 EUR de envío;desde Reino Unido;
Final Doom Manual Sony Playstation SLES - 00487;9,27 EUR;+ 16,50 EUR de envío estimado;desde Reino Unido;
Final Doom PlayStation 1 Videojuegos Retro;28,95 EUR;Envío no especificado;desde España;
Final Doom (Sony PlayStation 1 PS1) Auténtico completa Completo en Caja Reg tarjeta probado Negro;45,72 EUR;Envío gratis;desde Estados Unidos;
Final Doom (Sony PlayStation 1, 1995) Completo En Caja Probado PS1 Completa;36,24 EUR;+ 2,75 EUR de envío;desde Estados Unidos;
Final Doom (Sony PlayStation 1 PS1) Auténtico-completa CIB-reg tarjeta probado;73,34 EUR;+ 5,18 EUR de envío;desde Estados Unidos;
Final Doom PS1/PSX PlayStation 1 Black Label Muy Bueno! sólo un propietario! funciona!;38,83 EUR;Envío gratis;desde Estados Unidos;
Final Doom (Sony PlayStation 1, 1995) PS1 completa Completo en Caja Con Manual;50,90 EUR;Envío gratis;desde Estados Unidos;
Final Doom (Sony PlayStation 1) PS1 disco solamente;22,33 EUR;+ 2,58 EUR de envío;desde Estados Unidos;
Final Doom (Sony PlayStation 1, 1996) Completo en Caja Black Label PS1 completa ID Software;51,76 EUR;Envío gratis;desde Estados Unidos;
Final Doom-Sony PlayStation 1 PS1 Cartucho Completo en Caja con Manual envío rápido El vendedor;51,64 EUR;Envío gratis;desde Estados Unidos;
Final Doom (PlayStation 1 PS1 1996), Sellado De Fábrica! -! Raro!;271,79 EUR;Envío gratis;desde Estados Unidos;
Final Doom PLAYSTATION 1 PS1 piezas 1997 Promo anuncio Cartel de impresión de arte ID Software;12,04 EUR;Envío gratis;desde Estados Unidos;
Final Doom (Sony Playstation, 1999 PS1) -Complete;53,12 EUR;+ 4,09 EUR de envío;desde Canadá;
Final Doom Sony PlayStation 1 PS1 auténtico completa Completo en Caja-Tarjeta Reg-probado PSX;60,39 EUR;+ 4,31 EUR de envío;desde Estados Unidos;
Final Doom (Sony Playstation 1 ps1) Nuevo Sellado De Fábrica Vga 85+ Como Nuevo;603,99 EUR;Envío gratis;desde Estados Unidos;
Final Doom (Sony PlayStation 1, 1995) PS1 disco de juego y manual Auténtico;38,82 EUR;Envío gratis;desde Estados Unidos;
Final Doom and Reloaded the hardcore sequel PlayStation 1 PS1 PSX;64,70 EUR;+ 10,22 EUR de envío;desde Canadá;
Final Doom (Sony PlayStation 1 PS1) Auténtico-completa CIB-reg tarjeta probado;39,68 EUR;+ 4,49 EUR de envío;desde Estados Unidos;
Nuevo anuncioFinal Doom PlayStation PS1 completo juego de Cartucho en Caja Caso Manual;41,42 EUR;+ 1,73 EUR de envío;desde Estados Unidos;
Final Doom Sony PlayStation PS1 (disco solamente) Black Label;28,47 EUR;Envío gratis;desde Estados Unidos;
Final Doom (Sony Playstation 1) PS1 Solo Manual Envío Gratuito;12,93 EUR;Envío gratis;desde Estados Unidos;
Final Doom PS1 Playstation para 2533 p1 JP System;51,77 EUR;+ 14,67 EUR de envío;desde Japón;
Final Doom Sony PlayStation PS1 1996 Auténtico Original Juego de fabricante de equipos originales-Vendedor de EE. UU.;31,88 EUR;+ 4,27 EUR de envío;desde Estados Unidos;
Final Doom Sony PlayStation PS1 (disco solamente) Black Label Probado Funciona;34,51 EUR;+ 3,67 EUR de envío;desde Estados Unidos;
Final Doom-PS1 PS2 Playstation Game;38,41 EUR;+ 2,55 EUR de envío;desde Estados Unidos;
Final Doom (Sony PlayStation 1, 1996) PS1 Completa Black Label;51,76 EUR;Envío gratis;desde Estados Unidos;
Final Doom Sony Playstation Japan PS1 Midway ID Softbank;38,83 EUR;+ 8,63 EUR de envío;desde Japón;
Final Doom Sony PlayStation PS1 (disco solamente) Black Label Probado Funciona;34,47 EUR;+ 3,41 EUR de envío;desde Estados Unidos;
Final Doom-PlayStation 1 PS1 PS2 2 * probado y funciona muy bien **;41,37 EUR;+ 4,92 EUR de envío;desde Estados Unidos;
Final Doom Playstation Williams Entertainment 1996;68,17 EUR;+ 4,31 EUR de envío;desde Estados Unidos;
Final Doom Sony PlayStation PS1 (disco solamente) Black Label;34,51 EUR;Envío gratis;desde Estados Unidos;
Final Doom (Sony PlayStation 1, 1996) PS1 Complete Black Label damaged manual;51,08 EUR;+ 12,72 EUR de envío;desde Canadá;
Final Doom Sony PlayStation PS1 (disco solamente) Black Label Probado Funciona;34,51 EUR;+ 3,27 EUR de envío;desde Estados Unidos;
Final Doom-PLAYSTATION 1;25,89 EUR;+ 6,99 EUR de envío;desde Estados Unidos;
Final Doom Playstation 1 PS1 Cartucho Completo En Caja;64,67 EUR;+ 4,14 EUR de envío;desde Estados Unidos;
Final Doom PlayStation One Black Label Completo Original PS1 Juego;51,75 EUR;Envío gratis;desde Estados Unidos;
Final Doom-Playstation 1 juego probado y funciona;43,14 EUR;+ 2,75 EUR de envío;desde Estados Unidos;
Final Doom;51,48 EUR;Envío gratis;desde Estados Unidos;
Final Doom PlayStation PS1 completo juego de Cartucho en Caja Caso Manual;47,46 EUR;+ 4,49 EUR de envío;desde Estados Unidos;
Final Doom PS1 juego Banco Sony PlayStation 1 de Japón;26,79 EUR;+ 12,51 EUR de envío;desde Japón;
Final Doom;48,16 EUR;Envío gratis;desde Estados Unidos;
Final Doom PLAYSTATION Psx Schlüsselanhänger Keyring;2,17 EUR;+ 2,50 EUR de envío;desde España;
Final Doom PLAYSTATION PSX KEYRING;2,16 EUR;+ 2,49 EUR de envío;desde España;
Final Doom PLAYSTATION Psx Untersetzer Holz Wooden Coasters;4,90 EUR;+ 2,50 EUR de envío;desde España;
Nuevo anuncioFinal Doom W98 Original Caja Grande Juego de PC en muy buena condición;110,47 EUR;+ 29,09 EUR de envío;desde Reino Unido;
Final Doom PC Caja Grande;139,61 EUR;+ 17,22 EUR de envío;desde Reino Unido;
