Nuevo anuncioPlayStation 1 Ps1 Monster Rancher Completo Raro.;64,20 EUR;+ 23,35 EUR de envío;desde Reino Unido;
Monster Rancher para SONY PLAYSTATION 1 PS1 Raro Y Completo por Tecmo;87,55 EUR;+ 19,84 EUR de envío;desde Reino Unido;
Monster Rancher-PlayStation 1 Promo;57,21 EUR;Envío internacional gratis;desde Islandia;
Monster Rancher. PS1 Juego. completa (PlayStation One, PS2, PS3. PAL);109,69 EUR;+ 14,89 EUR de envío;desde Reino Unido;
Monster Rancher Juego Para Sony PlayStation 1 Promo formato de promoción de promoción;57,56 EUR;+ 19,85 EUR de envío;desde Reino Unido;
Sony Playstation 1 Ps1 Monster Rancher;87,55 EUR;+ 22,68 EUR de envío estimado;desde Reino Unido;
Monster Rancher Muy Raro Cartel De Doble Cara 50x33cm Playstation 1 PS2 Game Boy Advance Game Boy Color;34,48 EUR;+ 11,20 EUR de envío;desde Alemania;
Vintage Monster Rancher Sony PlayStation Collectible Coffee Mug TCDT;17,45 EUR;+ 23,50 EUR de envío;desde Bélgica;
Monster Rancher Sony Playstation 1 ps1 Nuevo Precintado PAL Versión Italiana;233,49 EUR;+ 7,01 EUR de envío;desde Reino Unido;
Monster Rancher Sony Playstation 1 ps1 pal;106,83 EUR;+ 1,18 EUR de envío;desde Reino Unido;
Monster Rancher Sony Playstation 1 ps1 PAL;93,39 EUR;+ 7,01 EUR de envío;desde Reino Unido;
Monster Rancher 2 (Sony PlayStation | PS1) Completo en Caja Completo En Caja;59,50 EUR;Envío gratis;desde Estados Unidos;
Monster Rancher 4 Sony PlayStation 2 PS2 Cartucho en Caja DVD, CAJA, MANUAL, ILUSTRACIONES Completa;85,37 EUR;Envío gratis;desde Estados Unidos;
Monster Rancher 2 Sony Playstation 1 disco solamente probado Funcionando PS1 muy limpio!!!;47,38 EUR;Envío gratis;desde Estados Unidos;
Monster Rancher (Sony PlayStation 1) Raro PS1 tarjeta de registro completo W;73,30 EUR;+ 4,40 EUR de envío;desde Estados Unidos;
Monster Rancher Evo (Sony PlayStation 2, 2006) En Buen Estado, Sin Manual-Raro;42,25 EUR;Envío gratis;desde Estados Unidos;
Nuevo anuncioMonster Rancher 3 (Sony PlayStation 2, 2001);34,49 EUR;+ 4,44 EUR de envío;desde Estados Unidos;
Monster Rancher tarjeta de batalla: episodio II PS1 completa Playstation;14,65 EUR;+ 4,74 EUR de envío;desde Estados Unidos;
Nuevo anuncioTarjeta de batalla Monster Rancher 2 Playstation PS1 Video Juego Nuevo Sellado;55,19 EUR;Envío gratis;desde Estados Unidos;
Monster Rancher 3 (Sony PlayStation 2 PS2, probado 2001) Envío Rápido!!!;38,80 EUR;Envío gratis;desde Estados Unidos;
Monster Rancher 3 PS2 (Sony PlayStation 2, 2001) Completo con Manual;38,76 EUR;Envío gratis;desde Estados Unidos;
Monster Rancher 4 Sony Playstation 2 PS2 Nueva Sellado de fábrica;1.293,49 EUR;Envío gratis;desde Estados Unidos;
Monster Rancher PS1 (Playstation 1) (Completo en Caja) (envío gratuito);64,67 EUR;Envío gratis;desde Estados Unidos;
Monster Rancher 2 PS1 Black Label Con Manual probado (Sony PlayStation 1, 1999);67,26 EUR;+ 7,93 EUR de envío;desde Estados Unidos;
Sony PlayStation 1 PS1 disco solamente probado Monster Rancher 1997;51,73 EUR;Envío gratis;desde Estados Unidos;
Monster Rancher (Sony PlayStation 1, 1997) listo para enviar;53,46 EUR;+ 4,48 EUR de envío;desde Estados Unidos;
Monster Rancher Sony PlayStation 1 PS1 Cartucho Completo en Caja Con Tarjeta;52,59 EUR;+ 3,45 EUR de envío;desde Estados Unidos;
Monster Rancher 4 (Sony PlayStation 2, 2003) PS2 Cartucho en Caja con Manual Raro Juego Funciona;103,48 EUR;Envío gratis;desde Estados Unidos;
Monster Rancher 2-PlayStation/PSOne/PS1 Cartucho en Caja, Probado Funciona, Ligeramente Usado;68,99 EUR;Envío gratis;desde Estados Unidos;
Monster Rancher (Sony PlayStation 1, 1997);64,67 EUR;+ 5,17 EUR de envío;desde Estados Unidos;
Monster Rancher Evo Promo Trading Card Set 2006 Playstation PS2 bonus pre-order;25,86 EUR;+ 4,30 EUR de envío;desde Estados Unidos;
Monster Rancher Evo (PlayStation 2 PS2 2006), Sellado De Fábrica! -! Raro!;217,30 EUR;Envío gratis;desde Estados Unidos;
Monster Rancher 2 100% auténticas disco de juego solamente Sony PlayStation 1 PS1 PS2 PS3;60,10 EUR;Envío gratis;desde Estados Unidos;
Monster Rancher 3 (Sony PlayStation 2, 2001);51,74 EUR;+ 4,48 EUR de envío;desde Estados Unidos;
Monster Rancher 4 (Sony PlayStation 2, 2003) Raro PS2 juego probado en muy buena condición;120,72 EUR;+ 3,83 EUR de envío;desde Estados Unidos;
